Sheet: Data
A1: Shiller, R., U.S.Stock Price Data, Annual, with consumption, both short and long rates, and present value calculations.
A2: An Update of Data shown in Chapter 26 of Market Volatility, R. Shiller, MIT Press, 1989, and Irrational Exuberance, Princeton 2015. | U2: CAPE
B3: P | C3: D | D3: E | E3: R | F3: RLONG | G3: CPI | H3: RealR | I3: C | K3: RealP | L3: P* | M3: P*r | N3: P*C | O3: RealD | P3: Return | Q3: ln(1+ret) | R3: RealE | S3: P/E | T3: E10 | U3: P/E10
B4: S&P | C4: Dividends | D4: Earnings | E4: One-Year | F4: Long | G4: Consumer | H4: Real | I4: Real Per | K4: RealP | L4: Present | M4: Present | N4: Present | O4: RealD | P4: on | R4: RealE | S4: Price | T4: Ten-Year | U4: Price
B5: Composite | C5: Accruing | D5: Accruing | E5: Interest | F5: Government | G5: Price | H5: One-Year | I5: Capita | K5: Stock | L5: Value | M5: Value | N5: Value | O5: S&P | P5: S&P | R5: Earnings | S5: Earnings | T5: Average | U5: Earnings
B6: Stock | C6: to | D6: to | E6: Rate | F6: Bond | G6: Index | H6: Interest | I6: Consumption | K6: Price | L6: of Real | M6: of Real | N6: of Real | O6: Dividend | P6: Composite | S6: Ratio | T6: of | U6: Ratio
B7: Price | C7: Index | D7: Index | F7: Yield | H7: Rate | I7: (See | L7: Dividends | M7: Dividends | N7: Dividends | S7: One-Year | T7: Real | U7: Ten-Year
B8: Index | F8: 10yrpost53 | I8: Consumption | L8: Const r | M8: Market r | N8: Cons disc. | S8: Earnings | T8: Earnings | U8: Earnings
A9: 1871 | B9: 4.44 | C9: 0.26 | D9: 0.4 | E9: 6.35 | F9: 5.32 | G9: 12.464061 | H9: of:=(1+[.E9]/100)*[.G9]/[.G10] -> 1.04750420830175 | I9: Tab) | J9: of:=1871 -> 1871 | K9: of:=[.B9]*[.$G$151]/[.G9] -> 82.0313058480699 | L9: of:=[.O9]+[.L10]/(1+[$Calculations.$E$3]) -> 112.018599504994 | M9: of:=[.O9]+[.M10]/([.H9]+[$Calculations.$E$3]-[$Calculations.$E$1]+1) -> 63.6503738431381 | O9: of:=[.C9]*[.$G$151]/[.G10] -> 4.73138496104752 | P9: of:=([.K10]-[.K9]+[.O9])/[.K9] -> 0.135808914663245 | Q9: of:=LN(1+[.P9]) -> 0.127345097227052 | R9: of:=[.D9]*[.$G$151]/[.G10] -> 7.27905378622695
A10: 1872 | B10: 4.86 | C10: 0.3 | D10: 0.43 | E10: 7.81 | F10: 5.36 | G10: 12.654392 | H10: of:=(1+[.E10]/100)*[.G10]/[.G11] -> 1.05432020857807 | I10: in 2005 | J10: of:=[.J9]+1 -> 1872 | K10: of:=[.B10]*[.$G$151]/[.G10] -> 88.4405035026574 | L10: of:=[.O10]+[.L11]/(1+[$Calculations.$E$3]) -> 114.293957520461 | M10: of:=[.O10]+[.M11]/([.H10]+[$Calculations.$E$3]-[$Calculations.$E$1]+1) -> 63.9620442377762 | O10: of:=[.C10]*[.$G$151]/[.G11] -> 5.33887406512323 | P10: of:=([.K11]-[.K10]+[.O10])/[.K10] -> 0.0886154174615551 | Q10: of:=LN(1+[.P10]) -> 0.0849066295683761 | R10: of:=[.D10]*[.$G$151]/[.G11] -> 7.65238616000996 | S10: of:=[.K10]/[.R9] -> 12.15
A11: 1873 | B11: 5.11 | C11: 0.33 | D11: 0.46 | E11: 8.35 | F11: 5.58 | G11: 12.939807 | H11: of:=(1+[.E11]/100)*[.G11]/[.G12] -> 1.1335110978781 | I11: dollars | J11: of:=[.J10]+1 -> 1873 | K11: of:=[.B11]*[.$G$151]/[.G11] -> 90.9388215759323 | L11: of:=[.O11]+[.L12]/(1+[$Calculations.$E$3]) -> 116.070752074394 | M11: of:=[.O11]+[.M12]/([.H11]+[$Calculations.$E$3]-[$Calculations.$E$1]+1) -> 64.0404810498872 | O11: of:=[.C11]*[.$G$151]/[.G12] -> 6.14383045988906 | P11: of:=([.K12]-[.K11]+[.O11])/[.K11] -> 0.0215897018543955 | Q11: of:=LN(1+[.P11]) -> 0.0213599452766097 | R11: of:=[.D11]*[.$G$151]/[.G12] -> 8.56412730772415 | S11: of:=[.K11]/[.R10] -> 11.8837209302326
A12: 1874 | B12: 4.66 | C12: 0.33 | D12: 0.46 | E12: 6.86 | F12: 5.47 | G12: 12.368896 | H12: of:=(1+[.E12]/100)*[.G12]/[.G13] -> 1.14807634363276 | J12: of:=[.J11]+1 -> 1874 | K12: of:=[.B12]*[.$G$151]/[.G12] -> 86.7583331608577 | L12: of:=[.O12]+[.L13]/(1+[$Calculations.$E$3]) -> 117.106059307905 | M12: of:=[.O12]+[.M13]/([.H12]+[$Calculations.$E$3]-[$Calculations.$E$1]+1) -> 67.831711737775 | O12: of:=[.C12]*[.$G$151]/[.G13] -> 6.60077335793468 | P12: of:=([.K13]-[.K12]+[.O12])/[.K12] -> 0.122790276614688 | Q12: of:=LN(1+[.P12]) -> 0.115816905523925 | R12: of:=[.D12]*[.$G$151]/[.G13] -> 9.20107801409076 | S12: of:=[.K12]/[.R11] -> 10.1304347826087
A13: 1875 | B13: 4.54 | C13: 0.3 | D13: 0.36 | E13: 4.96 | F13: 5.07 | G13: 11.512651 | H13: of:=(1+[.E13]/100)*[.G13]/[.G14] -> 1.1140547582624 | J13: of:=[.J12]+1 -> 1875 | K13: of:=[.B13]*[.$G$151]/[.G13] -> 90.810639530374 | L13: of:=[.O13]+[.L14]/(1+[$Calculations.$E$3]) -> 117.722195620792 | M13: of:=[.O13]+[.M14]/([.H13]+[$Calculations.$E$3]-[$Calculations.$E$1]+1) -> 72.6300067419008 | O13: of:=[.C13]*[.$G$151]/[.G14] -> 6.36919949384944 | P13: of:=([.K14]-[.K13]+[.O13])/[.K13] -> 0.11284278830136 | Q13: of:=LN(1+[.P13]) -> 0.106917811913539 | R13: of:=[.D13]*[.$G$151]/[.G14] -> 7.64303939261933 | S13: of:=[.K13]/[.R12] -> 9.8695652173913
A14: 1876 | B14: 4.46 | C14: 0.3 | D14: 0.28 | E14: 5.33 | F14: 4.59 | G14: 10.846575 | H14: of:=(1+[.E14]/100)*[.G14]/[.G15] -> 1.04413899868759 | J14: of:=[.J13]+1 -> 1876 | K14: of:=[.B14]*[.$G$151]/[.G14] -> 94.6887658085617 | L14: of:=[.O14]+[.L15]/(1+[$Calculations.$E$3]) -> 118.625268287637 | M14: of:=[.O14]+[.M15]/([.H14]+[$Calculations.$E$3]-[$Calculations.$E$1]+1) -> 76.341964317951 | O14: of:=[.C14]*[.$G$151]/[.G15] -> 6.31380383741526 | P14: of:=([.K15]-[.K14]+[.O14])/[.K14] -> -0.144279170238137 | Q14: of:=LN(1+[.P14]) -> -0.155811089489244 | R14: of:=[.D14]*[.$G$151]/[.G15] -> 5.89288358158757 | S14: of:=[.K14]/[.R13] -> 12.3888888888889
A15: 1877 | B15: 3.55 | C15: 0.19 | D15: 0.3 | E15: 5.03 | F15: 4.45 | G15: 10.94174 | H15: of:=(1+[.E15]/100)*[.G15]/[.G16] -> 1.24520514954818 | J15: of:=[.J14]+1 -> 1877 | K15: of:=[.B15]*[.$G$151]/[.G15] -> 74.7133454094139 | L15: of:=[.O15]+[.L16]/(1+[$Calculations.$E$3]) -> 119.646332524333 | M15: of:=[.O15]+[.M16]/([.H15]+[$Calculations.$E$3]-[$Calculations.$E$1]+1) -> 75.7864241631999 | O15: of:=[.C15]*[.$G$151]/[.G16] -> 4.7407927887316 | P15: of:=([.K16]-[.K15]+[.O15])/[.K15] -> 0.14883493098437 | Q15: of:=LN(1+[.P15]) -> 0.138748325347091 | R15: of:=[.D15]*[.$G$151]/[.G16] -> 7.48546229799727 | S15: of:=[.K15]/[.R14] -> 12.6785714285714
A16: 1878 | B16: 3.25 | C16: 0.18 | D16: 0.31 | E16: 4.9 | F16: 4.34 | G16: 9.2290893 | H16: of:=(1+[.E16]/100)*[.G16]/[.G17] -> 1.16956870698047 | J16: of:=[.J15]+1 -> 1878 | K16: of:=[.B16]*[.$G$151]/[.G16] -> 81.0925082283037 | L16: of:=[.O16]+[.L17]/(1+[$Calculations.$E$3]) -> 122.409822393394 | M16: of:=[.O16]+[.M17]/([.H16]+[$Calculations.$E$3]-[$Calculations.$E$1]+1) -> 91.1724311168613 | O16: of:=[.C16]*[.$G$151]/[.G17] -> 5.00749044481586 | P16: of:=([.K17]-[.K16]+[.O16])/[.K16] -> 0.289896117400181 | Q16: of:=LN(1+[.P16]) -> 0.254561685983788 | R16: of:=[.D16]*[.$G$151]/[.G17] -> 8.62401132162731 | S16: of:=[.K16]/[.R15] -> 10.8333333333333
A17: 1879 | B17: 3.58 | C17: 0.2 | D17: 0.38 | E17: 4.25 | F17: 4.22 | G17: 8.2776793 | H17: of:=(1+[.E17]/100)*[.G17]/[.G18] -> 0.863783293642955 | J17: of:=[.J16]+1 -> 1879 | K17: of:=[.B17]*[.$G$151]/[.G17] -> 99.5934210691154 | L17: of:=[.O17]+[.L18]/(1+[$Calculations.$E$3]) -> 125.06967580035 | M17: of:=[.O17]+[.M18]/([.H17]+[$Calculations.$E$3]-[$Calculations.$E$1]+1) -> 104.057740148331 | O17: of:=[.C17]*[.$G$151]/[.G18] -> 4.61005764914326 | P17: of:=([.K18]-[.K17]+[.O17])/[.K17] -> 0.228967026846212 | Q17: of:=LN(1+[.P17]) -> 0.206174000969481 | R17: of:=[.D17]*[.$G$151]/[.G18] -> 8.7591095333722 | S17: of:=[.K17]/[.R16] -> 11.5483870967742
A18: 1880 | B18: 5.11 | C18: 0.26 | D18: 0.49 | E18: 5.1 | F18: 4.02 | G18: 9.9903306 | H18: of:=(1+[.E18]/100)*[.G18]/[.G19] -> 1.11470108388205 | J18: of:=[.J17]+1 -> 1880 | K18: of:=[.B18]*[.$G$151]/[.G18] -> 117.78697293561 | L18: of:=[.O18]+[.L19]/(1+[$Calculations.$E$3]) -> 128.326628092908 | M18: of:=[.O18]+[.M19]/([.H18]+[$Calculations.$E$3]-[$Calculations.$E$1]+1) -> 89.6890927480191 | O18: of:=[.C18]*[.$G$151]/[.G19] -> 6.35631506730383 | P18: of:=([.K19]-[.K18]+[.O18])/[.K18] -> 0.338734704444969 | Q18: of:=LN(1+[.P18]) -> 0.291724917463362 | R18: of:=[.D18]*[.$G$151]/[.G19] -> 11.9792091653034 | S18: of:=[.K18]/[.R17] -> 13.4473684210526 | T18: of:=AVERAGE([.R9:.R18]) -> 8.30803605605589
A19: 1881 | B19: 6.19 | C19: 0.32 | D19: 0.44 | E19: 4.79 | F19: 3.7 | G19: 9.4194198 | H19: of:=(1+[.E19]/100)*[.G19]/[.G20] -> 0.969552816089064 | J19: of:=[.J18]+1 -> 1881 | K19: of:=[.B19]*[.$G$151]/[.G19] -> 151.329193333118 | L19: of:=[.O19]+[.L20]/(1+[$Calculations.$E$3]) -> 129.93598384452 | M19: of:=[.O19]+[.M20]/([.H19]+[$Calculations.$E$3]-[$Calculations.$E$1]+1) -> 96.0651857243447 | O19: of:=[.C19]*[.$G$151]/[.G20] -> 7.23825165167407 | P19: of:=([.K20]-[.K19]+[.O19])/[.K19] -> -0.0672922778558491 | Q19: of:=LN(1+[.P19]) -> -0.0696633939395906 | R19: of:=[.D19]*[.$G$151]/[.G20] -> 9.95259602105184 | S19: of:=[.K19]/[.R18] -> 12.6326530612245 | T19: of:=AVERAGE([.R10:.R19]) -> 8.57539027953838 | U19: of:=[.K19]/[.T18] -> 18.2147973735395
A20: 1882 | B20: 5.92 | C20: 0.32 | D20: 0.43 | E20: 5.26 | F20: 3.62 | G20: 10.18058 | H20: of:=(1+[.E20]/100)*[.G20]/[.G21] -> 1.07264503418936 | J20: of:=[.J19]+1 -> 1882 | K20: of:=[.B20]*[.$G$151]/[.G20] -> 133.90765555597 | L20: of:=[.O20]+[.L21]/(1+[$Calculations.$E$3]) -> 130.710909503217 | M20: of:=[.O20]+[.M21]/([.H20]+[$Calculations.$E$3]-[$Calculations.$E$1]+1) -> 89.5057181920675 | O20: of:=[.C20]*[.$G$151]/[.G21] -> 7.37609223862922 | P20: of:=([.K21]-[.K20]+[.O20])/[.K20] -> 0.0551918511274482 | Q20: of:=LN(1+[.P20]) -> 0.0537225998053337 | R20: of:=[.D20]*[.$G$151]/[.G21] -> 9.91162394565801 | S20: of:=[.K20]/[.R19] -> 13.4545454545455 | T20: of:=AVERAGE([.R11:.R20]) -> 8.80131405810318 | U20: of:=[.K20]/[.T19] -> 15.6153424148503
A21: 1883 | B21: 5.81 | C21: 0.33 | D21: 0.4 | E21: 5.35 | F21: 3.63 | G21: 9.9903306 | H21: of:=(1+[.E21]/100)*[.G21]/[.G22] -> 1.14039564955775 | J21: of:=[.J20]+1 -> 1883 | K21: of:=[.B21]*[.$G$151]/[.G21] -> 133.922174707612 | L21: of:=[.O21]+[.L22]/(1+[$Calculations.$E$3]) -> 131.38960150241 | M21: of:=[.O21]+[.M22]/([.H21]+[$Calculations.$E$3]-[$Calculations.$E$1]+1) -> 91.2241569162233 | O21: of:=[.C21]*[.$G$151]/[.G22] -> 8.234008527797 | P21: of:=([.K22]-[.K21]+[.O21])/[.K21] -> 0.0265886973040793 | Q21: of:=LN(1+[.P21]) -> 0.0262413612491294 | R21: of:=[.D21]*[.$G$151]/[.G22] -> 9.98061639732969 | S21: of:=[.K21]/[.R20] -> 13.5116279069767 | T21: of:=AVERAGE([.R12:.R21]) -> 8.94296296706374 | U21: of:=[.K21]/[.T20] -> 15.2161567947132
A22: 1884 | B22: 5.18 | C22: 0.31 | D22: 0.31 | E22: 5.65 | F22: 3.62 | G22: 9.2290893 | H22: of:=(1+[.E22]/100)*[.G22]/[.G23] -> 1.1779307330075 | J22: of:=[.J21]+1 -> 1884 | K22: of:=[.B22]*[.$G$151]/[.G22] -> 129.24898234542 | L22: of:=[.O22]+[.L23]/(1+[$Calculations.$E$3]) -> 131.19867238311 | M22: of:=[.O22]+[.M23]/([.H22]+[$Calculations.$E$3]-[$Calculations.$E$1]+1) -> 97.8026019497103 | O22: of:=[.C22]*[.$G$151]/[.G23] -> 8.62401132162731 | P22: of:=([.K23]-[.K22]+[.O22])/[.K22] -> -0.0206636184560518 | Q22: of:=LN(1+[.P22]) -> -0.0208800983849016 | R22: of:=[.D22]*[.$G$151]/[.G23] -> 8.62401132162731 | S22: of:=[.K22]/[.R21] -> 12.95 | T22: of:=AVERAGE([.R13:.R22]) -> 8.88525629781739 | U22: of:=[.K22]/[.T21] -> 14.4525905811568
A23: 1885 | B23: 4.24 | C23: 0.24 | D23: 0.27 | E23: 4.22 | F23: 3.52 | G23: 8.2776793 | H23: of:=(1+[.E23]/100)*[.G23]/[.G24] -> 1.07942277683102 | J23: of:=[.J22]+1 -> 1885 | K23: of:=[.B23]*[.$G$151]/[.G23] -> 117.954219366773 | L23: of:=[.O23]+[.L24]/(1+[$Calculations.$E$3]) -> 130.579800808488 | M23: of:=[.O23]+[.M24]/([.H23]+[$Calculations.$E$3]-[$Calculations.$E$1]+1) -> 108.442910931722 | O23: of:=[.C23]*[.$G$151]/[.G24] -> 6.9151144897306 | P23: of:=([.K24]-[.K23]+[.O23])/[.K23] -> 0.32884263014938 | Q23: of:=LN(1+[.P23]) -> 0.284308360492122 | R23: of:=[.D23]*[.$G$151]/[.G24] -> 7.77950380094692 | S23: of:=[.K23]/[.R22] -> 13.6774193548387 | T23: of:=AVERAGE([.R14:.R23]) -> 8.89890273865015 | U23: of:=[.K23]/[.T22] -> 13.2752748388078
A24: 1886 | B24: 5.2 | C24: 0.22 | D24: 0.33 | E24: 4.26 | F24: 3.37 | G24: 7.9922321 | H24: of:=(1+[.E24]/100)*[.G24]/[.G25] -> 1.0426 | J24: of:=[.J23]+1 -> 1886 | K24: of:=[.B24]*[.$G$151]/[.G24] -> 149.82748061083 | L24: of:=[.O24]+[.L25]/(1+[$Calculations.$E$3]) -> 131.741013735683 | M24: of:=[.O24]+[.M25]/([.H24]+[$Calculations.$E$3]-[$Calculations.$E$1]+1) -> 113.458491083961 | O24: of:=[.C24]*[.$G$151]/[.G25] -> 6.33885494891971 | P24: of:=([.K25]-[.K24]+[.O24])/[.K24] -> 0.115384615384615 | Q24: of:=LN(1+[.P24]) -> 0.109199291964992 | R24: of:=[.D24]*[.$G$151]/[.G25] -> 9.50828242337957 | S24: of:=[.K24]/[.R23] -> 19.2592592592593 | T24: of:=AVERAGE([.R15:.R24]) -> 9.26044262282935 | U24: of:=[.K24]/[.T23] -> 16.8366241334554
A25: 1887 | B25: 5.58 | C25: 0.25 | D25: 0.36 | E25: 6.11 | F25: 3.52 | G25: 7.9922321 | H25: of:=(1+[.E25]/100)*[.G25]/[.G26] -> 1.01286455039545 | J25: of:=[.J24]+1 -> 1887 | K25: of:=[.B25]*[.$G$151]/[.G25] -> 160.776411886236 | L25: of:=[.O25]+[.L26]/(1+[$Calculations.$E$3]) -> 133.591957534489 | M25: of:=[.O25]+[.M26]/([.H25]+[$Calculations.$E$3]-[$Calculations.$E$1]+1) -> 115.762994396796 | O25: of:=[.C25]*[.$G$151]/[.G26] -> 6.87579941469354 | P25: of:=([.K26]-[.K25]+[.O25])/[.K25] -> -0.0488792653801274 | Q25: of:=LN(1+[.P25]) -> -0.0501142690586574 | R25: of:=[.D25]*[.$G$151]/[.G26] -> 9.9011511571587 | S25: of:=[.K25]/[.R24] -> 16.9090909090909 | T25: of:=AVERAGE([.R16:.R25]) -> 9.50201150874549 | U25: of:=[.K25]/[.T24] -> 17.3616336102425
A26: 1888 | B26: 5.31 | C26: 0.23 | D26: 0.26 | E26: 5.02 | F26: 3.67 | G26: 8.3728446 | H26: of:=(1+[.E26]/100)*[.G26]/[.G27] -> 1.10021346839014 | J26: of:=[.J25]+1 -> 1888 | K26: of:=[.B26]*[.$G$151]/[.G26] -> 146.041979568091 | L26: of:=[.O26]+[.L27]/(1+[$Calculations.$E$3]) -> 134.99177189811 | M26: of:=[.O26]+[.M27]/([.H26]+[$Calculations.$E$3]-[$Calculations.$E$1]+1) -> 114.435365802719 | O26: of:=[.C26]*[.$G$151]/[.G27] -> 6.62698471932516 | P26: of:=([.K27]-[.K26]+[.O26])/[.K26] -> 0.079189592457514 | Q26: of:=LN(1+[.P26]) -> 0.0762103821079712 | R26: of:=[.D26]*[.$G$151]/[.G27] -> 7.49137403054148 | S26: of:=[.K26]/[.R25] -> 14.75 | T26: of:=AVERAGE([.R17:.R26]) -> 9.38874777963691 | U26: of:=[.K26]/[.T25] -> 15.3695856328606
A27: 1889 | B27: 5.24 | C27: 0.22 | D27: 0.3 | E27: 4.68 | F27: 3.45 | G27: 7.9922321 | H27: of:=(1+[.E27]/100)*[.G27]/[.G28] -> 1.09913967062524 | I27: of:=[$Consumption.G5] -> 2731.57014211228 | J27: of:=[.J26]+1 -> 1889 | K27: of:=[.B27]*[.$G$151]/[.G27] -> 150.979999692451 | L27: of:=[.O27]+[.L28]/(1+[$Calculations.$E$3]) -> 136.748070078057 | M27: of:=[.O27]+[.M28]/([.H27]+[$Calculations.$E$3]-[$Calculations.$E$1]+1) -> 122.718528125917 | N27: of:=([.I27]/[.I28])^4*([.O27]+[.N28]) -> 108.810686306142 | O27: of:=[.C27]*[.$G$151]/[.G28] -> 6.65579570185021 | P27: of:=([.K28]-[.K27]+[.O27])/[.K27] -> 0.122137068313857 | Q27: of:=LN(1+[.P27]) -> 0.115234963911658 | R27: of:=[.D27]*[.$G$151]/[.G28] -> 9.07608504797756 | S27: of:=[.K27]/[.R26] -> 20.1538461538462 | T27: of:=AVERAGE([.R18:.R27]) -> 9.42044533109745 | U27: of:=[.K27]/[.T26] -> 16.0809517132742
A28: 1890 | B28: 5.38 | C28: 0.22 | D28: 0.29 | E28: 5.41 | F28: 3.42 | G28: 7.6116519 | H28: of:=(1+[.E28]/100)*[.G28]/[.G29] -> 1.02839040174741 | I28: of:=[$Consumption.G6] -> 2674.73980114898 | J28: of:=[.J27]+1 -> 1890 | K28: of:=[.B28]*[.$G$151]/[.G28] -> 162.764458527064 | L28: of:=[.O28]+[.L29]/(1+[$Calculations.$E$3]) -> 138.588376485475 | M28: of:=[.O28]+[.M29]/([.H28]+[$Calculations.$E$3]-[$Calculations.$E$1]+1) -> 131.989847337773 | N28: of:=([.I28]/[.I29])^4*([.O28]+[.N29]) -> 93.3783534701936 | O28: of:=[.C28]*[.$G$151]/[.G29] -> 6.49346021798163 | P28: of:=([.K29]-[.K28]+[.O28])/[.K28] -> -0.0824189361417394 | Q28: of:=LN(1+[.P28]) -> -0.0860143499772757 | R28: of:=[.D28]*[.$G$151]/[.G29] -> 8.55956119643033 | S28: of:=[.K28]/[.R27] -> 17.9333333333333 | T28: of:=AVERAGE([.R19:.R28]) -> 9.07848053421014 | U28: of:=[.K28]/[.T27] -> 17.2777881306491
A29: 1891 | B29: 4.84 | C29: 0.22 | D29: 0.34 | E29: 5.97 | F29: 3.62 | G29: 7.801942 | H29: of:=(1+[.E29]/100)*[.G29]/[.G30] -> 1.12851186226138 | I29: of:=[$Consumption.G7] -> 2802.82749911844 | J29: of:=[.J28]+1 -> 1891 | K29: of:=[.B29]*[.$G$151]/[.G29] -> 142.856124795596 | L29: of:=[.O29]+[.L30]/(1+[$Calculations.$E$3]) -> 140.721807465339 | M29: of:=[.O29]+[.M30]/([.H29]+[$Calculations.$E$3]-[$Calculations.$E$1]+1) -> 133.839290700658 | N29: of:=([.I29]/[.I30])^4*([.O29]+[.N30]) -> 106.098020350082 | O29: of:=[.C29]*[.$G$151]/[.G30] -> 6.91511454479065 | P29: of:=([.K30]-[.K29]+[.O29])/[.K29] -> 0.26076009559031 | Q29: of:=LN(1+[.P29]) -> 0.231714789549466 | R29: of:=[.D29]*[.$G$151]/[.G30] -> 10.6869952055856 | S29: of:=[.K29]/[.R28] -> 16.6896551724138 | T29: of:=AVERAGE([.R20:.R29]) -> 9.15192045266351 | U29: of:=[.K29]/[.T28] -> 15.735686633603
A30: 1892 | B30: 5.51 | C30: 0.24 | D30: 0.37 | E30: 3.93 | F30: 3.6 | G30: 7.3262127 | H30: of:=(1+[.E30]/100)*[.G30]/[.G31] -> 0.964169307748014 | I30: of:=[$Consumption.G8] -> 2877.01045573511 | J30: of:=[.J29]+1 -> 1892 | K30: of:=[.B30]*[.$G$151]/[.G30] -> 173.192187008166 | L30: of:=[.O30]+[.L31]/(1+[$Calculations.$E$3]) -> 142.54537729983 | M30: of:=[.O30]+[.M31]/([.H30]+[$Calculations.$E$3]-[$Calculations.$E$1]+1) -> 148.069831948234 | N30: of:=([.I30]/[.I31])^4*([.O30]+[.N31]) -> 110.869228055966 | O30: of:=[.C30]*[.$G$151]/[.G31] -> 6.9984250276662 | P30: of:=([.K31]-[.K30]+[.O30])/[.K30] -> -0.015044425524111 | Q30: of:=LN(1+[.P30]) -> -0.0151587408821115 | R30: of:=[.D30]*[.$G$151]/[.G31] -> 10.7892385843187 | S30: of:=[.K30]/[.R29] -> 16.2058823529412 | T30: of:=AVERAGE([.R21:.R30]) -> 9.23968191652959 | U30: of:=[.K30]/[.T29] -> 18.9241359673052
A31: 1893 | B31: 5.61 | C31: 0.25 | D31: 0.26 | E31: 8.52 | F31: 3.75 | G31: 7.8970911 | H31: of:=(1+[.E31]/100)*[.G31]/[.G32] -> 1.25099538765694 | I31: of:=[$Consumption.G9] -> 2834.84616233237 | J31: of:=[.J30]+1 -> 1893 | K31: of:=[.B31]*[.$G$151]/[.G31] -> 163.588185021697 | L31: of:=[.O31]+[.L32]/(1+[$Calculations.$E$3]) -> 144.399289988807 | M31: of:=[.O31]+[.M32]/([.H31]+[$Calculations.$E$3]-[$Calculations.$E$1]+1) -> 141.389965789867 | N31: of:=([.I31]/[.I32])^4*([.O31]+[.N32]) -> 97.5128743761825 | O31: of:=[.C31]*[.$G$151]/[.G32] -> 8.403786389676 | P31: of:=([.K32]-[.K31]+[.O31])/[.K31] -> -0.0609271984837915 | Q31: of:=LN(1+[.P31]) -> -0.0628622718780586 | R31: of:=[.D31]*[.$G$151]/[.G32] -> 8.73993784526304 | S31: of:=[.K31]/[.R30] -> 15.1621621621622 | T31: of:=AVERAGE([.R22:.R31]) -> 9.11561406132292 | U31: of:=[.K31]/[.T30] -> 17.704958514756
A32: 1894 | B32: 4.32 | C32: 0.21 | D32: 0.16 | E32: 3.32 | F32: 3.7 | G32: 6.8504835 | H32: of:=(1+[.E32]/100)*[.G32]/[.G33] -> 1.078120801016 | I32: of:=[$Consumption.G10] -> 2698.707528645 | J32: of:=[.J31]+1 -> 1894 | K32: of:=[.B32]*[.$G$151]/[.G32] -> 145.217428813601 | L32: of:=[.O32]+[.L33]/(1+[$Calculations.$E$3]) -> 144.87713542946 | M32: of:=[.O32]+[.M33]/([.H32]+[$Calculations.$E$3]-[$Calculations.$E$1]+1) -> 171.430385219976 | N32: of:=([.I32]/[.I33])^4*([.O32]+[.N33]) -> 71.6841781599359 | O32: of:=[.C32]*[.$G$151]/[.G33] -> 7.36609505203645 | P32: of:=([.K33]-[.K32]+[.O32])/[.K32] -> 0.0772937485955516 | Q32: of:=LN(1+[.P32]) -> 0.0744521080566096 | R32: of:=[.D32]*[.$G$151]/[.G33] -> 5.61226289678967 | S32: of:=[.K32]/[.R31] -> 16.6153846153846 | T32: of:=AVERAGE([.R23:.R32]) -> 8.81443921883916 | U32: of:=[.K32]/[.T31] -> 15.9306249515051
A33: 1895 | B33: 4.25 | C33: 0.19 | D33: 0.25 | E33: 3.09 | F33: 3.46 | G33: 6.5650524 | H33: of:=(1+[.E33]/100)*[.G33]/[.G34] -> 1.01617357225092 | I33: of:=[$Consumption.G11] -> 2979.45733591223 | J33: of:=[.J32]+1 -> 1895 | K33: of:=[.B33]*[.$G$151]/[.G33] -> 149.075733195976 | L33: of:=[.O33]+[.L34]/(1+[$Calculations.$E$3]) -> 146.491649301361 | M33: of:=[.O33]+[.M34]/([.H33]+[$Calculations.$E$3]-[$Calculations.$E$1]+1) -> 183.130141024049 | N33: of:=([.I33]/[.I34])^4*([.O33]+[.N34]) -> 99.1336852626064 | O33: of:=[.C33]*[.$G$151]/[.G34] -> 6.56935878168343 | P33: of:=([.K34]-[.K33]+[.O33])/[.K33] -> 0.0344208960164111 | Q33: of:=LN(1+[.P33]) -> 0.0338417493700899 | R33: of:=[.D33]*[.$G$151]/[.G34] -> 8.64389313379398 | S33: of:=[.K33]/[.R32] -> 26.5625 | T33: of:=AVERAGE([.R24:.R33]) -> 8.90087815212386 | U33: of:=[.K33]/[.T32] -> 16.9126735683145
A34: 1896 | B34: 4.27 | C34: 0.18 | D34: 0.21 | E34: 5.76 | F34: 3.6 | G34: 6.6601934 | H34: of:=(1+[.E34]/100)*[.G34]/[.G35] -> 1.08870569052245 | I34: of:=[$Consumption.G12] -> 2916.27527740171 | J34: of:=[.J33]+1 -> 1896 | K34: of:=[.B34]*[.$G$151]/[.G34] -> 147.637694725201 | L34: of:=[.O34]+[.L35]/(1+[$Calculations.$E$3]) -> 149.060374032462 | M34: of:=[.O34]+[.M35]/([.H34]+[$Calculations.$E$3]-[$Calculations.$E$1]+1) -> 186.141394680661 | N34: of:=([.I34]/[.I35])^4*([.O34]+[.N35]) -> 84.4191677239254 | O34: of:=[.C34]*[.$G$151]/[.G35] -> 6.40664907619253 | P34: of:=([.K35]-[.K34]+[.O34])/[.K34] -> 0.0607519828153166 | Q34: of:=LN(1+[.P34]) -> 0.0589780743564494 | R34: of:=[.D34]*[.$G$151]/[.G35] -> 7.47442392222462 | S34: of:=[.K34]/[.R33] -> 17.08 | T34: of:=AVERAGE([.R25:.R34]) -> 8.69749230200837 | U34: of:=[.K34]/[.T33] -> 16.5868684192664
A35: 1897 | B35: 4.22 | C35: 0.18 | D35: 0.31 | E35: 3.44 | F35: 3.4 | G35: 6.4699033 | H35: of:=(1+[.E35]/100)*[.G35]/[.G36] -> 1.00484589134003 | I35: of:=[$Consumption.G13] -> 3089.2463215432 | J35: of:=[.J34]+1 -> 1897 | K35: of:=[.B35]*[.$G$151]/[.G35] -> 150.200328341847 | L35: of:=[.O35]+[.L36]/(1+[$Calculations.$E$3]) -> 151.970193742041 | M35: of:=[.O35]+[.M36]/([.H35]+[$Calculations.$E$3]-[$Calculations.$E$1]+1) -> 202.524126749638 | N35: of:=([.I35]/[.I36])^4*([.O35]+[.N36]) -> 99.8943030496057 | O35: of:=[.C35]*[.$G$151]/[.G36] -> 6.22360305633167 | P35: of:=([.K36]-[.K35]+[.O35])/[.K35] -> 0.164793705575722 | Q35: of:=LN(1+[.P35]) -> 0.152543994578687 | R35: of:=[.D35]*[.$G$151]/[.G36] -> 10.7184274859045 | S35: of:=[.K35]/[.R34] -> 20.0952380952381 | T35: of:=AVERAGE([.R26:.R35]) -> 8.77921993488295 | U35: of:=[.K35]/[.T34] -> 17.2693833034108
A36: 1898 | B36: 4.88 | C36: 0.2 | D36: 0.35 | E36: 3.55 | F36: 3.35 | G36: 6.6601934 | H36: of:=(1+[.E36]/100)*[.G36]/[.G37] -> 1.02091496703535 | I36: of:=[$Consumption.G14] -> 3085.27547648583 | J36: of:=[.J35]+1 -> 1898 | K36: of:=[.B36]*[.$G$151]/[.G36] -> 168.728793971659 | L36: of:=[.O36]+[.L37]/(1+[$Calculations.$E$3]) -> 155.265049198954 | M36: of:=[.O36]+[.M37]/([.H36]+[$Calculations.$E$3]-[$Calculations.$E$1]+1) -> 204.728632255513 | N36: of:=([.I36]/[.I37])^4*([.O36]+[.N37]) -> 93.1580821985471 | O36: of:=[.C36]*[.$G$151]/[.G37] -> 6.81771501592999 | P36: of:=([.K37]-[.K36]+[.O36])/[.K36] -> 0.268759447994158 | Q36: of:=LN(1+[.P36]) -> 0.238039610475137 | R36: of:=[.D36]*[.$G$151]/[.G37] -> 11.9310012778775 | S36: of:=[.K36]/[.R35] -> 15.741935483871 | T36: of:=AVERAGE([.R27:.R36]) -> 9.22318265961655 | U36: of:=[.K36]/[.T35] -> 19.2191100374692
A37: 1899 | B37: 6.08 | C37: 0.21 | D37: 0.48 | E37: 3.36 | F37: 3.1 | G37: 6.7553425 | H37: of:=(1+[.E37]/100)*[.G37]/[.G38] -> 0.884163791399089 | I37: of:=[$Consumption.G15] -> 3389.81305178606 | J37: of:=[.J36]+1 -> 1899 | K37: of:=[.B37]*[.$G$151]/[.G37] -> 207.258536484271 | L37: of:=[.O37]+[.L38]/(1+[$Calculations.$E$3]) -> 158.142173596934 | M37: of:=[.O37]+[.M38]/([.H37]+[$Calculations.$E$3]-[$Calculations.$E$1]+1) -> 209.588413112284 | N37: of:=([.I37]/[.I38])^4*([.O37]+[.N38]) -> 128.934755140377 | O37: of:=[.C37]*[.$G$151]/[.G38] -> 6.12362189920792 | P37: of:=([.K38]-[.K37]+[.O37])/[.K37] -> -0.112218675571799 | Q37: of:=LN(1+[.P37]) -> -0.119029822590571 | R37: of:=[.D37]*[.$G$151]/[.G38] -> 13.9968500553324 | S37: of:=[.K37]/[.R36] -> 17.3714285714286 | T37: of:=AVERAGE([.R28:.R37]) -> 9.71525916035203 | U37: of:=[.K37]/[.T36] -> 22.4714769438263
A38: 1900 | B38: 6.1 | C38: 0.3 | D38: 0.48 | E38: 4.64 | F38: 3.15 | G38: 7.8970911 | H38: of:=(1+[.E38]/100)*[.G38]/[.G39] -> 1.07223798981805 | I38: of:=[$Consumption.G16] -> 3362.0541357981 | J38: of:=[.J37]+1 -> 1900 | K38: of:=[.B38]*[.$G$151]/[.G38] -> 177.876636119849 | L38: of:=[.O38]+[.L39]/(1+[$Calculations.$E$3]) -> 161.946621169337 | M38: of:=[.O38]+[.M39]/([.H38]+[$Calculations.$E$3]-[$Calculations.$E$1]+1) -> 187.645937347375 | N38: of:=([.I38]/[.I39])^4*([.O38]+[.N39]) -> 118.639380787362 | O38: of:=[.C38]*[.$G$151]/[.G39] -> 8.96404002240673 | P38: of:=([.K39]-[.K38]+[.O38])/[.K38] -> 0.238029839223788 | Q38: of:=LN(1+[.P38]) -> 0.213521276737518 | R38: of:=[.D38]*[.$G$151]/[.G39] -> 14.3424640358508 | S38: of:=[.K38]/[.R37] -> 12.7083333333333 | T38: of:=AVERAGE([.R29:.R38]) -> 10.2935494442941 | U38: of:=[.K38]/[.T37] -> 18.3089954867868
A39: 1901 | B39: 7.07 | C39: 0.32 | D39: 0.5 | E39: 4.3 | F39: 3.1 | G39: 7.7067929 | H39: of:=(1+[.E39]/100)*[.G39]/[.G40] -> 1.01786656541166 | I39: of:=[$Consumption.G17] -> 3702.78578736083 | J39: of:=[.J38]+1 -> 1901 | K39: of:=[.B39]*[.$G$151]/[.G39] -> 211.252543194719 | L39: of:=[.O39]+[.L40]/(1+[$Calculations.$E$3]) -> 162.973609719504 | M39: of:=[.O39]+[.M40]/([.H39]+[$Calculations.$E$3]-[$Calculations.$E$1]+1) -> 198.395303069419 | N39: of:=([.I39]/[.I40])^4*([.O39]+[.N40]) -> 165.587793453211 | O39: of:=[.C39]*[.$G$151]/[.G40] -> 9.3312333702216 | P39: of:=([.K40]-[.K39]+[.O39])/[.K39] -> 0.165009786001704 | Q39: of:=LN(1+[.P39]) -> 0.152729486983846 | R39: of:=[.D39]*[.$G$151]/[.G40] -> 14.5800521409713 | S39: of:=[.K39]/[.R38] -> 14.7291666666667 | T39: of:=AVERAGE([.R30:.R39]) -> 10.6828551378326 | U39: of:=[.K39]/[.T38] -> 20.5228084188025
A40: 1902 | B40: 8.12 | C40: 0.33 | D40: 0.63 | E40: 4.72 | F40: 3.18 | G40: 7.8970911 | H40: of:=(1+[.E40]/100)*[.G40]/[.G41] -> 0.955138131390033 | I40: of:=[$Consumption.G18] -> 3659.71206519153 | J40: of:=[.J39]+1 -> 1902 | K40: of:=[.B40]*[.$G$151]/[.G40] -> 236.780046769373 | L40: of:=[.O40]+[.L41]/(1+[$Calculations.$E$3]) -> 163.676495008775 | M40: of:=[.O40]+[.M41]/([.H40]+[$Calculations.$E$3]-[$Calculations.$E$1]+1) -> 199.643224745618 | N40: of:=([.I40]/[.I41])^4*([.O40]+[.N41]) -> 148.68497544587 | O40: of:=[.C40]*[.$G$151]/[.G41] -> 8.77686791438857 | P40: of:=([.K41]-[.K40]+[.O40])/[.K40] -> -0.0126539438363445 | Q40: of:=LN(1+[.P40]) -> -0.0127346868518584 | R40: of:=[.D40]*[.$G$151]/[.G41] -> 16.7558387456509 | S40: of:=[.K40]/[.R39] -> 16.24 | T40: of:=AVERAGE([.R31:.R40]) -> 11.2795151539659 | U40: of:=[.K40]/[.T39] -> 22.164491019899
A41: 1903 | B41: 8.46 | C41: 0.35 | D41: 0.53 | E41: 5.5 | F41: 3.3 | G41: 8.6582595 | H41: of:=(1+[.E41]/100)*[.G41]/[.G42] -> 1.10350539582996 | I41: of:=[$Consumption.G19] -> 3808.0779029867 | J41: of:=[.J40]+1 -> 1903 | K41: of:=[.B41]*[.$G$151]/[.G41] -> 225.006977441598 | L41: of:=[.O41]+[.L42]/(1+[$Calculations.$E$3]) -> 165.015854632047 | M41: of:=[.O41]+[.M42]/([.H41]+[$Calculations.$E$3]-[$Calculations.$E$1]+1) -> 189.573611897889 | N41: of:=([.I41]/[.I42])^4*([.O41]+[.N42]) -> 165.525268980267 | O41: of:=[.C41]*[.$G$151]/[.G42] -> 9.73678697603083 | P41: of:=([.K42]-[.K41]+[.O41])/[.K41] -> -0.130825526012051 | Q41: of:=LN(1+[.P41]) -> -0.140211398279191 | R41: of:=[.D41]*[.$G$151]/[.G42] -> 14.7442774208467 | S41: of:=[.K41]/[.R40] -> 13.4285714285714 | T41: of:=AVERAGE([.R32:.R41]) -> 11.8799491115242 | U41: of:=[.K41]/[.T40] -> 19.948284511368
A42: 1904 | B42: 6.68 | C42: 0.31 | D42: 0.49 | E42: 4.34 | F42: 3.4 | G42: 8.2776793 | H42: of:=(1+[.E42]/100)*[.G42]/[.G43] -> 1.01995785316761 | I42: of:=[$Consumption.G20] -> 3785.68995733019 | J42: of:=[.J41]+1 -> 1904 | K42: of:=[.B42]*[.$G$151]/[.G42] -> 185.833534285388 | L42: of:=[.O42]+[.L43]/(1+[$Calculations.$E$3]) -> 165.420075802453 | M42: of:=[.O42]+[.M43]/([.H42]+[$Calculations.$E$3]-[$Calculations.$E$1]+1) -> 205.300681177559 | N42: of:=([.I42]/[.I43])^4*([.O42]+[.N43]) -> 151.930137712093 | O42: of:=[.C42]*[.$G$151]/[.G43] -> 8.43025500603813 | P42: of:=([.K43]-[.K42]+[.O42])/[.K42] -> 0.278987688321596 | Q42: of:=LN(1+[.P42]) -> 0.246068896531295 | R42: of:=[.D42]*[.$G$151]/[.G43] -> 13.3252417837377 | S42: of:=[.K42]/[.R41] -> 12.6037735849057 | T42: of:=AVERAGE([.R33:.R42]) -> 12.651247000219 | U42: of:=[.K42]/[.T41] -> 15.6426203968432
A43: 1905 | B43: 8.43 | C43: 0.33 | D43: 0.67 | E43: 4.17 | F43: 3.48 | G43: 8.4679289 | H43: of:=(1+[.E43]/100)*[.G43]/[.G44] -> 1.0417 | I43: of:=[$Consumption.G21] -> 3923.57045917408 | J43: of:=[.J42]+1 -> 1905 | K43: of:=[.B43]*[.$G$151]/[.G43] -> 229.248547422263 | L43: of:=[.O43]+[.L44]/(1+[$Calculations.$E$3]) -> 167.242555280439 | M43: of:=[.O43]+[.M44]/([.H43]+[$Calculations.$E$3]-[$Calculations.$E$1]+1) -> 208.298101703913 | N43: of:=([.I43]/[.I44])^4*([.O43]+[.N44]) -> 166.872840016426 | O43: of:=[.C43]*[.$G$151]/[.G44] -> 8.97414242578253 | P43: of:=([.K44]-[.K43]+[.O43])/[.K43] -> 0.209964412811388 | Q43: of:=LN(1+[.P43]) -> 0.190590948276461 | R43: of:=[.D43]*[.$G$151]/[.G44] -> 18.2202285614373 | S43: of:=[.K43]/[.R42] -> 17.2040816326531 | T43: of:=AVERAGE([.R34:.R43]) -> 13.6088805429834 | U43: of:=[.K43]/[.T42] -> 18.1206285371153
A44: 1906 | B44: 9.87 | C44: 0.4 | D44: 0.76 | E44: 5.47 | F44: 3.43 | G44: 8.4679289 | H44: of:=(1+[.E44]/100)*[.G44]/[.G45] -> 1.00933665885364 | I44: of:=[$Consumption.G22] -> 4273.8445351244 | J44: of:=[.J43]+1 -> 1906 | K44: of:=[.B44]*[.$G$151]/[.G44] -> 268.408441643859 | L44: of:=[.O44]+[.L45]/(1+[$Calculations.$E$3]) -> 168.604649981209 | M44: of:=[.O44]+[.M45]/([.H44]+[$Calculations.$E$3]-[$Calculations.$E$1]+1) -> 215.227785062721 | N44: of:=([.I44]/[.I45])^4*([.O44]+[.N45]) -> 225.953821195093 | O44: of:=[.C44]*[.$G$151]/[.G45] -> 10.4098892772795 | P44: of:=([.K45]-[.K44]+[.O44])/[.K44] -> -0.0342843115635312 | Q44: of:=LN(1+[.P44]) -> -0.0348858064785249 | R44: of:=[.D44]*[.$G$151]/[.G45] -> 19.778789626831 | S44: of:=[.K44]/[.R43] -> 14.7313432835821 | T44: of:=AVERAGE([.R35:.R44]) -> 14.839317113444 | U44: of:=[.K44]/[.T43] -> 19.7230360569407
A45: 1907 | B45: 9.56 | C45: 0.44 | D45: 0.66 | E45: 6.23 | F45: 3.67 | G45: 8.8485091 | H45: of:=(1+[.E45]/100)*[.G45]/[.G46] -> 1.08564212206044 | I45: of:=[$Consumption.G23] -> 4276.70511316831 | J45: of:=[.J44]+1 -> 1907 | K45: of:=[.B45]*[.$G$151]/[.G45] -> 248.79635372698 | L45: of:=[.O45]+[.L46]/(1+[$Calculations.$E$3]) -> 168.526187735523 | M45: of:=[.O45]+[.M46]/([.H45]+[$Calculations.$E$3]-[$Calculations.$E$1]+1) -> 214.531484909657 | N45: of:=([.I45]/[.I46])^4*([.O45]+[.N46]) -> 216.149482968722 | O45: of:=[.C45]*[.$G$151]/[.G46] -> 11.7024905525181 | P45: of:=([.K46]-[.K45]+[.O45])/[.K45] -> -0.22069199047651 | Q45: of:=LN(1+[.P45]) -> -0.249348920341874 | R45: of:=[.D45]*[.$G$151]/[.G46] -> 17.5537358287771 | S45: of:=[.K45]/[.R44] -> 12.5789473684211 | T45: of:=AVERAGE([.R36:.R45]) -> 15.5228479477313 | U45: of:=[.K45]/[.T44] -> 16.7660244622428
A46: 1908 | B46: 6.85 | C46: 0.4 | D46: 0.58 | E46: 5.32 | F46: 3.87 | G46: 8.6582595 | H46: of:=(1+[.E46]/100)*[.G46]/[.G47] -> 1.0195897678699 | I46: of:=[$Consumption.G24] -> 3929.98997219402 | J46: of:=[.J45]+1 -> 1908 | K46: of:=[.B46]*[.$G$151]/[.G46] -> 182.186500647157 | L46: of:=[.O46]+[.L47]/(1+[$Calculations.$E$3]) -> 167.065582420299 | M46: of:=[.O46]+[.M47]/([.H46]+[$Calculations.$E$3]-[$Calculations.$E$1]+1) -> 227.925219222205 | N46: of:=([.I46]/[.I47])^4*([.O46]+[.N47]) -> 142.425936566803 | O46: of:=[.C46]*[.$G$151]/[.G47] -> 10.2991226961482 | P46: of:=([.K47]-[.K46]+[.O46])/[.K46] -> 0.336950053372175 | Q46: of:=LN(1+[.P46]) -> 0.290390940183544 | R46: of:=[.D46]*[.$G$151]/[.G47] -> 14.933727909415 | S46: of:=[.K46]/[.R45] -> 10.3787878787879 | T46: of:=AVERAGE([.R37:.R46]) -> 15.823120610885 | U46: of:=[.K46]/[.T45] -> 11.7366672185811
A47: 1909 | B47: 9.06 | C47: 0.44 | D47: 0.76 | E47: 3.65 | F47: 3.76 | G47: 8.9436744 | H47: of:=(1+[.E47]/100)*[.G47]/[.G48] -> 0.936833113399328 | I47: of:=[$Consumption.G25] -> 4274.44234972731 | J47: of:=[.J46]+1 -> 1909 | K47: of:=[.B47]*[.$G$151]/[.G47] -> 233.275129067758 | L47: of:=[.O47]+[.L48]/(1+[$Calculations.$E$3]) -> 167.004606881708 | M47: of:=[.O47]+[.M48]/([.H47]+[$Calculations.$E$3]-[$Calculations.$E$1]+1) -> 230.17846494237 | N47: of:=([.I47]/[.I48])^4*([.O47]+[.N48]) -> 189.016422189942 | O47: of:=[.C47]*[.$G$151]/[.G48] -> 10.2396672443663 | P47: of:=([.K48]-[.K47]+[.O47])/[.K47] -> 0.0494952291004107 | Q47: of:=LN(1+[.P47]) -> 0.0483093143896194 | R47: of:=[.D47]*[.$G$151]/[.G48] -> 17.6866979675418 | S47: of:=[.K47]/[.R46] -> 15.6206896551724 | T47: of:=AVERAGE([.R38:.R47]) -> 16.1921054021059 | U47: of:=[.K47]/[.T46] -> 14.742675279065
A48: 1910 | B48: 10.08 | C48: 0.47 | D48: 0.73 | E48: 5.26 | F48: 3.91 | G48: 9.8951653 | H48: of:=(1+[.E48]/100)*[.G48]/[.G49] -> 1.12856758193682 | I48: of:=[$Consumption.G26] -> 4263.35950289906 | J48: of:=[.J47]+1 -> 1910 | K48: of:=[.B48]*[.$G$151]/[.G48] -> 234.581467780028 | L48: of:=[.O48]+[.L49]/(1+[$Calculations.$E$3]) -> 167.002987520651 | M48: of:=[.O48]+[.M49]/([.H48]+[$Calculations.$E$3]-[$Calculations.$E$1]+1) -> 214.423160392722 | N48: of:=([.I48]/[.I49])^4*([.O48]+[.N49]) -> 176.82402600188 | O48: of:=[.C48]*[.$G$151]/[.G49] -> 11.7272242668624 | P48: of:=([.K49]-[.K48]+[.O48])/[.K48] -> 0.0360068575530894 | Q48: of:=LN(1+[.P48]) -> 0.0353737630751229 | R48: of:=[.D48]*[.$G$151]/[.G49] -> 18.2146249251267 | S48: of:=[.K48]/[.R47] -> 13.2631578947368 | T48: of:=AVERAGE([.R39:.R48]) -> 16.5793214910335 | U48: of:=[.K48]/[.T47] -> 14.4873975282744
A49: 1911 | B49: 9.27 | C49: 0.47 | D49: 0.59 | E49: 4 | F49: 3.98 | G49: 9.2290893 | H49: of:=(1+[.E49]/100)*[.G49]/[.G50] -> 1.05082632120302 | I49: of:=[$Consumption.G27] -> 4399.92825070562 | J49: of:=[.J48]+1 -> 1911 | K49: of:=[.B49]*[.$G$151]/[.G49] -> 231.300785008116 | L49: of:=[.O49]+[.L50]/(1+[$Calculations.$E$3]) -> 165.416555595413 | M49: of:=[.O49]+[.M50]/([.H49]+[$Calculations.$E$3]-[$Calculations.$E$1]+1) -> 236.476513842377 | N49: of:=([.I49]/[.I50])^4*([.O49]+[.N50]) -> 188.865801972763 | O49: of:=[.C49]*[.$G$151]/[.G50] -> 11.8493037829517 | P49: of:=([.K50]-[.K49]+[.O49])/[.K49] -> 0.0452892312190865 | Q49: of:=LN(1+[.P49]) -> 0.0442936234074912 | R49: of:=[.D49]*[.$G$151]/[.G50] -> 14.8746579403011 | S49: of:=[.K49]/[.R48] -> 12.6986301369863 | T49: of:=AVERAGE([.R40:.R49]) -> 16.6087820709665 | U49: of:=[.K49]/[.T48] -> 13.9511610974676
A50: 1912 | B50: 9.12 | C50: 0.48 | D50: 0.7 | E50: 4.35 | F50: 4.01 | G50: 9.134005 | H50: of:=(1+[.E50]/100)*[.G50]/[.G51] -> 0.972585124234694 | I50: of:=[$Consumption.G28] -> 4444.75522290071 | J50: of:=[.J49]+1 -> 1912 | K50: of:=[.B50]*[.$G$151]/[.G50] -> 229.926915958553 | L50: of:=[.O50]+[.L51]/(1+[$Calculations.$E$3]) -> 163.596464217998 | M50: of:=[.O50]+[.M51]/([.H50]+[$Calculations.$E$3]-[$Calculations.$E$1]+1) -> 244.599972724896 | N50: of:=([.I50]/[.I51])^4*([.O50]+[.N51]) -> 184.831667671791 | O50: of:=[.C50]*[.$G$151]/[.G51] -> 11.2790204081633 | P50: of:=([.K51]-[.K50]+[.O50])/[.K50] -> -0.000508314312566864 | Q50: of:=LN(1+[.P50]) -> -0.000508443548083693 | R50: of:=[.D50]*[.$G$151]/[.G51] -> 16.4485714285714 | S50: of:=[.K50]/[.R49] -> 15.4576271186441 | T50: of:=AVERAGE([.R41:.R50]) -> 16.5780553392586 | U50: of:=[.K50]/[.T49] -> 13.8436951593509
A51: 1913 | B51: 9.3 | C51: 0.48 | D51: 0.63 | E51: 5.65 | F51: 4.45 | G51: 9.8 | H51: of:=(1+[.E51]/100)*[.G51]/[.G52] -> 1.03537 | I51: of:=[$Consumption.G29] -> 4501.98802080392 | J51: of:=[.J50]+1 -> 1913 | K51: of:=[.B51]*[.$G$151]/[.G51] -> 218.531020408163 | L51: of:=[.O51]+[.L52]/(1+[$Calculations.$E$3]) -> 162.265033409881 | M51: of:=[.O51]+[.M52]/([.H51]+[$Calculations.$E$3]-[$Calculations.$E$1]+1) -> 235.811409814817 | N51: of:=([.I51]/[.I52])^4*([.O51]+[.N52]) -> 183.258029898159 | O51: of:=[.C51]*[.$G$151]/[.G52] -> 11.05344 | P51: of:=([.K52]-[.K51]+[.O51])/[.K51] -> -0.0674193548387098 | Q51: of:=LN(1+[.P51]) -> -0.0697996484568918 | R51: of:=[.D51]*[.$G$151]/[.G52] -> 14.50764 | S51: of:=[.K51]/[.R50] -> 13.2857142857143 | T51: of:=AVERAGE([.R42:.R51]) -> 16.5543915971739 | U51: of:=[.K51]/[.T50] -> 13.1819454053009
A52: 1914 | B52: 8.37 | C52: 0.42 | D52: 0.52 | E52: 4.64 | F52: 4.16 | G52: 10 | H52: of:=(1+[.E52]/100)*[.G52]/[.G53] -> 1.0360396039604 | I52: of:=[$Consumption.G30] -> 4361.75444333482 | J52: of:=[.J51]+1 -> 1914 | K52: of:=[.B52]*[.$G$151]/[.G52] -> 192.74436 | L52: of:=[.O52]+[.L53]/(1+[$Calculations.$E$3]) -> 161.086961827227 | M52: of:=[.O52]+[.M53]/([.H52]+[$Calculations.$E$3]-[$Calculations.$E$1]+1) -> 241.268427629499 | N52: of:=([.I52]/[.I53])^4*([.O52]+[.N53]) -> 150.416067924688 | O52: of:=[.C52]*[.$G$151]/[.G53] -> 9.576 | P52: of:=([.K53]-[.K52]+[.O52])/[.K52] -> -0.0654979476442266 | Q52: of:=LN(1+[.P52]) -> -0.067741455881576 | R52: of:=[.D52]*[.$G$151]/[.G53] -> 11.856 | S52: of:=[.K52]/[.R51] -> 13.2857142857143 | T52: of:=AVERAGE([.R43:.R52]) -> 16.4074674188001 | U52: of:=[.K52]/[.T51] -> 11.6430953604423
A53: 1915 | B53: 7.48 | C53: 0.43 | D53: 0.88 | E53: 3.65 | F53: 4.24 | G53: 10.1 | H53: of:=(1+[.E53]/100)*[.G53]/[.G54] -> 1.00660096153846 | I53: of:=[$Consumption.G31] -> 4224.74378145974 | J53: of:=[.J52]+1 -> 1915 | K53: of:=[.B53]*[.$G$151]/[.G53] -> 170.544 | L53: of:=[.O53]+[.L54]/(1+[$Calculations.$E$3]) -> 161.405881479681 | M53: of:=[.O53]+[.M54]/([.H53]+[$Calculations.$E$3]-[$Calculations.$E$1]+1) -> 248.867424778906 | N53: of:=([.I53]/[.I54])^4*([.O53]+[.N54]) -> 122.812689855532 | O53: of:=[.C53]*[.$G$151]/[.G54] -> 9.52119230769231 | P53: of:=([.K54]-[.K53]+[.O53])/[.K53] -> 0.26717400246812 | Q53: of:=LN(1+[.P53]) -> 0.236789226138502 | R53: of:=[.D53]*[.$G$151]/[.G54] -> 19.4852307692308 | S53: of:=[.K53]/[.R52] -> 14.3846153846154 | T53: of:=AVERAGE([.R44:.R53]) -> 16.5339676395795 | U53: of:=[.K53]/[.T52] -> 10.3942915531611
A54: 1916 | B54: 9.33 | C54: 0.56 | D54: 1.53 | E54: 3.64 | F54: 4.05 | G54: 10.4 | H54: of:=(1+[.E54]/100)*[.G54]/[.G55] -> 0.921244444444445 | I54: of:=[$Consumption.G32] -> 4541.70890088214 | J54: of:=[.J53]+1 -> 1916 | K54: of:=[.B54]*[.$G$151]/[.G54] -> 206.587730769231 | L54: of:=[.O54]+[.L55]/(1+[$Calculations.$E$3]) -> 161.804016312877 | M54: of:=[.O54]+[.M55]/([.H54]+[$Calculations.$E$3]-[$Calculations.$E$1]+1) -> 250.042566045478 | N54: of:=([.I54]/[.I55])^4*([.O54]+[.N55]) -> 154.507159589384 | O54: of:=[.C54]*[.$G$151]/[.G55] -> 11.0219487179487 | P54: of:=([.K55]-[.K54]+[.O54])/[.K54] -> -0.034893414314636 | Q54: of:=LN(1+[.P54]) -> -0.0355167322550437 | R54: of:=[.D54]*[.$G$151]/[.G55] -> 30.1135384615385 | S54: of:=[.K54]/[.R53] -> 10.6022727272727 | T54: of:=AVERAGE([.R45:.R54]) -> 17.5674425230502 | U54: of:=[.K54]/[.T53] -> 12.4947462867107
A55: 1917 | B55: 9.57 | C55: 0.69 | D55: 1.28 | E55: 4.25 | F55: 4.23 | G55: 11.7 | H55: of:=(1+[.E55]/100)*[.G55]/[.G56] -> 0.871232142857143 | I55: of:=[$Consumption.G33] -> 4387.47802913982 | J55: of:=[.J54]+1 -> 1917 | K55: of:=[.B55]*[.$G$151]/[.G55] -> 188.357230769231 | L55: of:=[.O55]+[.L56]/(1+[$Calculations.$E$3]) -> 160.629384421971 | M55: of:=[.O55]+[.M56]/([.H55]+[$Calculations.$E$3]-[$Calculations.$E$1]+1) -> 229.300431819698 | N55: of:=([.I55]/[.I56])^4*([.O55]+[.N56]) -> 123.542782450251 | O55: of:=[.C55]*[.$G$151]/[.G56] -> 11.3495142857143 | P55: of:=([.K56]-[.K55]+[.O55])/[.K55] -> -0.310120913569189 | Q55: of:=LN(1+[.P55]) -> -0.371238933803435 | R55: of:=[.D55]*[.$G$151]/[.G56] -> 21.0541714285714 | S55: of:=[.K55]/[.R54] -> 6.25490196078431 | T55: of:=AVERAGE([.R46:.R55]) -> 17.9174860830297 | U55: of:=[.K55]/[.T54] -> 10.721949454059
A56: 1918 | B56: 7.21 | C56: 0.57 | D56: 0.99 | E56: 5.98 | F56: 4.57 | G56: 14 | H56: of:=(1+[.E56]/100)*[.G56]/[.G57] -> 0.899224242424242 | I56: of:=[$Consumption.G34] -> 4369.95926165201 | J56: of:=[.J55]+1 -> 1918 | K56: of:=[.B56]*[.$G$151]/[.G56] -> 118.5942 | L56: of:=[.O56]+[.L57]/(1+[$Calculations.$E$3]) -> 159.029081037653 | M56: of:=[.O56]+[.M57]/([.H56]+[$Calculations.$E$3]-[$Calculations.$E$1]+1) -> 198.187340676361 | N56: of:=([.I56]/[.I57])^4*([.O56]+[.N57]) -> 110.231878154513 | O56: of:=[.C56]*[.$G$151]/[.G57] -> 7.95512727272727 | P56: of:=([.K57]-[.K56]+[.O56])/[.K56] -> -0.00912032950867913 | Q56: of:=LN(1+[.P56]) -> -0.00916217433389878 | R56: of:=[.D56]*[.$G$151]/[.G57] -> 13.8168 | S56: of:=[.K56]/[.R55] -> 5.6328125 | T56: of:=AVERAGE([.R47:.R56]) -> 17.8057932920882 | U56: of:=[.K56]/[.T55] -> 6.61890844789466
A57: 1919 | B57: 7.85 | C57: 0.53 | D57: 0.93 | E57: 5.56 | F57: 4.5 | G57: 16.5 | H57: of:=(1+[.E57]/100)*[.G57]/[.G58] -> 0.902455958549223 | I57: of:=[$Consumption.G35] -> 4505.82673730124 | J57: of:=[.J56]+1 -> 1919 | K57: of:=[.B57]*[.$G$151]/[.G57] -> 109.557454545455 | L57: of:=[.O57]+[.L58]/(1+[$Calculations.$E$3]) -> 160.940333174404 | M57: of:=[.O57]+[.M58]/([.H57]+[$Calculations.$E$3]-[$Calculations.$E$1]+1) -> 178.307140689345 | N57: of:=([.I57]/[.I58])^4*([.O57]+[.N58]) -> 116.638435522088 | O57: of:=[.C57]*[.$G$151]/[.G58] -> 6.32375129533679 | P57: of:=([.K58]-[.K57]+[.O57])/[.K57] -> 0.0193722979439623 | Q57: of:=LN(1+[.P57]) -> 0.0191870436908788 | R57: of:=[.D57]*[.$G$151]/[.G58] -> 11.0963937823834 | S57: of:=[.K57]/[.R56] -> 7.92929292929293 | T57: of:=AVERAGE([.R48:.R57]) -> 17.1467628735723 | U57: of:=[.K57]/[.T56] -> 6.15291061444229
A58: 1920 | B58: 8.83 | C58: 0.51 | D58: 0.8 | E58: 7.3 | F58: 4.97 | G58: 19.3 | H58: of:=(1+[.E58]/100)*[.G58]/[.G59] -> 1.08994210526316 | I58: of:=[$Consumption.G36] -> 4637.2132854993 | J58: of:=[.J57]+1 -> 1920 | K58: of:=[.B58]*[.$G$151]/[.G58] -> 105.356082901554 | L58: of:=[.O58]+[.L59]/(1+[$Calculations.$E$3]) -> 164.714324221797 | M58: of:=[.O58]+[.M59]/([.H58]+[$Calculations.$E$3]-[$Calculations.$E$1]+1) -> 161.758080855594 | N58: of:=([.I58]/[.I59])^4*([.O58]+[.N59]) -> 124.525734546255 | O58: of:=[.C58]*[.$G$151]/[.G59] -> 6.1812 | P58: of:=([.K59]-[.K58]+[.O58])/[.K58] -> -0.123407045359719 | Q58: of:=LN(1+[.P58]) -> -0.131712528172914 | R58: of:=[.D58]*[.$G$151]/[.G59] -> 9.696 | S58: of:=[.K58]/[.R57] -> 9.49462365591398 | T58: of:=AVERAGE([.R49:.R58]) -> 16.2949003810597 | U58: of:=[.K58]/[.T57] -> 6.14437160403821
A59: 1921 | B59: 7.11 | C59: 0.46 | D59: 0.29 | E59: 7.44 | F59: 5.09 | G59: 19 | H59: of:=(1+[.E59]/100)*[.G59]/[.G60] -> 1.20790532544379 | I59: of:=[$Consumption.G37] -> 4842.81395424887 | J59: of:=[.J58]+1 -> 1921 | K59: of:=[.B59]*[.$G$151]/[.G59] -> 86.1732 | L59: of:=[.O59]+[.L60]/(1+[$Calculations.$E$3]) -> 168.886649191271 | M59: of:=[.O59]+[.M60]/([.H59]+[$Calculations.$E$3]-[$Calculations.$E$1]+1) -> 175.49553463761 | N59: of:=([.I59]/[.I60])^4*([.O59]+[.N60]) -> 141.941618405041 | O59: of:=[.C59]*[.$G$151]/[.G60] -> 6.26797633136095 | P59: of:=([.K60]-[.K59]+[.O59])/[.K59] -> 0.227040837556904 | Q59: of:=LN(1+[.P59]) -> 0.204605447617391 | R59: of:=[.D59]*[.$G$151]/[.G60] -> 3.95155029585799 | S59: of:=[.K59]/[.R58] -> 8.8875 | T59: of:=AVERAGE([.R50:.R59]) -> 15.2025896166154 | U59: of:=[.K59]/[.T58] -> 5.28835390120968
A60: 1922 | B60: 7.3 | C60: 0.51 | D60: 0.69 | E60: 4.58 | F60: 4.3 | G60: 16.9 | H60: of:=(1+[.E60]/100)*[.G60]/[.G61] -> 1.052025 | I60: of:=[$Consumption.G38] -> 4952.36056486647 | J60: of:=[.J59]+1 -> 1922 | K60: of:=[.B60]*[.$G$151]/[.G60] -> 99.4700591715976 | L60: of:=[.O60]+[.L61]/(1+[$Calculations.$E$3]) -> 173.239017965847 | M60: of:=[.O60]+[.M61]/([.H60]+[$Calculations.$E$3]-[$Calculations.$E$1]+1) -> 210.856548829726 | N60: of:=([.I60]/[.I61])^4*([.O60]+[.N61]) -> 148.959157632483 | O60: of:=[.C60]*[.$G$151]/[.G61] -> 6.99064285714286 | P60: of:=([.K61]-[.K60]+[.O60])/[.K60] -> 0.296713959556425 | Q60: of:=LN(1+[.P60]) -> 0.259833340962757 | R60: of:=[.D60]*[.$G$151]/[.G61] -> 9.45792857142857 | S60: of:=[.K60]/[.R59] -> 25.1724137931034 | T60: of:=AVERAGE([.R51:.R60]) -> 14.5035253309011 | U60: of:=[.K60]/[.T59] -> 6.54296811793722
A61: 1923 | B61: 8.9 | C61: 0.53 | D61: 0.98 | E61: 4.96 | F61: 4.36 | G61: 16.8 | H61: of:=(1+[.E61]/100)*[.G61]/[.G62] -> 1.01926473988439 | I61: of:=[$Consumption.G39] -> 5310.28484651773 | J61: of:=[.J60]+1 -> 1923 | K61: of:=[.B61]*[.$G$151]/[.G61] -> 121.993571428571 | L61: of:=[.O61]+[.L62]/(1+[$Calculations.$E$3]) -> 177.105769809475 | M61: of:=[.O61]+[.M62]/([.H61]+[$Calculations.$E$3]-[$Calculations.$E$1]+1) -> 222.237043855459 | N61: of:=([.I61]/[.I62])^4*([.O61]+[.N62]) -> 189.929186559105 | O61: of:=[.C61]*[.$G$151]/[.G62] -> 7.05482080924856 | P61: of:=([.K62]-[.K61]+[.O61])/[.K61] -> 0.0212898616613626 | Q61: of:=LN(1+[.P61]) -> 0.0210663986568865 | R61: of:=[.D61]*[.$G$151]/[.G62] -> 13.0447630057803 | S61: of:=[.K61]/[.R60] -> 12.8985507246377 | T61: of:=AVERAGE([.R52:.R61]) -> 14.3572376314791 | U61: of:=[.K61]/[.T60] -> 8.41130474455429
A62: 1924 | B62: 8.83 | C62: 0.55 | D62: 0.93 | E62: 4.34 | F62: 4.06 | G62: 17.3 | H62: of:=(1+[.E62]/100)*[.G62]/[.G63] -> 1.0434 | I62: of:=[$Consumption.G40] -> 5595.71352320811 | J62: of:=[.J61]+1 -> 1924 | K62: of:=[.B62]*[.$G$151]/[.G62] -> 117.535976878613 | L62: of:=[.O62]+[.L63]/(1+[$Calculations.$E$3]) -> 181.15668324472 | M62: of:=[.O62]+[.M63]/([.H62]+[$Calculations.$E$3]-[$Calculations.$E$1]+1) -> 227.523692018893 | N62: of:=([.I62]/[.I63])^4*([.O62]+[.N63]) -> 227.121149096646 | O62: of:=[.C62]*[.$G$151]/[.G63] -> 7.32104046242775 | P62: of:=([.K63]-[.K62]+[.O62])/[.K62] -> 0.260475651189128 | Q62: of:=LN(1+[.P62]) -> 0.231489150671585 | R62: of:=[.D62]*[.$G$151]/[.G63] -> 12.3792138728324 | S62: of:=[.K62]/[.R61] -> 9.01020408163265 | T62: of:=AVERAGE([.R53:.R62]) -> 14.4095590187623 | U62: of:=[.K62]/[.T61] -> 8.18653141332063
A63: 1925 | B63: 10.58 | C63: 0.6 | D63: 1.25 | E63: 3.87 | F63: 3.86 | G63: 17.3 | H63: of:=(1+[.E63]/100)*[.G63]/[.G64] -> 1.00388324022346 | I63: of:=[$Consumption.G41] -> 5351.59563818976 | J63: of:=[.J62]+1 -> 1925 | K63: of:=[.B63]*[.$G$151]/[.G63] -> 140.830196531792 | L63: of:=[.O63]+[.L64]/(1+[$Calculations.$E$3]) -> 185.188548851392 | M63: of:=[.O63]+[.M64]/([.H63]+[$Calculations.$E$3]-[$Calculations.$E$1]+1) -> 238.146708307146 | N63: of:=([.I63]/[.I64])^4*([.O63]+[.N64]) -> 182.685631745606 | O63: of:=[.C63]*[.$G$151]/[.G64] -> 7.71888268156425 | P63: of:=([.K64]-[.K63]+[.O63])/[.K63] -> 0.210384302626438 | Q63: of:=LN(1+[.P63]) -> 0.190937914659102 | R63: of:=[.D63]*[.$G$151]/[.G64] -> 16.0810055865922 | S63: of:=[.K63]/[.R62] -> 11.3763440860215 | T63: of:=AVERAGE([.R54:.R63]) -> 14.0691365004985 | U63: of:=[.K63]/[.T62] -> 9.77338698210128
A64: 1926 | B64: 12.65 | C64: 0.69 | D64: 1.24 | E64: 4.28 | F64: 3.68 | G64: 17.9 | H64: of:=(1+[.E64]/100)*[.G64]/[.G65] -> 1.06663542857143 | I64: of:=[$Consumption.G42] -> 5712.11057755878 | J64: of:=[.J63]+1 -> 1926 | K64: of:=[.B64]*[.$G$151]/[.G64] -> 162.739776536313 | L64: of:=[.O64]+[.L65]/(1+[$Calculations.$E$3]) -> 189.059904039882 | M64: of:=[.O64]+[.M65]/([.H64]+[$Calculations.$E$3]-[$Calculations.$E$1]+1) -> 240.099358831134 | N64: of:=([.I64]/[.I65])^4*([.O64]+[.N65]) -> 229.395365472601 | O64: of:=[.C64]*[.$G$151]/[.G65] -> 9.07961142857143 | P64: of:=([.K65]-[.K64]+[.O64])/[.K64] -> 0.139293054771316 | Q64: of:=LN(1+[.P64]) -> 0.130407942654301 | R64: of:=[.D64]*[.$G$151]/[.G65] -> 16.3169828571429 | S64: of:=[.K64]/[.R63] -> 10.12 | T64: of:=AVERAGE([.R55:.R64]) -> 12.6894809400589 | U64: of:=[.K64]/[.T63] -> 11.5671474600127
A65: 1927 | B65: 13.4 | C65: 0.77 | D65: 1.11 | E65: 4.26 | F65: 3.34 | G65: 17.5 | H65: of:=(1+[.E65]/100)*[.G65]/[.G66] -> 1.05465317919075 | I65: of:=[$Consumption.G43] -> 5760.19675566048 | J65: of:=[.J64]+1 -> 1927 | K65: of:=[.B65]*[.$G$151]/[.G65] -> 176.328685714286 | L65: of:=[.O65]+[.L66]/(1+[$Calculations.$E$3]) -> 191.734495164951 | M65: of:=[.O65]+[.M66]/([.H65]+[$Calculations.$E$3]-[$Calculations.$E$1]+1) -> 255.21311949245 | N65: of:=([.I65]/[.I66])^4*([.O65]+[.N66]) -> 228.13830549861 | O65: of:=[.C65]*[.$G$151]/[.G66] -> 10.2494566473988 | P65: of:=([.K66]-[.K65]+[.O65])/[.K65] -> 0.381459753256837 | Q65: of:=LN(1+[.P65]) -> 0.323140732316245 | R65: of:=[.D65]*[.$G$151]/[.G66] -> 14.7751907514451 | S65: of:=[.K65]/[.R64] -> 10.8064516129032 | T65: of:=AVERAGE([.R56:.R65]) -> 12.0615828723463 | U65: of:=[.K65]/[.T64] -> 13.8956578718394
A66: 1928 | B66: 17.53 | C66: 0.85 | D66: 1.38 | E66: 4.64 | F66: 3.33 | G66: 17.3 | H66: of:=(1+[.E66]/100)*[.G66]/[.G67] -> 1.05863859649123 | I66: of:=[$Consumption.G44] -> 5818.53558085694 | J66: of:=[.J65]+1 -> 1928 | K66: of:=[.B66]*[.$G$151]/[.G66] -> 233.341526011561 | L66: of:=[.O66]+[.L67]/(1+[$Calculations.$E$3]) -> 193.337513431555 | M66: of:=[.O66]+[.M67]/([.H66]+[$Calculations.$E$3]-[$Calculations.$E$1]+1) -> 267.682085463607 | N66: of:=([.I66]/[.I67])^4*([.O66]+[.N67]) -> 227.272474866321 | O66: of:=[.C66]*[.$G$151]/[.G67] -> 11.4466666666667 | P66: of:=([.K67]-[.K66]+[.O66])/[.K66] -> 0.483782187928463 | Q66: of:=LN(1+[.P66]) -> 0.394594360339774 | R66: of:=[.D66]*[.$G$151]/[.G67] -> 18.584 | S66: of:=[.K66]/[.R65] -> 15.7927927927928 | T66: of:=AVERAGE([.R57:.R66]) -> 12.5383028723463 | U66: of:=[.K66]/[.T65] -> 19.3458461033788
A67: 1929 | B67: 24.86 | C67: 0.97 | D67: 1.61 | E67: 6.01 | F67: 3.6 | G67: 17.1 | H67: of:=(1+[.E67]/100)*[.G67]/[.G68] -> 1.0601 | I67: of:=[$Consumption.G45] -> 6071.47098375347 | J67: of:=[.J66]+1 -> 1929 | K67: of:=[.B67]*[.$G$151]/[.G67] -> 334.781333333333 | L67: of:=[.O67]+[.L68]/(1+[$Calculations.$E$3]) -> 193.769824315752 | M67: of:=[.O67]+[.M68]/([.H67]+[$Calculations.$E$3]-[$Calculations.$E$1]+1) -> 281.020411796644 | N67: of:=([.I67]/[.I68])^4*([.O67]+[.N68]) -> 257.996862849281 | O67: of:=[.C67]*[.$G$151]/[.G68] -> 13.0626666666667 | P67: of:=([.K68]-[.K67]+[.O67])/[.K67] -> -0.0876910699919548 | Q67: of:=LN(1+[.P67]) -> -0.0917766072230137 | R67: of:=[.D67]*[.$G$151]/[.G68] -> 21.6813333333333 | S67: of:=[.K67]/[.R66] -> 18.0144927536232 | T67: of:=AVERAGE([.R58:.R67]) -> 13.5967968274413 | U67: of:=[.K67]/[.T66] -> 26.7006896181864
A68: 1930 | B68: 21.71 | C68: 0.98 | D68: 0.97 | E68: 4.15 | F68: 3.29 | G68: 17.1 | H68: of:=(1+[.E68]/100)*[.G68]/[.G69] -> 1.12010377358491 | I68: of:=[$Consumption.G46] -> 5686.17862838706 | J68: of:=[.J67]+1 -> 1930 | K68: of:=[.B68]*[.$G$151]/[.G68] -> 292.361333333333 | L68: of:=[.O68]+[.L69]/(1+[$Calculations.$E$3]) -> 192.508830504942 | M68: of:=[.O68]+[.M69]/([.H68]+[$Calculations.$E$3]-[$Calculations.$E$1]+1) -> 294.268202993934 | N68: of:=([.I68]/[.I69])^4*([.O68]+[.N69]) -> 185.419149267664 | O68: of:=[.C68]*[.$G$151]/[.G69] -> 14.193358490566 | P68: of:=([.K69]-[.K68]+[.O68])/[.K68] -> -0.15983417779825 | Q68: of:=LN(1+[.P68]) -> -0.174155999244015 | R68: of:=[.D68]*[.$G$151]/[.G69] -> 14.0485283018868 | S68: of:=[.K68]/[.R67] -> 13.4844720496894 | T68: of:=AVERAGE([.R59:.R68]) -> 14.03204965763 | U68: of:=[.K68]/[.T67] -> 21.5022212248759
A69: 1931 | B69: 15.98 | C69: 0.82 | D69: 0.61 | E69: 2.43 | F69: 3.34 | G69: 15.9 | H69: of:=(1+[.E69]/100)*[.G69]/[.G70] -> 1.13890699300699 | I69: of:=[$Consumption.G47] -> 5469.07249894468 | J69: of:=[.J68]+1 -> 1931 | K69: of:=[.B69]*[.$G$151]/[.G69] -> 231.438641509434 | L69: of:=[.O69]+[.L70]/(1+[$Calculations.$E$3]) -> 189.960948005636 | M69: of:=[.O69]+[.M70]/([.H69]+[$Calculations.$E$3]-[$Calculations.$E$1]+1) -> 324.380613751393 | N69: of:=([.I69]/[.I70])^4*([.O69]+[.N70]) -> 144.48851204493 | O69: of:=[.C69]*[.$G$151]/[.G70] -> 13.2048671328671 | P69: of:=([.K70]-[.K69]+[.O69])/[.K69] -> -0.365430564429313 | Q69: of:=LN(1+[.P69]) -> -0.454808564291564 | R69: of:=[.D69]*[.$G$151]/[.G70] -> 9.82313286713287 | S69: of:=[.K69]/[.R68] -> 16.4742268041237 | T69: of:=AVERAGE([.R60:.R69]) -> 14.6192079147574 | U69: of:=[.K69]/[.T68] -> 16.4935734376901
A70: 1932 | B70: 8.3 | C70: 0.5 | D70: 0.41 | E70: 3.36 | F70: 3.68 | G70: 14.3 | H70: of:=(1+[.E70]/100)*[.G70]/[.G71] -> 1.14577364341085 | I70: of:=[$Consumption.G48] -> 4951.90058331912 | J70: of:=[.J69]+1 -> 1932 | K70: of:=[.B70]*[.$G$151]/[.G70] -> 133.659020979021 | L70: of:=[.O70]+[.L71]/(1+[$Calculations.$E$3]) -> 188.299715717574 | M70: of:=[.O70]+[.M71]/([.H70]+[$Calculations.$E$3]-[$Calculations.$E$1]+1) -> 366.252554432616 | N70: of:=([.I70]/[.I71])^4*([.O70]+[.N71]) -> 83.9056495268666 | O70: of:=[.C70]*[.$G$151]/[.G71] -> 8.92558139534884 | P70: of:=([.K71]-[.K70]+[.O70])/[.K70] -> 0.0137013168954889 | Q70: of:=LN(1+[.P70]) -> 0.0136083025032215 | R70: of:=[.D70]*[.$G$151]/[.G71] -> 7.31897674418605 | S70: of:=[.K70]/[.R69] -> 13.6065573770492 | T70: of:=AVERAGE([.R61:.R70]) -> 14.4053127320332 | U70: of:=[.K70]/[.T69] -> 9.14269923229549
A71: 1933 | B71: 7.09 | C71: 0.44 | D71: 0.44 | E71: 1.46 | F71: 3.31 | G71: 12.9 | H71: of:=(1+[.E71]/100)*[.G71]/[.G72] -> 0.991540909090909 | I71: of:=[$Consumption.G49] -> 4815.92623934862 | J71: of:=[.J70]+1 -> 1933 | K71: of:=[.B71]*[.$G$151]/[.G71] -> 126.564744186047 | L71: of:=[.O71]+[.L72]/(1+[$Calculations.$E$3]) -> 191.08874972326 | M71: of:=[.O71]+[.M72]/([.H71]+[$Calculations.$E$3]-[$Calculations.$E$1]+1) -> 423.025994623325 | N71: of:=([.I71]/[.I72])^4*([.O71]+[.N72]) -> 66.136887070949 | O71: of:=[.C71]*[.$G$151]/[.G72] -> 7.676 | P71: of:=([.K72]-[.K71]+[.O71])/[.K71] -> 0.513463264521093 | Q71: of:=LN(1+[.P71]) -> 0.41440057731265 | R71: of:=[.D71]*[.$G$151]/[.G72] -> 7.676 | S71: of:=[.K71]/[.R70] -> 17.2926829268293 | T71: of:=AVERAGE([.R62:.R71]) -> 13.8684364314552 | U71: of:=[.K71]/[.T70] -> 8.78597685037435
A72: 1934 | B72: 10.54 | C72: 0.45 | D72: 0.49 | E72: 1.01 | F72: 3.12 | G72: 13.2 | H72: of:=(1+[.E72]/100)*[.G72]/[.G73] -> 0.980391176470588 | I72: of:=[$Consumption.G50] -> 5123.65695907205 | J72: of:=[.J71]+1 -> 1934 | K72: of:=[.B72]*[.$G$151]/[.G72] -> 183.875090909091 | L72: of:=[.O72]+[.L73]/(1+[$Calculations.$E$3]) -> 195.391120131976 | M72: of:=[.O72]+[.M73]/([.H72]+[$Calculations.$E$3]-[$Calculations.$E$1]+1) -> 427.656707184767 | N72: of:=([.I72]/[.I73])^4*([.O72]+[.N73]) -> 77.0554469960181 | O72: of:=[.C72]*[.$G$151]/[.G73] -> 7.61955882352941 | P72: of:=([.K73]-[.K72]+[.O72])/[.K72] -> -0.105843286081036 | Q72: of:=LN(1+[.P72]) -> -0.111874223959664 | R72: of:=[.D72]*[.$G$151]/[.G73] -> 8.29685294117647 | S72: of:=[.K72]/[.R71] -> 23.9545454545455 | T72: of:=AVERAGE([.R63:.R72]) -> 13.4602003382896 | U72: of:=[.K72]/[.T71] -> 13.258530752035
A73: 1935 | B73: 9.26 | C73: 0.47 | D73: 0.76 | E73: 0.75 | F73: 2.79 | G73: 13.6 | H73: of:=(1+[.E73]/100)*[.G73]/[.G74] -> 0.992898550724638 | I73: of:=[$Consumption.G51] -> 5400.9604075974 | J73: of:=[.J72]+1 -> 1935 | K73: of:=[.B73]*[.$G$151]/[.G73] -> 156.793588235294 | L73: of:=[.O73]+[.L74]/(1+[$Calculations.$E$3]) -> 200.034598185486 | M73: of:=[.O73]+[.M74]/([.H73]+[$Calculations.$E$3]-[$Calculations.$E$1]+1) -> 427.799438176833 | N73: of:=([.I73]/[.I74])^4*([.O73]+[.N74]) -> 87.5213156089169 | O73: of:=[.C73]*[.$G$151]/[.G74] -> 7.84286956521739 | P73: of:=([.K74]-[.K73]+[.O73])/[.K73] -> 0.51444580085767 | Q73: of:=LN(1+[.P73]) -> 0.41504956402252 | R73: of:=[.D73]*[.$G$151]/[.G74] -> 12.6820869565217 | S73: of:=[.K73]/[.R72] -> 18.8979591836735 | T73: of:=AVERAGE([.R64:.R73]) -> 13.1203084752825 | U73: of:=[.K73]/[.T72] -> 11.6486816165188
A74: 1936 | B74: 13.76 | C74: 0.72 | D74: 1.02 | E74: 0.75 | F74: 2.65 | G74: 13.8 | H74: of:=(1+[.E74]/100)*[.G74]/[.G75] -> 0.986063829787234 | I74: of:=[$Consumption.G52] -> 5909.39074277582 | J74: of:=[.J73]+1 -> 1936 | K74: of:=[.B74]*[.$G$151]/[.G74] -> 229.61252173913 | L74: of:=[.O74]+[.L75]/(1+[$Calculations.$E$3]) -> 204.743439002336 | M74: of:=[.O74]+[.M75]/([.H74]+[$Calculations.$E$3]-[$Calculations.$E$1]+1) -> 432.969923286875 | N74: of:=([.I74]/[.I75])^4*([.O74]+[.N75]) -> 117.586919730019 | O74: of:=[.C74]*[.$G$151]/[.G75] -> 11.7589787234043 | P74: of:=([.K75]-[.K74]+[.O74])/[.K74] -> 0.302356506679862 | Q74: of:=LN(1+[.P74]) -> 0.264175320960258 | R74: of:=[.D74]*[.$G$151]/[.G75] -> 16.6585531914894 | S74: of:=[.K74]/[.R73] -> 18.1052631578947 | T74: of:=AVERAGE([.R65:.R74]) -> 13.1544655087172 | U74: of:=[.K74]/[.T73] -> 17.5005429309608
A75: 1937 | B75: 17.59 | C75: 0.8 | D75: 1.13 | E75: 0.88 | F75: 2.68 | G75: 14.1 | H75: of:=(1+[.E75]/100)*[.G75]/[.G76] -> 1.00169577464789 | I75: of:=[$Consumption.G53] -> 6090.5632983824 | J75: of:=[.J74]+1 -> 1937 | K75: of:=[.B75]*[.$G$151]/[.G75] -> 287.278382978723 | L75: of:=[.O75]+[.L76]/(1+[$Calculations.$E$3]) -> 205.587942598645 | M75: of:=[.O75]+[.M76]/([.H75]+[$Calculations.$E$3]-[$Calculations.$E$1]+1) -> 431.38430980383 | N75: of:=([.I75]/[.I76])^4*([.O75]+[.N76]) -> 120.924860179561 | O75: of:=[.C75]*[.$G$151]/[.G76] -> 12.9735211267606 | P75: of:=([.K76]-[.K75]+[.O75])/[.K75] -> -0.316388953390611 | Q75: of:=LN(1+[.P75]) -> -0.380366168407558 | R75: of:=[.D75]*[.$G$151]/[.G76] -> 18.3250985915493 | S75: of:=[.K75]/[.R74] -> 17.2450980392157 | T75: of:=AVERAGE([.R66:.R75]) -> 13.5094562927276 | U75: of:=[.K75]/[.T74] -> 21.8388487763604
A76: 1938 | B76: 11.31 | C76: 0.51 | D76: 0.64 | E76: 0.88 | F76: 2.56 | G76: 14.2 | H76: of:=(1+[.E76]/100)*[.G76]/[.G77] -> 1.02321142857143 | I76: of:=[$Consumption.G54] -> 5945.86308859311 | J76: of:=[.J75]+1 -> 1938 | K76: of:=[.B76]*[.$G$151]/[.G76] -> 183.413154929577 | L76: of:=[.O76]+[.L77]/(1+[$Calculations.$E$3]) -> 205.193737195202 | M76: of:=[.O76]+[.M77]/([.H76]+[$Calculations.$E$3]-[$Calculations.$E$1]+1) -> 435.057097078682 | N76: of:=([.I76]/[.I77])^4*([.O76]+[.N77]) -> 96.8626458250571 | O76: of:=[.C76]*[.$G$151]/[.G77] -> 8.38877142857143 | P76: of:=([.K77]-[.K76]+[.O76])/[.K76] -> 0.166742452949349 | Q76: of:=LN(1+[.P76]) -> 0.154215637388341 | R76: of:=[.D76]*[.$G$151]/[.G77] -> 10.5270857142857 | S76: of:=[.K76]/[.R75] -> 10.0088495575221 | T76: of:=AVERAGE([.R67:.R76]) -> 12.7037648641562 | U76: of:=[.K76]/[.T75] -> 13.5766496412082
A77: 1939 | B77: 12.5 | C77: 0.62 | D77: 0.9 | E77: 0.56 | F77: 2.36 | G77: 14 | H77: of:=(1+[.E77]/100)*[.G77]/[.G78] -> 1.0128345323741 | I77: of:=[$Consumption.G55] -> 6225.8148042089 | J77: of:=[.J76]+1 -> 1939 | K77: of:=[.B77]*[.$G$151]/[.G77] -> 205.607142857143 | L77: of:=[.O77]+[.L78]/(1+[$Calculations.$E$3]) -> 209.657958711692 | M77: of:=[.O77]+[.M78]/([.H77]+[$Calculations.$E$3]-[$Calculations.$E$1]+1) -> 452.823204942102 | N77: of:=([.I77]/[.I78])^4*([.O77]+[.N78]) -> 108.045679611484 | O77: of:=[.C77]*[.$G$151]/[.G78] -> 10.2714820143885 | P77: of:=([.K78]-[.K77]+[.O77])/[.K77] -> 0.0410359712230215 | Q77: of:=LN(1+[.P77]) -> 0.0402163435248128 | R77: of:=[.D77]*[.$G$151]/[.G78] -> 14.9102158273381 | S77: of:=[.K77]/[.R76] -> 19.53125 | T77: of:=AVERAGE([.R68:.R77]) -> 12.0266531135566 | U77: of:=[.K77]/[.T76] -> 16.1847409060023
A78: 1940 | B78: 12.3 | C78: 0.67 | D78: 1.05 | E78: 0.56 | F78: 2.21 | G78: 13.9 | H78: of:=(1+[.E78]/100)*[.G78]/[.G79] -> 0.991336170212766 | I78: of:=[$Consumption.G56] -> 6495.56048447913 | J78: of:=[.J77]+1 -> 1940 | K78: of:=[.B78]*[.$G$151]/[.G78] -> 203.772949640288 | L78: of:=[.O78]+[.L79]/(1+[$Calculations.$E$3]) -> 212.408063669707 | M78: of:=[.O78]+[.M79]/([.H78]+[$Calculations.$E$3]-[$Calculations.$E$1]+1) -> 465.087945311583 | N78: of:=([.I78]/[.I79])^4*([.O78]+[.N79]) -> 117.751853704013 | O78: of:=[.C78]*[.$G$151]/[.G79] -> 10.9423829787234 | P78: of:=([.K79]-[.K78]+[.O78])/[.K78] -> -0.100743815948798 | Q78: of:=LN(1+[.P78]) -> -0.106187319531298 | R78: of:=[.D78]*[.$G$151]/[.G79] -> 17.1485106382979 | S78: of:=[.K78]/[.R77] -> 13.6666666666667 | T78: of:=AVERAGE([.R69:.R78]) -> 12.3366513471978 | U78: of:=[.K78]/[.T77] -> 16.9434461704555
A79: 1941 | B79: 10.55 | C79: 0.71 | D79: 1.16 | E79: 0.53 | F79: 1.95 | G79: 14.1 | H79: of:=(1+[.E79]/100)*[.G79]/[.G80] -> 0.902849044585987 | I79: of:=[$Consumption.G57] -> 6892.7520014453 | J79: of:=[.J78]+1 -> 1941 | K79: of:=[.B79]*[.$G$151]/[.G79] -> 172.30170212766 | L79: of:=[.O79]+[.L80]/(1+[$Calculations.$E$3]) -> 214.623056890849 | M79: of:=[.O79]+[.M80]/([.H79]+[$Calculations.$E$3]-[$Calculations.$E$1]+1) -> 467.50879624552 | N79: of:=([.I79]/[.I80])^4*([.O79]+[.N80]) -> 138.361753590242 | O79: of:=[.C79]*[.$G$151]/[.G80] -> 10.4139363057325 | P79: of:=([.K80]-[.K79]+[.O79])/[.K79] -> -0.179376339541763 | Q79: of:=LN(1+[.P79]) -> -0.197690666269761 | R79: of:=[.D79]*[.$G$151]/[.G80] -> 17.0143184713376 | S79: of:=[.K79]/[.R78] -> 10.047619047619 | T79: of:=AVERAGE([.R70:.R79]) -> 13.0557699076182 | U79: of:=[.K79]/[.T78] -> 13.9666508583626
A80: 1942 | B80: 8.93 | C80: 0.59 | D80: 1.03 | E80: 0.63 | F80: 2.46 | G80: 15.7 | H80: of:=(1+[.E80]/100)*[.G80]/[.G81] -> 0.93484674556213 | I80: of:=[$Consumption.G58] -> 6662.80300707845 | J80: of:=[.J79]+1 -> 1942 | K80: of:=[.B80]*[.$G$151]/[.G80] -> 130.980917197452 | L80: of:=[.O80]+[.L81]/(1+[$Calculations.$E$3]) -> 217.545666113698 | M80: of:=[.O80]+[.M81]/([.H80]+[$Calculations.$E$3]-[$Calculations.$E$1]+1) -> 430.097866644497 | N80: of:=([.I80]/[.I81])^4*([.O80]+[.N81]) -> 110.387844858659 | O80: of:=[.C80]*[.$G$151]/[.G81] -> 8.03936094674556 | P80: of:=([.K81]-[.K80]+[.O80])/[.K80] -> 0.11104779448306 | Q80: of:=LN(1+[.P80]) -> 0.105303529068876 | R80: of:=[.D80]*[.$G$151]/[.G81] -> 14.0348165680473 | S80: of:=[.K80]/[.R79] -> 7.69827586206897 | T80: of:=AVERAGE([.R71:.R80]) -> 13.7273538900044 | U80: of:=[.K80]/[.T79] -> 10.0324161749376
A81: 1943 | B81: 10.09 | C81: 0.61 | D81: 0.94 | E81: 0.69 | F81: 2.47 | G81: 16.9 | H81: of:=(1+[.E81]/100)*[.G81]/[.G82] -> 0.977966091954023 | I81: of:=[$Consumption.G59] -> 6759.2795227207 | J81: of:=[.J80]+1 -> 1943 | K81: of:=[.B81]*[.$G$151]/[.G81] -> 137.486698224852 | L81: of:=[.O81]+[.L82]/(1+[$Calculations.$E$3]) -> 223.188800686144 | M81: of:=[.O81]+[.M82]/([.H81]+[$Calculations.$E$3]-[$Calculations.$E$1]+1) -> 410.635735760795 | N81: of:=([.I81]/[.I82])^4*([.O81]+[.N82]) -> 108.882303354214 | O81: of:=[.C81]*[.$G$151]/[.G82] -> 8.07303448275862 | P81: of:=([.K82]-[.K81]+[.O81])/[.K81] -> 0.199400795142567 | Q81: of:=LN(1+[.P81]) -> 0.181822094702334 | R81: of:=[.D81]*[.$G$151]/[.G82] -> 12.4404137931034 | S81: of:=[.K81]/[.R80] -> 9.79611650485437 | T81: of:=AVERAGE([.R72:.R81]) -> 14.2037952693147 | U81: of:=[.K81]/[.T80] -> 10.0155280709244
A82: 1944 | B82: 11.85 | C82: 0.64 | D82: 0.93 | E82: 0.72 | F82: 2.48 | G82: 17.4 | H82: of:=(1+[.E82]/100)*[.G82]/[.G83] -> 0.984566292134831 | I82: of:=[$Consumption.G60] -> 6872.80097762336 | J82: of:=[.J81]+1 -> 1944 | K82: of:=[.B82]*[.$G$151]/[.G82] -> 156.828620689655 | L82: of:=[.O82]+[.L83]/(1+[$Calculations.$E$3]) -> 229.164605949951 | M82: of:=[.O82]+[.M83]/([.H82]+[$Calculations.$E$3]-[$Calculations.$E$1]+1) -> 409.025814599854 | N82: of:=([.I82]/[.I83])^4*([.O82]+[.N83]) -> 108.310286192793 | O82: of:=[.C82]*[.$G$151]/[.G83] -> 8.27973033707865 | P82: of:=([.K83]-[.K82]+[.O82])/[.K82] -> 0.165609443891339 | Q82: of:=LN(1+[.P82]) -> 0.15324407803774 | R82: of:=[.D82]*[.$G$151]/[.G83] -> 12.0314831460674 | S82: of:=[.K82]/[.R81] -> 12.6063829787234 | T82: of:=AVERAGE([.R73:.R82]) -> 14.5772582898038 | U82: of:=[.K82]/[.T81] -> 11.0413180221248
A83: 1945 | B83: 13.49 | C83: 0.66 | D83: 0.96 | E83: 0.75 | F83: 2.37 | G83: 17.8 | H83: of:=(1+[.E83]/100)*[.G83]/[.G84] -> 0.985357142857143 | I83: of:=[$Consumption.G61] -> 7217.9069700584 | J83: of:=[.J82]+1 -> 1945 | K83: of:=[.B83]*[.$G$151]/[.G83] -> 174.521191011236 | L83: of:=[.O83]+[.L84]/(1+[$Calculations.$E$3]) -> 235.310485946757 | M83: of:=[.O83]+[.M84]/([.H83]+[$Calculations.$E$3]-[$Calculations.$E$1]+1) -> 409.825036315425 | N83: of:=([.I83]/[.I84])^4*([.O83]+[.N84]) -> 123.479106768905 | O83: of:=[.C83]*[.$G$151]/[.G84] -> 8.35081318681319 | P83: of:=([.K84]-[.K83]+[.O83])/[.K83] -> 0.354295815378098 | Q83: of:=LN(1+[.P83]) -> 0.303281625796322 | R83: of:=[.D83]*[.$G$151]/[.G84] -> 12.1466373626374 | S83: of:=[.K83]/[.R82] -> 14.505376344086 | T83: of:=AVERAGE([.R74:.R83]) -> 14.5237133304154 | U83: of:=[.K83]/[.T82] -> 11.9721546769399
A84: 1946 | B84: 18.02 | C84: 0.71 | D84: 1.06 | E84: 0.76 | F84: 2.19 | G84: 18.2 | H84: of:=(1+[.E84]/100)*[.G84]/[.G85] -> 0.85294511627907 | I84: of:=[$Consumption.G62] -> 8015.24029252142 | J84: of:=[.J83]+1 -> 1946 | K84: of:=[.B84]*[.$G$151]/[.G84] -> 228.002505494505 | L84: of:=[.O84]+[.L85]/(1+[$Calculations.$E$3]) -> 241.782017620164 | M84: of:=[.O84]+[.M85]/([.H84]+[$Calculations.$E$3]-[$Calculations.$E$1]+1) -> 410.887177436581 | N84: of:=([.I84]/[.I85])^4*([.O84]+[.N85]) -> 179.41414523992 | O84: of:=[.C84]*[.$G$151]/[.G85] -> 7.60459534883721 | P84: of:=([.K85]-[.K84]+[.O84])/[.K84] -> -0.252138450816922 | Q84: of:=LN(1+[.P84]) -> -0.290537412814822 | R84: of:=[.D84]*[.$G$151]/[.G85] -> 11.3533395348837 | S84: of:=[.K84]/[.R83] -> 18.7708333333333 | T84: of:=AVERAGE([.R75:.R84]) -> 13.9931919647548 | U84: of:=[.K84]/[.T83] -> 15.6986371396512
A85: 1947 | B85: 15.21 | C85: 0.84 | D85: 1.61 | E85: 1.01 | F85: 2.25 | G85: 21.5 | H85: of:=(1+[.E85]/100)*[.G85]/[.G86] -> 0.916335443037975 | I85: of:=[$Consumption.G63] -> 8007.9423446256 | J85: of:=[.J84]+1 -> 1947 | K85: of:=[.B85]*[.$G$151]/[.G85] -> 162.909711627907 | L85: of:=[.O85]+[.L86]/(1+[$Calculations.$E$3]) -> 249.471145905898 | M85: of:=[.O85]+[.M86]/([.H85]+[$Calculations.$E$3]-[$Calculations.$E$1]+1) -> 359.338471155475 | N85: of:=([.I85]/[.I86])^4*([.O85]+[.N86]) -> 171.157009055373 | O85: of:=[.C85]*[.$G$151]/[.G86] -> 8.16182278481013 | P85: of:=([.K86]-[.K85]+[.O85])/[.K85] -> -0.0653911345245329 | Q85: of:=LN(1+[.P85]) -> -0.0676271629107406 | R85: of:=[.D85]*[.$G$151]/[.G86] -> 15.6434936708861 | S85: of:=[.K85]/[.R84] -> 14.3490566037736 | T85: of:=AVERAGE([.R76:.R85]) -> 13.7250314726885 | U85: of:=[.K85]/[.T84] -> 11.6420693747527
A86: 1948 | B86: 14.83 | C86: 0.93 | D86: 2.29 | E86: 1.35 | F86: 2.44 | G86: 23.7 | H86: of:=(1+[.E86]/100)*[.G86]/[.G87] -> 1.00083125 | I86: of:=[$Consumption.G64] -> 8045.45701007427 | J86: of:=[.J85]+1 -> 1948 | K86: of:=[.B86]*[.$G$151]/[.G86] -> 144.095037974684 | L86: of:=[.O86]+[.L87]/(1+[$Calculations.$E$3]) -> 257.068818901954 | M86: of:=[.O86]+[.M87]/([.H86]+[$Calculations.$E$3]-[$Calculations.$E$1]+1) -> 335.17151782737 | N86: of:=([.I86]/[.I87])^4*([.O86]+[.N87]) -> 166.22505908196 | O86: of:=[.C86]*[.$G$151]/[.G87] -> 8.92335 | P86: of:=([.K87]-[.K86]+[.O86])/[.K86] -> 0.0847184760620364 | Q86: of:=LN(1+[.P86]) -> 0.0813204842572528 | R86: of:=[.D86]*[.$G$151]/[.G87] -> 21.97255 | S86: of:=[.K86]/[.R85] -> 9.2111801242236 | T86: of:=AVERAGE([.R77:.R86]) -> 14.8695779012599 | U86: of:=[.K86]/[.T85] -> 10.4987036467945
A87: 1949 | B87: 15.36 | C87: 1.14 | D87: 2.32 | E87: 1.58 | F87: 2.31 | G87: 24 | H87: of:=(1+[.E87]/100)*[.G87]/[.G88] -> 1.03741276595745 | I87: of:=[$Consumption.G65] -> 8125.39175247086 | J87: of:=[.J86]+1 -> 1949 | K87: of:=[.B87]*[.$G$151]/[.G87] -> 147.3792 | L87: of:=[.O87]+[.L88]/(1+[$Calculations.$E$3]) -> 264.351421575566 | M87: of:=[.O87]+[.M88]/([.H87]+[$Calculations.$E$3]-[$Calculations.$E$1]+1) -> 338.94577308198 | N87: of:=([.I87]/[.I88])^4*([.O87]+[.N88]) -> 164.006855465776 | O87: of:=[.C87]*[.$G$151]/[.G88] -> 11.171029787234 | P87: of:=([.K88]-[.K87]+[.O87])/[.K87] -> 0.19813829787234 | Q87: of:=LN(1+[.P87]) -> 0.180768933658498 | R87: of:=[.D87]*[.$G$151]/[.G88] -> 22.7340255319149 | S87: of:=[.K87]/[.R86] -> 6.70742358078603 | T87: of:=AVERAGE([.R78:.R87]) -> 15.6519588717176 | U87: of:=[.K87]/[.T86] -> 9.91145821210652
A88: 1950 | B88: 16.88 | C88: 1.47 | D88: 2.84 | E88: 1.32 | F88: 2.32 | G88: 23.5 | H88: of:=(1+[.E88]/100)*[.G88]/[.G89] -> 0.937409448818898 | I88: of:=[$Consumption.G66] -> 8502.69292565981 | J88: of:=[.J87]+1 -> 1950 | K88: of:=[.B88]*[.$G$151]/[.G88] -> 165.409634042553 | L88: of:=[.O88]+[.L89]/(1+[$Calculations.$E$3]) -> 269.715166593465 | M88: of:=[.O88]+[.M89]/([.H88]+[$Calculations.$E$3]-[$Calculations.$E$1]+1) -> 352.522259993123 | N88: of:=([.I88]/[.I89])^4*([.O88]+[.N89]) -> 185.486575040051 | O88: of:=[.C88]*[.$G$151]/[.G89] -> 13.3272283464567 | P88: of:=([.K89]-[.K88]+[.O88])/[.K88] -> 0.243096242116655 | Q88: of:=LN(1+[.P88]) -> 0.217605236817363 | R88: of:=[.D88]*[.$G$151]/[.G89] -> 25.747842519685 | S88: of:=[.K88]/[.R87] -> 7.27586206896552 | T88: of:=AVERAGE([.R79:.R88]) -> 16.5118920598563 | U88: of:=[.K88]/[.T87] -> 10.5679829213864
A89: 1951 | B89: 21.21 | C89: 1.41 | D89: 2.44 | E89: 2.12 | F89: 2.57 | G89: 25.4 | H89: of:=(1+[.E89]/100)*[.G89]/[.G90] -> 0.978810566037736 | I89: of:=[$Consumption.G67] -> 8492.65823496438 | J89: of:=[.J88]+1 -> 1951 | K89: of:=[.B89]*[.$G$151]/[.G89] -> 192.292866141732 | L89: of:=[.O89]+[.L90]/(1+[$Calculations.$E$3]) -> 273.132192380287 | M89: of:=[.O89]+[.M90]/([.H89]+[$Calculations.$E$3]-[$Calculations.$E$1]+1) -> 330.88417003653 | N89: of:=([.I89]/[.I90])^4*([.O89]+[.N90]) -> 171.285266908251 | O89: of:=[.C89]*[.$G$151]/[.G90] -> 12.2526339622642 | P89: of:=([.K90]-[.K89]+[.O89])/[.K89] -> 0.156876873671195 | Q89: of:=LN(1+[.P89]) -> 0.14572402394124 | R89: of:=[.D89]*[.$G$151]/[.G90] -> 21.2031396226415 | S89: of:=[.K89]/[.R88] -> 7.46830985915493 | T89: of:=AVERAGE([.R80:.R89]) -> 16.9307741749867 | U89: of:=[.K89]/[.T88] -> 11.645719669476
A90: 1952 | B90: 24.19 | C90: 1.41 | D90: 2.4 | E90: 2.39 | F90: 2.68 | G90: 26.5 | H90: of:=(1+[.E90]/100)*[.G90]/[.G91] -> 1.0200507518797 | I90: of:=[$Consumption.G68] -> 8612.56761281851 | J90: of:=[.J89]+1 -> 1952 | K90: of:=[.B90]*[.$G$151]/[.G90] -> 210.206535849057 | L90: of:=[.O90]+[.L91]/(1+[$Calculations.$E$3]) -> 277.91715251935 | M90: of:=[.O90]+[.M91]/([.H90]+[$Calculations.$E$3]-[$Calculations.$E$1]+1) -> 324.016217044604 | N90: of:=([.I90]/[.I91])^4*([.O90]+[.N91]) -> 168.913074484378 | O90: of:=[.C90]*[.$G$151]/[.G91] -> 12.2065714285714 | P90: of:=([.K91]-[.K90]+[.O90])/[.K90] -> 0.136266151115697 | Q90: of:=LN(1+[.P90]) -> 0.127747580811782 | R90: of:=[.D90]*[.$G$151]/[.G91] -> 20.7771428571429 | S90: of:=[.K90]/[.R89] -> 9.91393442622951 | T90: of:=AVERAGE([.R81:.R90]) -> 17.6050068038962 | U90: of:=[.K90]/[.T89] -> 12.4156481963839
A91: 1953 | B91: 26.18 | C91: 1.45 | D91: 2.51 | E91: 2.58 | F91: 2.83 | G91: 26.6 | H91: of:=(1+[.E91]/100)*[.G91]/[.G92] -> 1.01435985130112 | I91: of:=[$Consumption.G69] -> 8874.23939929859 | J91: of:=[.J90]+1 -> 1953 | K91: of:=[.B91]*[.$G$151]/[.G91] -> 226.644 | L91: of:=[.O91]+[.L92]/(1+[$Calculations.$E$3]) -> 283.063680952281 | M91: of:=[.O91]+[.M92]/([.H91]+[$Calculations.$E$3]-[$Calculations.$E$1]+1) -> 329.938128480634 | N91: of:=([.I91]/[.I92])^4*([.O91]+[.N92]) -> 178.18917917033 | O91: of:=[.C91]*[.$G$151]/[.G92] -> 12.4128624535316 | P91: of:=([.K92]-[.K91]+[.O91])/[.K91] -> 0.0164204918195735 | Q91: of:=LN(1+[.P91]) -> 0.0162871334369208 | R91: of:=[.D91]*[.$G$151]/[.G92] -> 21.487092936803 | S91: of:=[.K91]/[.R90] -> 10.9083333333333 | T91: of:=AVERAGE([.R82:.R91]) -> 18.5096747182662 | U91: of:=[.K91]/[.T90] -> 12.8738376829165
A92: 1954 | B92: 25.46 | C92: 1.54 | D92: 2.77 | E92: 1.8 | F92: 2.48 | G92: 26.9 | H92: of:=(1+[.E92]/100)*[.G92]/[.G93] -> 1.02562546816479 | I92: of:=[$Consumption.G70] -> 8897.17368568524 | J92: of:=[.J91]+1 -> 1954 | K92: of:=[.B92]*[.$G$151]/[.G92] -> 217.952743494424 | L92: of:=[.O92]+[.L93]/(1+[$Calculations.$E$3]) -> 288.326556746454 | M92: of:=[.O92]+[.M93]/([.H92]+[$Calculations.$E$3]-[$Calculations.$E$1]+1) -> 334.179047960548 | N92: of:=([.I92]/[.I93])^4*([.O92]+[.N93]) -> 167.625494257725 | O92: of:=[.C92]*[.$G$151]/[.G93] -> 13.2820674157303 | P92: of:=([.K93]-[.K92]+[.O92])/[.K92] -> 0.469685869881815 | Q92: of:=LN(1+[.P92]) -> 0.385048683996889 | R92: of:=[.D92]*[.$G$151]/[.G93] -> 23.8904719101124 | S92: of:=[.K92]/[.R91] -> 10.1434262948207 | T92: of:=AVERAGE([.R83:.R92]) -> 19.6955735946707 | U92: of:=[.K92]/[.T91] -> 11.7750715132416
A93: 1955 | B93: 35.6 | C93: 1.64 | D93: 3.62 | E93: 1.81 | F93: 2.61 | G93: 26.7 | H93: of:=(1+[.E93]/100)*[.G93]/[.G94] -> 1.01430111940299 | I93: of:=[$Consumption.G71] -> 9378.79158204927 | J93: of:=[.J92]+1 -> 1955 | K93: of:=[.B93]*[.$G$151]/[.G93] -> 307.04 | L93: of:=[.O93]+[.L94]/(1+[$Calculations.$E$3]) -> 293.007170644048 | M93: of:=[.O93]+[.M94]/([.H93]+[$Calculations.$E$3]-[$Calculations.$E$1]+1) -> 341.342706898755 | N93: of:=([.I93]/[.I94])^4*([.O93]+[.N94]) -> 193.693621320594 | O93: of:=[.C93]*[.$G$151]/[.G94] -> 14.0917611940299 | P93: of:=([.K94]-[.K93]+[.O93])/[.K93] -> 0.281436567164179 | Q93: of:=LN(1+[.P93]) -> 0.247981766700412 | R93: of:=[.D93]*[.$G$151]/[.G94] -> 31.1049850746269 | S93: of:=[.K93]/[.R92] -> 12.8519855595668 | T93: of:=AVERAGE([.R84:.R93]) -> 21.5914083658696 | U93: of:=[.K93]/[.T92] -> 15.5892895692604
A94: 1956 | B94: 44.15 | C94: 1.74 | D94: 3.41 | E94: 3.21 | F94: 2.9 | G94: 26.8 | H94: of:=(1+[.E94]/100)*[.G94]/[.G95] -> 1.00218405797101 | I94: of:=[$Consumption.G72] -> 9480.33936600009 | J94: of:=[.J93]+1 -> 1956 | K94: of:=[.B94]*[.$G$151]/[.G94] -> 379.36052238806 | L94: of:=[.O94]+[.L95]/(1+[$Calculations.$E$3]) -> 297.130893881346 | M94: of:=[.O94]+[.M95]/([.H94]+[$Calculations.$E$3]-[$Calculations.$E$1]+1) -> 344.395606656612 | N94: of:=([.I94]/[.I95])^4*([.O94]+[.N95]) -> 188.127870432321 | O94: of:=[.C94]*[.$G$151]/[.G95] -> 14.517652173913 | P94: of:=([.K95]-[.K94]+[.O94])/[.K94] -> 0.0374349631526252 | Q94: of:=LN(1+[.P94]) -> 0.0367512850399079 | R94: of:=[.D94]*[.$G$151]/[.G95] -> 28.4512608695652 | S94: of:=[.K94]/[.R93] -> 12.1961325966851 | T94: of:=AVERAGE([.R85:.R94]) -> 23.3012004993378 | U94: of:=[.K94]/[.T93] -> 17.5699757959156
A95: 1957 | B95: 45.43 | C95: 1.79 | D95: 3.37 | E95: 3.86 | F95: 3.46 | G95: 27.6 | H95: of:=(1+[.E95]/100)*[.G95]/[.G96] -> 1.00228531468531 | I95: of:=[$Consumption.G73] -> 9541.59146077077 | J95: of:=[.J94]+1 -> 1957 | K95: of:=[.B95]*[.$G$151]/[.G95] -> 379.044217391304 | L95: of:=[.O95]+[.L96]/(1+[$Calculations.$E$3]) -> 301.070225186975 | M95: of:=[.O95]+[.M96]/([.H95]+[$Calculations.$E$3]-[$Calculations.$E$1]+1) -> 343.163092855754 | N95: of:=([.I95]/[.I96])^4*([.O95]+[.N96]) -> 178.519487498418 | O95: of:=[.C95]*[.$G$151]/[.G96] -> 14.4126293706294 | P95: of:=([.K96]-[.K95]+[.O95])/[.K95] -> -0.0884954798668204 | Q95: of:=LN(1+[.P95]) -> -0.0926587258705813 | R95: of:=[.D95]*[.$G$151]/[.G96] -> 27.1343916083916 | S95: of:=[.K95]/[.R94] -> 13.3225806451613 | T95: of:=AVERAGE([.R86:.R95]) -> 24.4502902930883 | U95: of:=[.K95]/[.T94] -> 16.2671540207586
A96: 1958 | B96: 41.12 | C96: 1.75 | D96: 2.89 | E96: 2.54 | F96: 3.09 | G96: 28.6 | H96: of:=(1+[.E96]/100)*[.G96]/[.G97] -> 1.01125655172414 | I96: of:=[$Consumption.G74] -> 9458.97514596458 | J96: of:=[.J95]+1 -> 1958 | K96: of:=[.B96]*[.$G$151]/[.G96] -> 331.087888111888 | L96: of:=[.O96]+[.L97]/(1+[$Calculations.$E$3]) -> 305.378709088683 | M96: of:=[.O96]+[.M97]/([.H96]+[$Calculations.$E$3]-[$Calculations.$E$1]+1) -> 342.023482729702 | N96: of:=([.I96]/[.I97])^4*([.O96]+[.N97]) -> 158.003820450959 | O96: of:=[.C96]*[.$G$151]/[.G97] -> 13.8962068965517 | P96: of:=([.K97]-[.K96]+[.O96])/[.K96] -> 0.375940896283376 | Q96: of:=LN(1+[.P96]) -> 0.319137785306203 | R96: of:=[.D96]*[.$G$151]/[.G97] -> 22.9485931034483 | S96: of:=[.K96]/[.R95] -> 12.2017804154303 | T96: of:=AVERAGE([.R87:.R96]) -> 24.5478946034332 | U96: of:=[.K96]/[.T95] -> 13.5412661421644
A97: 1959 | B97: 55.62 | C97: 1.83 | D97: 3.39 | E97: 3.74 | F97: 4.02 | G97: 29 | H97: of:=(1+[.E97]/100)*[.G97]/[.G98] -> 1.02677815699659 | I97: of:=[$Consumption.G75] -> 9819.11128336877 | J97: of:=[.J96]+1 -> 1959 | K97: of:=[.B97]*[.$G$151]/[.G97] -> 441.66115862069 | L97: of:=[.O97]+[.L98]/(1+[$Calculations.$E$3]) -> 310.518721779836 | M97: of:=[.O97]+[.M98]/([.H97]+[$Calculations.$E$3]-[$Calculations.$E$1]+1) -> 344.31884197882 | N97: of:=([.I97]/[.I98])^4*([.O97]+[.N98]) -> 169.580095425013 | O97: of:=[.C97]*[.$G$151]/[.G98] -> 14.3826757679181 | P97: of:=([.K98]-[.K97]+[.O97])/[.K97] -> 0.0652121354927941 | Q97: of:=LN(1+[.P97]) -> 0.0631739675821864 | R97: of:=[.D97]*[.$G$151]/[.G98] -> 26.6433174061433 | S97: of:=[.K97]/[.R96] -> 19.2456747404844 | T97: of:=AVERAGE([.R88:.R97]) -> 24.938823790856 | U97: of:=[.K97]/[.T96] -> 17.9918141965185
A98: 1960 | B98: 58.03 | C98: 1.95 | D98: 3.27 | E98: 4.28 | F98: 4.72 | G98: 29.3 | H98: of:=(1+[.E98]/100)*[.G98]/[.G99] -> 1.0253033557047 | I98: of:=[$Consumption.G76] -> 9886.80230597561 | J98: of:=[.J97]+1 -> 1960 | K98: of:=[.B98]*[.$G$151]/[.G98] -> 456.080150170648 | L98: of:=[.O98]+[.L99]/(1+[$Calculations.$E$3]) -> 315.476180521953 | M98: of:=[.O98]+[.M99]/([.H98]+[$Calculations.$E$3]-[$Calculations.$E$1]+1) -> 351.338131682356 | N98: of:=([.I98]/[.I99])^4*([.O98]+[.N99]) -> 159.92220489941 | O98: of:=[.C98]*[.$G$151]/[.G99] -> 15.0686577181208 | P98: of:=([.K99]-[.K98]+[.O98])/[.K98] -> 0.0448952000064766 | Q98: of:=LN(1+[.P98]) -> 0.0439165933125474 | R98: of:=[.D98]*[.$G$151]/[.G99] -> 25.2689798657718 | S98: of:=[.K98]/[.R97] -> 17.117994100295 | T98: of:=AVERAGE([.R89:.R98]) -> 24.8909375254647 | U98: of:=[.K98]/[.T97] -> 18.2879575233967
A99: 1961 | B99: 59.72 | C99: 2.02 | D99: 3.19 | E99: 2.91 | F99: 3.84 | G99: 29.8 | H99: of:=(1+[.E99]/100)*[.G99]/[.G100] -> 1.02223933333333 | I99: of:=[$Consumption.G77] -> 9927.01255734689 | J99: of:=[.J98]+1 -> 1961 | K99: of:=[.B99]*[.$G$151]/[.G99] -> 461.487302013423 | L99: of:=[.O99]+[.L100]/(1+[$Calculations.$E$3]) -> 320.026620097441 | M99: of:=[.O99]+[.M100]/([.H99]+[$Calculations.$E$3]-[$Calculations.$E$1]+1) -> 357.586331381732 | N99: of:=([.I99]/[.I100])^4*([.O99]+[.N100]) -> 147.471116860076 | O99: of:=[.C99]*[.$G$151]/[.G100] -> 15.50552 | P99: of:=([.K100]-[.K99]+[.O99])/[.K99] -> 0.182452556374191 | Q99: of:=LN(1+[.P99]) -> 0.167590719119605 | R99: of:=[.D99]*[.$G$151]/[.G100] -> 24.48644 | S99: of:=[.K99]/[.R98] -> 18.262996941896 | T99: of:=AVERAGE([.R90:.R99]) -> 25.2192675632005 | U99: of:=[.K99]/[.T98] -> 18.540374445169
A100: 1962 | B100: 69.07 | C100: 2.13 | D100: 3.67 | E100: 3.39 | F100: 4.08 | G100: 30 | H100: of:=(1+[.E100]/100)*[.G100]/[.G101] -> 1.02029605263158 | I100: of:=[$Consumption.G78] -> 10259.5997892789 | J100: of:=[.J99]+1 -> 1962 | K100: of:=[.B100]*[.$G$151]/[.G100] -> 530.18132 | L100: of:=[.O100]+[.L101]/(1+[$Calculations.$E$3]) -> 324.408848030671 | M100: of:=[.O100]+[.M101]/([.H100]+[$Calculations.$E$3]-[$Calculations.$E$1]+1) -> 362.717918929348 | N100: of:=([.I100]/[.I101])^4*([.O100]+[.N101]) -> 152.744205455792 | O100: of:=[.C100]*[.$G$151]/[.G101] -> 16.13475 | P100: of:=([.K101]-[.K100]+[.O100])/[.K100] -> -0.0400185166840655 | Q100: of:=LN(1+[.P100]) -> -0.0408412829188434 | R100: of:=[.D100]*[.$G$151]/[.G101] -> 27.80025 | S100: of:=[.K100]/[.R99] -> 21.6520376175549 | T100: of:=AVERAGE([.R91:.R100]) -> 25.9215782774862 | U100: of:=[.K100]/[.T99] -> 21.0228674830204
A101: 1963 | B101: 65.06 | C101: 2.28 | D101: 4.02 | E101: 3.5 | F101: 3.83 | G101: 30.4 | H101: of:=(1+[.E101]/100)*[.G101]/[.G102] -> 1.01825242718447 | I101: of:=[$Consumption.G79] -> 10529.7562584778 | J101: of:=[.J100]+1 -> 1963 | K101: of:=[.B101]*[.$G$151]/[.G101] -> 492.8295 | L101: of:=[.O101]+[.L102]/(1+[$Calculations.$E$3]) -> 328.406947787276 | M101: of:=[.O101]+[.M102]/([.H101]+[$Calculations.$E$3]-[$Calculations.$E$1]+1) -> 366.818387061137 | N101: of:=([.I101]/[.I102])^4*([.O101]+[.N102]) -> 153.344423369226 | O101: of:=[.C101]*[.$G$151]/[.G102] -> 16.9915339805825 | P101: of:=([.K102]-[.K101]+[.O101])/[.K101] -> 0.190532612664237 | Q101: of:=LN(1+[.P101]) -> 0.174400780659647 | R101: of:=[.D101]*[.$G$151]/[.G102] -> 29.9587572815534 | S101: of:=[.K101]/[.R100] -> 17.7275204359673 | T101: of:=AVERAGE([.R92:.R101]) -> 26.7687447119613 | U101: of:=[.K101]/[.T100] -> 19.0123261293869
A102: 1964 | B102: 76.45 | C102: 2.5 | D102: 4.55 | E102: 4.09 | F102: 4.17 | G102: 30.9 | H102: of:=(1+[.E102]/100)*[.G102]/[.G103] -> 1.03089134615385 | I102: of:=[$Consumption.G80] -> 11007.9195038865 | J102: of:=[.J101]+1 -> 1964 | K102: of:=[.B102]*[.$G$151]/[.G102] -> 569.738058252427 | L102: of:=[.O102]+[.L103]/(1+[$Calculations.$E$3]) -> 331.753417479767 | M102: of:=[.O102]+[.M103]/([.H102]+[$Calculations.$E$3]-[$Calculations.$E$1]+1) -> 369.53653827637 | N102: of:=([.I102]/[.I103])^4*([.O102]+[.N103]) -> 166.162164912376 | O102: of:=[.C102]*[.$G$151]/[.G103] -> 18.4519230769231 | P102: of:=([.K103]-[.K102]+[.O102])/[.K102] -> 0.148042964230015 | Q102: of:=LN(1+[.P102]) -> 0.138058722484535 | R102: of:=[.D102]*[.$G$151]/[.G103] -> 33.5825 | S102: of:=[.K102]/[.R101] -> 19.0174129353234 | T102: of:=AVERAGE([.R93:.R102]) -> 27.73794752095 | U102: of:=[.K102]/[.T101] -> 21.2837047229132
A103: 1965 | B103: 86.12 | C103: 2.72 | D103: 5.19 | E103: 4.46 | F103: 4.19 | G103: 31.2 | H103: of:=(1+[.E103]/100)*[.G103]/[.G104] -> 1.02489056603774 | I103: of:=[$Consumption.G81] -> 11557.9398362542 | J103: of:=[.J102]+1 -> 1965 | K103: of:=[.B103]*[.$G$151]/[.G103] -> 635.631846153846 | L103: of:=[.O103]+[.L104]/(1+[$Calculations.$E$3]) -> 333.762674747306 | M103: of:=[.O103]+[.M104]/([.H103]+[$Calculations.$E$3]-[$Calculations.$E$1]+1) -> 375.302494298965 | N103: of:=([.I103]/[.I104])^4*([.O103]+[.N104]) -> 183.492972087649 | O103: of:=[.C103]*[.$G$151]/[.G104] -> 19.6969056603774 | P103: of:=([.K104]-[.K103]+[.O103])/[.K103] -> 0.0941468245274252 | Q103: of:=LN(1+[.P103]) -> 0.0899749038861955 | R103: of:=[.D103]*[.$G$151]/[.G104] -> 37.5834339622642 | S103: of:=[.K103]/[.R102] -> 18.9274725274725 | T103: of:=AVERAGE([.R94:.R103]) -> 28.3857924097138 | U103: of:=[.K103]/[.T102] -> 22.9156049009669
A104: 1966 | B104: 93.32 | C104: 2.87 | D104: 5.55 | E104: 5.44 | F104: 4.61 | G104: 31.8 | H104: of:=(1+[.E104]/100)*[.G104]/[.G105] -> 1.01914650455927 | I104: of:=[$Consumption.G82] -> 12074.8512206569 | J104: of:=[.J103]+1 -> 1966 | K104: of:=[.B104]*[.$G$151]/[.G104] -> 675.777660377358 | L104: of:=[.O104]+[.L105]/(1+[$Calculations.$E$3]) -> 334.576862893099 | M104: of:=[.O104]+[.M105]/([.H104]+[$Calculations.$E$3]-[$Calculations.$E$1]+1) -> 378.00141434326 | N104: of:=([.I104]/[.I105])^4*([.O104]+[.N105]) -> 198.890366619476 | O104: of:=[.C104]*[.$G$151]/[.G105] -> 20.0882553191489 | P104: of:=([.K105]-[.K104]+[.O104])/[.K104] -> -0.0955798722440156 | Q104: of:=LN(1+[.P104]) -> -0.100461283456681 | R104: of:=[.D104]*[.$G$151]/[.G105] -> 38.8466261398176 | S104: of:=[.K104]/[.R103] -> 17.980732177264 | T104: of:=AVERAGE([.R95:.R104]) -> 29.425328936739 | U104: of:=[.K104]/[.T103] -> 23.8068978531
A105: 1967 | B105: 84.45 | C105: 2.92 | D105: 5.33 | E105: 5.55 | F105: 4.58 | G105: 32.9 | H105: of:=(1+[.E105]/100)*[.G105]/[.G106] -> 1.01835630498534 | I105: of:=[$Consumption.G83] -> 12299.8972352347 | J105: of:=[.J104]+1 -> 1967 | K105: of:=[.B105]*[.$G$151]/[.G105] -> 591.098662613982 | L105: of:=[.O105]+[.L106]/(1+[$Calculations.$E$3]) -> 335.027316232568 | M105: of:=[.O105]+[.M106]/([.H105]+[$Calculations.$E$3]-[$Calculations.$E$1]+1) -> 378.398438931866 | N105: of:=([.I105]/[.I106])^4*([.O105]+[.N106]) -> 194.049145431232 | O105: of:=[.C105]*[.$G$151]/[.G106] -> 19.718991202346 | P105: of:=([.K106]-[.K105]+[.O105])/[.K105] -> 0.119156036385166 | Q105: of:=LN(1+[.P105]) -> 0.112574862312013 | R105: of:=[.D105]*[.$G$151]/[.G106] -> 35.9939120234604 | S105: of:=[.K105]/[.R104] -> 15.2162162162162 | T105: of:=AVERAGE([.R96:.R105]) -> 30.3112809782459 | U105: of:=[.K105]/[.T104] -> 20.0880902261033
A106: 1968 | B106: 95.04 | C106: 3.07 | D106: 5.76 | E106: 6.17 | F106: 5.53 | G106: 34.1 | H106: of:=(1+[.E106]/100)*[.G106]/[.G107] -> 1.0169654494382 | I106: of:=[$Consumption.G84] -> 12877.1554517032 | J106: of:=[.J105]+1 -> 1968 | K106: of:=[.B106]*[.$G$151]/[.G106] -> 641.81264516129 | L106: of:=[.O106]+[.L107]/(1+[$Calculations.$E$3]) -> 335.900568022394 | M106: of:=[.O106]+[.M107]/([.H106]+[$Calculations.$E$3]-[$Calculations.$E$1]+1) -> 378.925158082011 | N106: of:=([.I106]/[.I107])^4*([.O106]+[.N107]) -> 213.404241404304 | O106: of:=[.C106]*[.$G$151]/[.G107] -> 19.8584157303371 | P106: of:=([.K107]-[.K106]+[.O106])/[.K106] -> 0.0593561433624637 | Q106: of:=LN(1+[.P106]) -> 0.0576613116524146 | R106: of:=[.D106]*[.$G$151]/[.G107] -> 37.2587865168539 | S106: of:=[.K106]/[.R105] -> 17.8311444652908 | T106: of:=AVERAGE([.R97:.R106]) -> 31.7423003195865 | U106: of:=[.K106]/[.T105] -> 21.1740521828131
A107: 1969 | B107: 102.04 | C107: 3.16 | D107: 5.78 | E107: 8.05 | F107: 6.04 | G107: 35.6 | H107: of:=(1+[.E107]/100)*[.G107]/[.G108] -> 1.01761375661376 | I107: of:=[$Consumption.G85] -> 13224.5115758537 | J107: of:=[.J106]+1 -> 1969 | K107: of:=[.B107]*[.$G$151]/[.G107] -> 660.049752808989 | L107: of:=[.O107]+[.L108]/(1+[$Calculations.$E$3]) -> 336.682320277292 | M107: of:=[.O107]+[.M108]/([.H107]+[$Calculations.$E$3]-[$Calculations.$E$1]+1) -> 378.834903631549 | N107: of:=([.I107]/[.I108])^4*([.O107]+[.N108]) -> 217.520344457091 | O107: of:=[.C107]*[.$G$151]/[.G108] -> 19.2509206349206 | P107: of:=([.K108]-[.K107]+[.O107])/[.K107] -> -0.137299616915454 | Q107: of:=LN(1+[.P107]) -> -0.147687828846676 | R107: of:=[.D107]*[.$G$151]/[.G108] -> 35.212126984127 | S107: of:=[.K107]/[.R106] -> 17.7152777777778 | T107: of:=AVERAGE([.R98:.R107]) -> 32.5991812773848 | U107: of:=[.K107]/[.T106] -> 20.7940113401834
A108: 1970 | B108: 90.31 | C108: 3.14 | D108: 5.13 | E108: 9.11 | F108: 7.79 | G108: 37.8 | H108: of:=(1+[.E108]/100)*[.G108]/[.G109] -> 1.03627085427136 | I108: of:=[$Consumption.G86] -> 13375.3591962943 | J108: of:=[.J107]+1 -> 1970 | K108: of:=[.B108]*[.$G$151]/[.G108] -> 550.174253968254 | L108: of:=[.O108]+[.L109]/(1+[$Calculations.$E$3]) -> 338.162296976447 | M108: of:=[.O108]+[.M109]/([.H108]+[$Calculations.$E$3]-[$Calculations.$E$1]+1) -> 379.613741464633 | N108: of:=([.I108]/[.I109])^4*([.O108]+[.N109]) -> 208.365260887611 | O108: of:=[.C108]*[.$G$151]/[.G109] -> 18.1678190954774 | P108: of:=([.K109]-[.K108]+[.O108])/[.K108] -> 0.0162132776605873 | Q108: of:=LN(1+[.P108]) -> 0.0160832460836597 | R108: of:=[.D108]*[.$G$151]/[.G109] -> 29.6818190954774 | S108: of:=[.K108]/[.R107] -> 15.6245674740484 | T108: of:=AVERAGE([.R99:.R108]) -> 33.0404652003554 | U108: of:=[.K108]/[.T107] -> 16.8769347084777
A109: 1971 | B109: 93.49 | C109: 3.07 | D109: 5.7 | E109: 5.66 | F109: 6.24 | G109: 39.8 | H109: of:=(1+[.E109]/100)*[.G109]/[.G110] -> 1.0231795620438 | I109: of:=[$Consumption.G87] -> 13711.9873981657 | J109: of:=[.J108]+1 -> 1971 | K109: of:=[.B109]*[.$G$151]/[.G109] -> 540.92656281407 | L109: of:=[.O109]+[.L110]/(1+[$Calculations.$E$3]) -> 340.892765435054 | M109: of:=[.O109]+[.M110]/([.H109]+[$Calculations.$E$3]-[$Calculations.$E$1]+1) -> 388.322927550553 | N109: of:=([.I109]/[.I110])^4*([.O109]+[.N110]) -> 211.979076137361 | O109: of:=[.C109]*[.$G$151]/[.G110] -> 17.2009635036496 | P109: of:=([.K110]-[.K109]+[.O109])/[.K109] -> 0.101780926125307 | Q109: of:=LN(1+[.P109]) -> 0.096927894348552 | R109: of:=[.D109]*[.$G$151]/[.G110] -> 31.9366423357664 | S109: of:=[.K109]/[.R108] -> 18.224171539961 | T109: of:=AVERAGE([.R100:.R109]) -> 33.785485433932 | U109: of:=[.K109]/[.T108] -> 16.3716388233012
A110: 1972 | B110: 103.3 | C110: 3.15 | D110: 6.42 | E110: 4.62 | F110: 5.95 | G110: 41.1 | H110: of:=(1+[.E110]/100)*[.G110]/[.G111] -> 1.00936197183099 | I110: of:=[$Consumption.G88] -> 14396.6179501066 | J110: of:=[.J109]+1 -> 1972 | K110: of:=[.B110]*[.$G$151]/[.G110] -> 578.781605839416 | L110: of:=[.O110]+[.L111]/(1+[$Calculations.$E$3]) -> 344.831555343581 | M110: of:=[.O110]+[.M111]/([.H110]+[$Calculations.$E$3]-[$Calculations.$E$1]+1) -> 393.860010562779 | N110: of:=([.I110]/[.I111])^4*([.O110]+[.N111]) -> 240.391582823871 | O110: of:=[.C110]*[.$G$151]/[.G111] -> 17.0277464788732 | P110: of:=([.K111]-[.K110]+[.O110])/[.K110] -> 0.135424648569052 | Q110: of:=LN(1+[.P110]) -> 0.127006720668974 | R110: of:=[.D110]*[.$G$151]/[.G111] -> 34.7041690140845 | S110: of:=[.K110]/[.R109] -> 18.1228070175439 | T110: of:=AVERAGE([.R101:.R110]) -> 34.4758773353405 | U110: of:=[.K110]/[.T109] -> 17.1310726605137
A111: 1973 | B111: 118.42 | C111: 3.38 | D111: 8.16 | E111: 7.93 | F111: 6.46 | G111: 42.6 | H111: of:=(1+[.E111]/100)*[.G111]/[.G112] -> 0.986656223175966 | I111: of:=[$Consumption.G89] -> 14959.1753084321 | J111: of:=[.J110]+1 -> 1973 | K111: of:=[.B111]*[.$G$151]/[.G111] -> 640.135154929577 | L111: of:=[.O111]+[.L112]/(1+[$Calculations.$E$3]) -> 349.212110358982 | M111: of:=[.O111]+[.M112]/([.H111]+[$Calculations.$E$3]-[$Calculations.$E$1]+1) -> 394.713257705162 | N111: of:=([.I111]/[.I112])^4*([.O111]+[.N112]) -> 263.197942198844 | O111: of:=[.C111]*[.$G$151]/[.G112] -> 16.7027124463519 | P111: of:=([.K112]-[.K111]+[.O111])/[.K111] -> -0.231970226001437 | Q111: of:=LN(1+[.P111]) -> -0.263926778358637 | R111: of:=[.D111]*[.$G$151]/[.G112] -> 40.3237081545064 | S111: of:=[.K111]/[.R110] -> 18.4454828660436 | T111: of:=AVERAGE([.R102:.R111]) -> 35.5123724226358 | U111: of:=[.K111]/[.T110] -> 18.5676247975679
A112: 1974 | B112: 96.11 | C112: 3.6 | D112: 8.89 | E112: 11.03 | F112: 6.99 | G112: 46.6 | H112: of:=(1+[.E112]/100)*[.G112]/[.G113] -> 0.993089827255278 | I112: of:=[$Consumption.G90] -> 14709.7212391479 | J112: of:=[.J111]+1 -> 1974 | K112: of:=[.B112]*[.$G$151]/[.G112] -> 474.940145922747 | L112: of:=[.O112]+[.L113]/(1+[$Calculations.$E$3]) -> 354.225013313337 | M112: of:=[.O112]+[.M113]/([.H112]+[$Calculations.$E$3]-[$Calculations.$E$1]+1) -> 387.364436838676 | N112: of:=([.I112]/[.I113])^4*([.O112]+[.N113]) -> 229.373510839632 | O112: of:=[.C112]*[.$G$151]/[.G113] -> 15.9118618042227 | P112: of:=([.K113]-[.K112]+[.O112])/[.K112] -> -0.291228001504195 | Q112: of:=LN(1+[.P112]) -> -0.344221385979804 | R112: of:=[.D112]*[.$G$151]/[.G113] -> 39.2934587332054 | S112: of:=[.K112]/[.R111] -> 11.7781862745098 | T112: of:=AVERAGE([.R103:.R112]) -> 36.0834682959563 | U112: of:=[.K112]/[.T111] -> 13.3739345901886
A113: 1975 | B113: 72.56 | C113: 3.68 | D113: 7.96 | E113: 7.24 | F113: 7.5 | G113: 52.1 | H113: of:=(1+[.E113]/100)*[.G113]/[.G114] -> 1.0048928057554 | I113: of:=[$Consumption.G91] -> 14902.6481982159 | J113: of:=[.J112]+1 -> 1975 | K113: of:=[.B113]*[.$G$151]/[.G113] -> 320.712414587332 | L113: of:=[.O113]+[.L114]/(1+[$Calculations.$E$3]) -> 360.407800049255 | M113: of:=[.O113]+[.M114]/([.H113]+[$Calculations.$E$3]-[$Calculations.$E$1]+1) -> 383.033968085099 | N113: of:=([.I113]/[.I114])^4*([.O113]+[.N114]) -> 225.733959274141 | O113: of:=[.C113]*[.$G$151]/[.G114] -> 15.2415539568345 | P113: of:=([.K114]-[.K113]+[.O113])/[.K113] -> 0.298388136238528 | Q113: of:=LN(1+[.P113]) -> 0.261123599960333 | R113: of:=[.D113]*[.$G$151]/[.G114] -> 32.9681438848921 | S113: of:=[.K113]/[.R112] -> 8.16197975253093 | T113: of:=AVERAGE([.R104:.R113]) -> 35.6219392882191 | U113: of:=[.K113]/[.T112] -> 8.88807062438819
A114: 1976 | B114: 96.86 | C114: 4.05 | D114: 9.91 | E114: 5.7 | F114: 7.74 | G114: 55.6 | H114: of:=(1+[.E114]/100)*[.G114]/[.G115] -> 1.00460170940171 | I114: of:=[$Consumption.G92] -> 15572.3238239848 | J114: of:=[.J113]+1 -> 1976 | K114: of:=[.B114]*[.$G$151]/[.G114] -> 401.16764028777 | L114: of:=[.O114]+[.L115]/(1+[$Calculations.$E$3]) -> 367.708458422366 | M114: of:=[.O114]+[.M115]/([.H114]+[$Calculations.$E$3]-[$Calculations.$E$1]+1) -> 383.600734227786 | N114: of:=([.I114]/[.I115])^4*([.O114]+[.N115]) -> 253.885158682213 | O114: of:=[.C114]*[.$G$151]/[.G115] -> 15.9424615384615 | P114: of:=([.K115]-[.K114]+[.O114])/[.K114] -> 0.0583635558238078 | Q114: of:=LN(1+[.P114]) -> 0.0567238999527238 | R114: of:=[.D114]*[.$G$151]/[.G115] -> 39.0098256410256 | S114: of:=[.K114]/[.R113] -> 12.1683417085427 | T114: of:=AVERAGE([.R105:.R114]) -> 35.6382592383399 | U114: of:=[.K114]/[.T113] -> 11.2618135986898
A115: 1977 | B115: 103.81 | C115: 4.67 | D115: 10.89 | E115: 5.28 | F115: 7.21 | G115: 58.5 | H115: of:=(1+[.E115]/100)*[.G115]/[.G116] -> 0.9854208 | I115: of:=[$Consumption.G93] -> 16070.003606048 | J115: of:=[.J114]+1 -> 1977 | K115: of:=[.B115]*[.$G$151]/[.G115] -> 408.638748717949 | L115: of:=[.O115]+[.L116]/(1+[$Calculations.$E$3]) -> 374.739227557477 | M115: of:=[.O115]+[.M116]/([.H115]+[$Calculations.$E$3]-[$Calculations.$E$1]+1) -> 383.353803187604 | N115: of:=([.I115]/[.I116])^4*([.O115]+[.N116]) -> 271.987928874942 | O115: of:=[.C115]*[.$G$151]/[.G116] -> 17.2065216 | P115: of:=([.K116]-[.K115]+[.O115])/[.K115] -> -0.144156439649359 | Q115: of:=LN(1+[.P115]) -> -0.155667676142136 | R115: of:=[.D115]*[.$G$151]/[.G116] -> 40.1239872 | S115: of:=[.K115]/[.R114] -> 10.4752774974773 | T115: of:=AVERAGE([.R106:.R115]) -> 36.0512667559939 | U115: of:=[.K115]/[.T114] -> 11.466293737443
A116: 1978 | B116: 90.25 | C116: 5.07 | D116: 12.33 | E116: 7.78 | F116: 7.96 | G116: 62.5 | H116: of:=(1+[.E116]/100)*[.G116]/[.G117] -> 0.986273792093705 | I116: of:=[$Consumption.G94] -> 16599.4568732244 | J116: of:=[.J115]+1 -> 1978 | K116: of:=[.B116]*[.$G$151]/[.G116] -> 332.52432 | L116: of:=[.O116]+[.L117]/(1+[$Calculations.$E$3]) -> 380.88255045657 | M116: of:=[.O116]+[.M117]/([.H116]+[$Calculations.$E$3]-[$Calculations.$E$1]+1) -> 374.755269222762 | N116: of:=([.I116]/[.I117])^4*([.O116]+[.N117]) -> 292.436464162351 | O116: of:=[.C116]*[.$G$151]/[.G117] -> 17.0939912152269 | P116: of:=([.K117]-[.K116]+[.O116])/[.K116] -> 0.0624059570981859 | Q116: of:=LN(1+[.P116]) -> 0.0605361069326948 | R116: of:=[.D116]*[.$G$151]/[.G117] -> 41.5717774524158 | S116: of:=[.K116]/[.R115] -> 8.28741965105601 | T116: of:=AVERAGE([.R107:.R116]) -> 36.4825658495501 | U116: of:=[.K116]/[.T115] -> 9.22365148083776
A117: 1979 | B117: 99.71 | C117: 5.65 | D117: 14.86 | E117: 10.88 | F117: 9.1 | G117: 68.3 | H117: of:=(1+[.E117]/100)*[.G117]/[.G118] -> 0.973406683804627 | I117: of:=[$Consumption.G95] -> 16816.0673890457 | J117: of:=[.J116]+1 -> 1979 | K117: of:=[.B117]*[.$G$151]/[.G117] -> 336.181827232796 | L117: of:=[.O117]+[.L118]/(1+[$Calculations.$E$3]) -> 387.546962730853 | M117: of:=[.O117]+[.M118]/([.H117]+[$Calculations.$E$3]-[$Calculations.$E$1]+1) -> 366.374845068672 | N117: of:=([.I117]/[.I118])^4*([.O117]+[.N118]) -> 290.908172316214 | O117: of:=[.C117]*[.$G$151]/[.G118] -> 16.7234190231362 | P117: of:=([.K118]-[.K117]+[.O117])/[.K117] -> 0.025894889524093 | Q117: of:=LN(1+[.P117]) -> 0.0255652946429308 | R117: of:=[.D117]*[.$G$151]/[.G118] -> 43.9840719794344 | S117: of:=[.K117]/[.R116] -> 8.0867802108678 | T117: of:=AVERAGE([.R108:.R117]) -> 37.3597603490808 | U117: of:=[.K117]/[.T116] -> 9.21486248031928
A118: 1980 | B118: 110.87 | C118: 6.16 | D118: 14.82 | E118: 11.37 | F118: 10.8 | G118: 77.8 | H118: of:=(1+[.E118]/100)*[.G118]/[.G119] -> 0.995929425287356 | I118: of:=[$Consumption.G96] -> 16576.5745729404 | J118: of:=[.J117]+1 -> 1980 | K118: of:=[.B118]*[.$G$151]/[.G118] -> 328.163799485861 | L118: of:=[.O118]+[.L119]/(1+[$Calculations.$E$3]) -> 395.041389901647 | M118: of:=[.O118]+[.M119]/([.H118]+[$Calculations.$E$3]-[$Calculations.$E$1]+1) -> 353.670849336571 | N118: of:=([.I118]/[.I119])^4*([.O118]+[.N119]) -> 257.963091517974 | O118: of:=[.C118]*[.$G$151]/[.G119] -> 16.3048827586207 | P118: of:=([.K119]-[.K118]+[.O118])/[.K118] -> 0.12219177684541 | Q118: of:=LN(1+[.P118]) -> 0.115283716599287 | R118: of:=[.D118]*[.$G$151]/[.G119] -> 39.2270068965517 | S118: of:=[.K118]/[.R117] -> 7.46096904441454 | T118: of:=AVERAGE([.R109:.R118]) -> 38.3142791291883 | U118: of:=[.K118]/[.T117] -> 8.78388395481063
A119: 1981 | B119: 132.97 | C119: 6.63 | D119: 15.36 | E119: 17.63 | F119: 12.57 | G119: 87 | H119: of:=(1+[.E119]/100)*[.G119]/[.G120] -> 1.08523966065748 | I119: of:=[$Consumption.G97] -> 16646.1725230561 | J119: of:=[.J118]+1 -> 1981 | K119: of:=[.B119]*[.$G$151]/[.G119] -> 351.957834482759 | L119: of:=[.O119]+[.L120]/(1+[$Calculations.$E$3]) -> 403.471135333855 | M119: of:=[.O119]+[.M120]/([.H119]+[$Calculations.$E$3]-[$Calculations.$E$1]+1) -> 348.842568632955 | N119: of:=([.I119]/[.I120])^4*([.O119]+[.N120]) -> 246.017876433149 | O119: of:=[.C119]*[.$G$151]/[.G120] -> 16.1904178154825 | P119: of:=([.K120]-[.K119]+[.O119])/[.K119] -> -0.140273629521677 | Q119: of:=LN(1+[.P119]) -> -0.151141114225041 | R119: of:=[.D119]*[.$G$151]/[.G120] -> 37.5090222693531 | S119: of:=[.K119]/[.R118] -> 8.972334682861 | T119: of:=AVERAGE([.R110:.R119]) -> 38.8715171225469 | U119: of:=[.K119]/[.T118] -> 9.18607481289223
A120: 1982 | B120: 117.28 | C120: 6.87 | D120: 12.64 | E120: 14.6 | F120: 14.59 | G120: 94.3 | H120: of:=(1+[.E120]/100)*[.G120]/[.G121] -> 1.10498773006135 | I120: of:=[$Consumption.G98] -> 16719.585381705 | J120: of:=[.J119]+1 -> 1982 | K120: of:=[.B120]*[.$G$151]/[.G120] -> 286.39701378579 | L120: of:=[.O120]+[.L121]/(1+[$Calculations.$E$3]) -> 412.573353355237 | M120: of:=[.O120]+[.M121]/([.H120]+[$Calculations.$E$3]-[$Calculations.$E$1]+1) -> 373.677638963757 | N120: of:=([.I120]/[.I121])^4*([.O120]+[.N121]) -> 234.196199886447 | O120: of:=[.C120]*[.$G$151]/[.G121] -> 16.1761104294479 | P120: of:=([.K121]-[.K120]+[.O120])/[.K120] -> 0.242591271269428 | Q120: of:=LN(1+[.P120]) -> 0.217198934052873 | R120: of:=[.D120]*[.$G$151]/[.G121] -> 29.7621595092025 | S120: of:=[.K120]/[.R119] -> 7.63541666666667 | T120: of:=AVERAGE([.R111:.R120]) -> 38.3773161720587 | U120: of:=[.K120]/[.T119] -> 7.36778584902901
A121: 1983 | B121: 144.27 | C121: 7.09 | D121: 14.03 | E121: 9.37 | F121: 10.46 | G121: 97.8 | H121: of:=(1+[.E121]/100)*[.G121]/[.G122] -> 1.04969440628067 | I121: of:=[$Consumption.G99] -> 17515.6372339881 | J121: of:=[.J120]+1 -> 1983 | K121: of:=[.B121]*[.$G$151]/[.G121] -> 339.698319018405 | L121: of:=[.O121]+[.L122]/(1+[$Calculations.$E$3]) -> 422.285263316536 | M121: of:=[.O121]+[.M122]/([.H121]+[$Calculations.$E$3]-[$Calculations.$E$1]+1) -> 408.651617960933 | N121: of:=([.I121]/[.I122])^4*([.O121]+[.N122]) -> 265.909931993984 | O121: of:=[.C121]*[.$G$151]/[.G122] -> 16.0224259077527 | P121: of:=([.K122]-[.K121]+[.O121])/[.K121] -> 0.154085680451541 | Q121: of:=LN(1+[.P121]) -> 0.143308411821577 | R121: of:=[.D121]*[.$G$151]/[.G122] -> 31.705872423945 | S121: of:=[.K121]/[.R120] -> 11.4137658227848 | T121: of:=AVERAGE([.R112:.R121]) -> 37.5155325990026 | U121: of:=[.K121]/[.T120] -> 8.85153921382674
A122: 1984 | B122: 166.39 | C122: 7.53 | D122: 16.64 | E122: 11.11 | F122: 11.67 | G122: 101.9 | H122: of:=(1+[.E122]/100)*[.G122]/[.G123] -> 1.07318568720379 | I122: of:=[$Consumption.G100] -> 18284.4037685181 | J122: of:=[.J121]+1 -> 1984 | K122: of:=[.B122]*[.$G$151]/[.G122] -> 376.018539744848 | L122: of:=[.O122]+[.L123]/(1+[$Calculations.$E$3]) -> 432.79516276305 | M122: of:=[.O122]+[.M123]/([.H122]+[$Calculations.$E$3]-[$Calculations.$E$1]+1) -> 427.095453746975 | N122: of:=([.I122]/[.I123])^4*([.O122]+[.N123]) -> 299.735313073984 | O122: of:=[.C122]*[.$G$151]/[.G123] -> 16.4360985781991 | P122: of:=([.K123]-[.K122]+[.O122])/[.K122] -> 0.039889211351507 | Q122: of:=LN(1+[.P122]) -> 0.0391141799321913 | R122: of:=[.D122]*[.$G$151]/[.G123] -> 36.3209402843602 | S122: of:=[.K122]/[.R121] -> 11.8595866001426 | T122: of:=AVERAGE([.R113:.R122]) -> 37.2182807541181 | U122: of:=[.K122]/[.T121] -> 10.0230095028651
A123: 1985 | B123: 171.61 | C123: 7.9 | D123: 14.61 | E123: 8.35 | F123: 11.38 | G123: 105.5 | H123: of:=(1+[.E123]/100)*[.G123]/[.G124] -> 1.04296760948905 | I123: of:=[$Consumption.G101] -> 19063.9459696557 | J123: of:=[.J122]+1 -> 1985 | K123: of:=[.B123]*[.$G$151]/[.G123] -> 374.581524170616 | L123: of:=[.O123]+[.L124]/(1+[$Calculations.$E$3]) -> 443.550756699998 | M123: of:=[.O123]+[.M124]/([.H123]+[$Calculations.$E$3]-[$Calculations.$E$1]+1) -> 456.355277233088 | N123: of:=([.I123]/[.I124])^4*([.O123]+[.N124]) -> 337.778041051752 | O123: of:=[.C123]*[.$G$151]/[.G124] -> 16.5986496350365 | P123: of:=([.K124]-[.K123]+[.O123])/[.K123] -> 0.212087531267851 | Q123: of:=LN(1+[.P123]) -> 0.192344105557376 | R123: of:=[.D123]*[.$G$151]/[.G124] -> 30.696996350365 | S123: of:=[.K123]/[.R122] -> 10.3131009615385 | T123: of:=AVERAGE([.R114:.R123]) -> 36.9911660006653 | U123: of:=[.K123]/[.T122] -> 10.0644499579463
A124: 1986 | B124: 208.19 | C124: 8.28 | D124: 14.48 | E124: 7.31 | F124: 9.19 | G124: 109.6 | H124: of:=(1+[.E124]/100)*[.G124]/[.G125] -> 1.05765971223022 | I124: of:=[$Consumption.G102] -> 19657.785054109 | J124: of:=[.J123]+1 -> 1986 | K124: of:=[.B124]*[.$G$151]/[.G124] -> 437.426945255475 | L124: of:=[.O124]+[.L125]/(1+[$Calculations.$E$3]) -> 454.835612944036 | M124: of:=[.O124]+[.M125]/([.H124]+[$Calculations.$E$3]-[$Calculations.$E$1]+1) -> 475.401734696835 | N124: of:=([.I124]/[.I125])^4*([.O124]+[.N125]) -> 365.273993163585 | O124: of:=[.C124]*[.$G$151]/[.G125] -> 17.1467482014388 | P124: of:=([.K125]-[.K124]+[.O124])/[.K124] -> 0.291440338290873 | Q124: of:=LN(1+[.P124]) -> 0.255758136815682 | R124: of:=[.D124]*[.$G$151]/[.G125] -> 29.9861007194245 | S124: of:=[.K124]/[.R123] -> 14.2498288843258 | T124: of:=AVERAGE([.R115:.R124]) -> 36.0887935085052 | U124: of:=[.K124]/[.T123] -> 11.825173211561
A125: 1987 | B125: 264.51 | C125: 8.81 | D125: 17.5 | E125: 6.25 | F125: 7.08 | G125: 111.2 | H125: of:=(1+[.E125]/100)*[.G125]/[.G126] -> 1.02117545375972 | I125: of:=[$Consumption.G103] -> 20132.1707824179 | J125: of:=[.J124]+1 -> 1987 | K125: of:=[.B125]*[.$G$151]/[.G125] -> 547.764053956835 | L125: of:=[.O125]+[.L126]/(1+[$Calculations.$E$3]) -> 466.273569751206 | M125: of:=[.O125]+[.M126]/([.H125]+[$Calculations.$E$3]-[$Calculations.$E$1]+1) -> 502.132234072277 | N125: of:=([.I125]/[.I126])^4*([.O125]+[.N126]) -> 384.683705607408 | O125: of:=[.C125]*[.$G$151]/[.G126] -> 17.5347173725151 | P125: of:=([.K126]-[.K125]+[.O125])/[.K125] -> -0.0578607426193741 | Q125: of:=LN(1+[.P125]) -> -0.0596021837175377 | R125: of:=[.D125]*[.$G$151]/[.G126] -> 34.8305963699222 | S125: of:=[.K125]/[.R124] -> 18.2672651933702 | T125: of:=AVERAGE([.R116:.R125]) -> 35.5594544254974 | U125: of:=[.K125]/[.T124] -> 15.1782312652746
A126: 1988 | B126: 250.48 | C126: 9.75 | D126: 23.75 | E126: 7.63 | F126: 8.67 | G126: 115.7 | H126: of:=(1+[.E126]/100)*[.G126]/[.G127] -> 1.02830644095789 | I126: of:=[$Consumption.G104] -> 20758.540895106 | J126: of:=[.J125]+1 -> 1988 | K126: of:=[.B126]*[.$G$151]/[.G126] -> 498.535301642178 | L126: of:=[.O126]+[.L127]/(1+[$Calculations.$E$3]) -> 478.045213025289 | M126: of:=[.O126]+[.M127]/([.H126]+[$Calculations.$E$3]-[$Calculations.$E$1]+1) -> 513.316842126312 | N126: of:=([.I126]/[.I127])^4*([.O126]+[.N127]) -> 417.304457713987 | O126: of:=[.C126]*[.$G$151]/[.G127] -> 18.5402972749794 | P126: of:=([.K127]-[.K126]+[.O126])/[.K126] -> 0.12583219244649 | Q126: of:=LN(1+[.P126]) -> 0.1185224888126 | R126: of:=[.D126]*[.$G$151]/[.G127] -> 45.1622625928984 | S126: of:=[.K126]/[.R125] -> 14.3131428571429 | T126: of:=AVERAGE([.R117:.R126]) -> 35.9185029395457 | U126: of:=[.K126]/[.T125] -> 14.0197680109712
A127: 1989 | B127: 285.41 | C127: 11.06 | D127: 22.87 | E127: 9.29 | F127: 9.09 | G127: 121.1 | H127: of:=(1+[.E127]/100)*[.G127]/[.G128] -> 1.03885549450549 | I127: of:=[$Consumption.G105] -> 21142.7633571314 | J127: of:=[.J126]+1 -> 1989 | K127: of:=[.B127]*[.$G$151]/[.G127] -> 542.726794384806 | L127: of:=[.O127]+[.L128]/(1+[$Calculations.$E$3]) -> 489.51438943078 | M127: of:=[.O127]+[.M128]/([.H127]+[$Calculations.$E$3]-[$Calculations.$E$1]+1) -> 527.627368312384 | N127: of:=([.I127]/[.I128])^4*([.O127]+[.N128]) -> 430.528338545018 | O127: of:=[.C127]*[.$G$151]/[.G128] -> 19.9913406593407 | P127: of:=([.K128]-[.K127]+[.O127])/[.K127] -> 0.169094893754156 | Q127: of:=LN(1+[.P127]) -> 0.156229854348663 | R127: of:=[.D127]*[.$G$151]/[.G128] -> 41.3383328100471 | S127: of:=[.K127]/[.R126] -> 12.0172631578947 | T127: of:=AVERAGE([.R118:.R127]) -> 35.653929022607 | U127: of:=[.K127]/[.T126] -> 15.1099503032815
A128: 1990 | B128: 339.97 | C128: 12.09 | D128: 21.34 | E128: 8.43 | F128: 8.21 | G128: 127.4 | H128: of:=(1+[.E128]/100)*[.G128]/[.G129] -> 1.02629881129272 | I128: of:=[$Consumption.G106] -> 21332.497075325 | J128: of:=[.J127]+1 -> 1990 | K128: of:=[.B128]*[.$G$151]/[.G128] -> 614.507783359498 | L128: of:=[.O128]+[.L129]/(1+[$Calculations.$E$3]) -> 500.186789444319 | M128: of:=[.O128]+[.M129]/([.H128]+[$Calculations.$E$3]-[$Calculations.$E$1]+1) -> 546.695739615747 | N128: of:=([.I128]/[.I129])^4*([.O128]+[.N129]) -> 426.200399594188 | O128: of:=[.C128]*[.$G$151]/[.G129] -> 20.6841396731055 | P128: of:=([.K129]-[.K128]+[.O128])/[.K128] -> -0.0601179695035586 | Q128: of:=LN(1+[.P128]) -> -0.062000911065676 | R128: of:=[.D128]*[.$G$151]/[.G129] -> 36.5094739970282 | S128: of:=[.K128]/[.R127] -> 14.8653257542632 | T128: of:=AVERAGE([.R119:.R128]) -> 35.3821757326546 | U128: of:=[.K128]/[.T127] -> 17.2353454501426
A129: 1991 | B129: 325.5 | C129: 12.2 | D129: 15.97 | E129: 6.92 | F129: 8.09 | G129: 134.6 | H129: of:=(1+[.E129]/100)*[.G129]/[.G130] -> 1.04210224475018 | I129: of:=[$Consumption.G107] -> 21086.6914744718 | J129: of:=[.J128]+1 -> 1991 | K129: of:=[.B129]*[.$G$151]/[.G129] -> 556.880683506687 | L129: of:=[.O129]+[.L130]/(1+[$Calculations.$E$3]) -> 510.818140976632 | M129: of:=[.O129]+[.M130]/([.H129]+[$Calculations.$E$3]-[$Calculations.$E$1]+1) -> 559.880246901918 | N129: of:=([.I129]/[.I130])^4*([.O129]+[.N130]) -> 386.209450735725 | O129: of:=[.C129]*[.$G$151]/[.G130] -> 20.3433454018827 | P129: of:=([.K130]-[.K129]+[.O129])/[.K129] -> 0.282413798856769 | Q129: of:=LN(1+[.P129]) -> 0.248744082436826 | R129: of:=[.D129]*[.$G$151]/[.G130] -> 26.6297726285301 | S129: of:=[.K129]/[.R128] -> 15.253045923149 | T129: of:=AVERAGE([.R120:.R129]) -> 34.2942507685723 | U129: of:=[.K129]/[.T128] -> 15.7390175130676
A130: 1992 | B130: 416.08 | C130: 12.39 | D130: 19.09 | E130: 3.91 | F130: 7.03 | G130: 138.1 | H130: of:=(1+[.E130]/100)*[.G130]/[.G131] -> 1.00630932678822 | I130: of:=[$Consumption.G108] -> 21489.4521771637 | J130: of:=[.J129]+1 -> 1992 | K130: of:=[.B130]*[.$G$151]/[.G130] -> 693.808127443881 | L130: of:=[.O130]+[.L131]/(1+[$Calculations.$E$3]) -> 522.506858702302 | M130: of:=[.O130]+[.M131]/([.H130]+[$Calculations.$E$3]-[$Calculations.$E$1]+1) -> 582.802946264256 | N130: of:=([.I130]/[.I131])^4*([.O130]+[.N131]) -> 396.229061016777 | O130: of:=[.C130]*[.$G$151]/[.G131] -> 20.0081991584853 | P130: of:=([.K131]-[.K130]+[.O130])/[.K130] -> 0.0418538362322706 | Q130: of:=LN(1+[.P130]) -> 0.0410016611622172 | R130: of:=[.D130]*[.$G$151]/[.G131] -> 30.8278064516129 | S130: of:=[.K130]/[.R129] -> 26.0538509705698 | T130: of:=AVERAGE([.R121:.R130]) -> 34.4008154628134 | U130: of:=[.K130]/[.T129] -> 20.2310332459485
A131: 1993 | B131: 435.23 | C131: 12.58 | D131: 21.89 | E131: 3.44 | F131: 6.6 | G131: 142.6 | H131: of:=(1+[.E131]/100)*[.G131]/[.G132] -> 1.00892913816689 | I131: of:=[$Consumption.G109] -> 21921.1970694889 | J131: of:=[.J130]+1 -> 1993 | K131: of:=[.B131]*[.$G$151]/[.G131] -> 702.83846002805 | L131: of:=[.O131]+[.L132]/(1+[$Calculations.$E$3]) -> 535.315980493319 | M131: of:=[.O131]+[.M132]/([.H131]+[$Calculations.$E$3]-[$Calculations.$E$1]+1) -> 587.781797325911 | N131: of:=([.I131]/[.I132])^4*([.O131]+[.N132]) -> 409.03597910632 | O131: of:=[.C131]*[.$G$151]/[.G132] -> 19.8147906976744 | P131: of:=([.K132]-[.K131]+[.O131])/[.K131] -> 0.0881911172773942 | Q131: of:=LN(1+[.P131]) -> 0.08451679226978 | R131: of:=[.D131]*[.$G$151]/[.G132] -> 34.4789958960328 | S131: of:=[.K131]/[.R130] -> 22.7988475641697 | T131: of:=AVERAGE([.R122:.R131]) -> 34.6781278100221 | U131: of:=[.K131]/[.T130] -> 20.4308662621038
A132: 1994 | B132: 472.99 | C132: 13.17 | D132: 30.6 | E132: 4.35 | F132: 5.75 | G132: 146.2 | H132: of:=(1+[.E132]/100)*[.G132]/[.G133] -> 1.01503459747172 | I132: of:=[$Consumption.G110] -> 22467.6955149957 | J132: of:=[.J131]+1 -> 1994 | K132: of:=[.B132]*[.$G$151]/[.G132] -> 745.007778385773 | L132: of:=[.O132]+[.L133]/(1+[$Calculations.$E$3]) -> 549.167683574418 | M132: of:=[.O132]+[.M133]/([.H132]+[$Calculations.$E$3]-[$Calculations.$E$1]+1) -> 594.671662071621 | N132: of:=([.I132]/[.I133])^4*([.O132]+[.N133]) -> 431.561313326133 | O132: of:=[.C132]*[.$G$151]/[.G133] -> 20.1782275449102 | P132: of:=([.K133]-[.K132]+[.O132])/[.K132] -> -0.0161117822988105 | Q132: of:=LN(1+[.P132]) -> -0.0162429882800058 | R132: of:=[.D132]*[.$G$151]/[.G133] -> 46.8833532934132 | S132: of:=[.K132]/[.R131] -> 21.6075833714025 | T132: of:=AVERAGE([.R123:.R132]) -> 35.7343691109274 | U132: of:=[.K132]/[.T131] -> 21.4835063319209
A133: 1995 | B133: 465.25 | C133: 13.79 | D133: 33.96 | E133: 6.45 | F133: 7.78 | G133: 150.3 | H133: of:=(1+[.E133]/100)*[.G133]/[.G134] -> 1.03623283678756 | I133: of:=[$Consumption.G111] -> 22802.9768781791 | J133: of:=[.J132]+1 -> 1995 | K133: of:=[.B133]*[.$G$151]/[.G133] -> 712.826147704591 | L133: of:=[.O133]+[.L134]/(1+[$Calculations.$E$3]) -> 563.53684521694 | M133: of:=[.O133]+[.M134]/([.H133]+[$Calculations.$E$3]-[$Calculations.$E$1]+1) -> 605.012495643923 | N133: of:=([.I133]/[.I134])^4*([.O133]+[.N134]) -> 437.725917728609 | O133: of:=[.C133]*[.$G$151]/[.G134] -> 20.5671062176166 | P133: of:=([.K134]-[.K133]+[.O133])/[.K133] -> 0.314407861949534 | Q133: of:=LN(1+[.P133]) -> 0.273386269121035 | R133: of:=[.D133]*[.$G$151]/[.G134] -> 50.6496683937824 | S133: of:=[.K133]/[.R132] -> 15.2042483660131 | T133: of:=AVERAGE([.R124:.R133]) -> 37.7296363152692 | U133: of:=[.K133]/[.T132] -> 19.9479147229889
A134: 1996 | B134: 614.42 | C134: 14.9 | D134: 38.73 | E134: 5.68 | F134: 5.65 | G134: 154.4 | H134: of:=(1+[.E134]/100)*[.G134]/[.G135] -> 1.02558089252043 | I134: of:=[$Consumption.G112] -> 23325.448437975 | J134: of:=[.J133]+1 -> 1996 | K134: of:=[.B134]*[.$G$151]/[.G134] -> 916.377186528497 | L134: of:=[.O134]+[.L135]/(1+[$Calculations.$E$3]) -> 578.430156360009 | M134: of:=[.O134]+[.M135]/([.H134]+[$Calculations.$E$3]-[$Calculations.$E$1]+1) -> 627.882345744049 | N134: of:=([.I134]/[.I135])^4*([.O134]+[.N135]) -> 458.676229202214 | O134: of:=[.C134]*[.$G$151]/[.G135] -> 21.5661345065996 | P134: of:=([.K135]-[.K134]+[.O134])/[.K134] -> 0.23375671692216 | Q134: of:=LN(1+[.P134]) -> 0.210063756064542 | R134: of:=[.D134]*[.$G$151]/[.G135] -> 56.0574758013828 | S134: of:=[.K134]/[.R133] -> 18.0924617196702 | T134: of:=AVERAGE([.R125:.R134]) -> 40.336773823465 | U134: of:=[.K134]/[.T133] -> 24.2879941611746
A135: 1997 | B135: 766.22 | C135: 15.5 | D135: 39.72 | E135: 5.78 | F135: 6.58 | G135: 159.1 | H135: of:=(1+[.E135]/100)*[.G135]/[.G136] -> 1.04143551980198 | I135: of:=[$Consumption.G113] -> 23898.9148513691 | J135: of:=[.J134]+1 -> 1997 | K135: of:=[.B135]*[.$G$151]/[.G135] -> 1109.02037460717 | L135: of:=[.O135]+[.L136]/(1+[$Calculations.$E$3]) -> 593.231850868086 | M135: of:=[.O135]+[.M136]/([.H135]+[$Calculations.$E$3]-[$Calculations.$E$1]+1) -> 644.920197026879 | N135: of:=([.I135]/[.I136])^4*([.O135]+[.N136]) -> 483.908018802214 | O135: of:=[.C135]*[.$G$151]/[.G136] -> 22.0875 | P135: of:=([.K136]-[.K135]+[.O135])/[.K135] -> 0.257754620147614 | Q135: of:=LN(1+[.P135]) -> 0.229328083725907 | R135: of:=[.D135]*[.$G$151]/[.G136] -> 56.601 | S135: of:=[.K135]/[.R134] -> 19.7836302607798 | T135: of:=AVERAGE([.R126:.R135]) -> 42.5138141864728 | U135: of:=[.K135]/[.T134] -> 27.4940276448688
A136: 1998 | B136: 963.36 | C136: 16.2 | D136: 37.71 | E136: 5.68 | F136: 5.54 | G136: 161.6 | H136: of:=(1+[.E136]/100)*[.G136]/[.G137] -> 1.03943323189288 | I136: of:=[$Consumption.G114] -> 24861.1282110706 | J136: of:=[.J135]+1 -> 1998 | K136: of:=[.B136]*[.$G$151]/[.G136] -> 1372.788 | L136: of:=[.O136]+[.L137]/(1+[$Calculations.$E$3]) -> 608.444803545809 | M136: of:=[.O136]+[.M137]/([.H136]+[$Calculations.$E$3]-[$Calculations.$E$1]+1) -> 672.363063177096 | N136: of:=([.I136]/[.I137])^4*([.O136]+[.N137]) -> 544.586679153637 | O136: of:=[.C136]*[.$G$151]/[.G137] -> 22.7056360316494 | P136: of:=([.K137]-[.K136]+[.O136])/[.K136] -> 0.291502969470921 | Q136: of:=LN(1+[.P136]) -> 0.255806632793021 | R136: of:=[.D136]*[.$G$151]/[.G137] -> 52.8536749847839 | S136: of:=[.K136]/[.R135] -> 24.2537764350453 | T136: of:=AVERAGE([.R127:.R136]) -> 43.2829554256613 | U136: of:=[.K136]/[.T135] -> 32.2903984568103
A137: 1999 | B137: 1248.77 | C137: 16.69 | D137: 48.17 | E137: 5.31 | F137: 4.72 | G137: 164.3 | H137: of:=(1+[.E137]/100)*[.G137]/[.G138] -> 1.02502565165877 | I137: of:=[$Consumption.G115] -> 25922.5713140108 | J137: of:=[.J136]+1 -> 1999 | K137: of:=[.B137]*[.$G$151]/[.G137] -> 1750.2541424224 | L137: of:=[.O137]+[.L138]/(1+[$Calculations.$E$3]) -> 623.992782499834 | M137: of:=[.O137]+[.M138]/([.H137]+[$Calculations.$E$3]-[$Calculations.$E$1]+1) -> 700.020211343586 | N137: of:=([.I137]/[.I138])^4*([.O137]+[.N138]) -> 621.012867024278 | O137: of:=[.C137]*[.$G$151]/[.G138] -> 22.7687985781991 | P137: of:=([.K138]-[.K137]+[.O137])/[.K137] -> 0.124170657860985 | Q137: of:=LN(1+[.P137]) -> 0.117045570783539 | R137: of:=[.D137]*[.$G$151]/[.G138] -> 65.7143815165877 | S137: of:=[.K137]/[.R136] -> 33.1150888358526 | T137: of:=AVERAGE([.R128:.R137]) -> 45.7205602963154 | U137: of:=[.K137]/[.T136] -> 40.4374915069852
A138: 2000 | B138: 1425.59 | C138: 16.27 | D138: 50 | E138: 6.61 | F138: 6.66 | G138: 168.8 | H138: of:=(1+[.E138]/100)*[.G138]/[.G139] -> 1.02774231867504 | I138: of:=[$Consumption.G116] -> 26939.6238841696 | J138: of:=[.J137]+1 -> 2000 | K138: of:=[.B138]*[.$G$151]/[.G138] -> 1944.8155521327 | L138: of:=[.O138]+[.L139]/(1+[$Calculations.$E$3]) -> 640.488885564969 | M138: of:=[.O138]+[.M139]/([.H138]+[$Calculations.$E$3]-[$Calculations.$E$1]+1) -> 719.995785595697 | N138: of:=([.I138]/[.I139])^4*([.O138]+[.N139]) -> 701.591099861928 | O138: of:=[.C138]*[.$G$151]/[.G139] -> 21.397233580811 | P138: of:=([.K139]-[.K138]+[.O138])/[.K138] -> -0.0858105102928336 | Q138: of:=LN(1+[.P138]) -> -0.0897174098611841 | R138: of:=[.D138]*[.$G$151]/[.G139] -> 65.7567104511708 | S138: of:=[.K138]/[.R137] -> 29.5949761262196 | T138: of:=AVERAGE([.R129:.R138]) -> 48.6452839417297 | U138: of:=[.K138]/[.T137] -> 42.5370017236957
A139: 2001 | B139: 1335.63 | C139: 15.74 | D139: 24.69 | E139: 4.63 | F139: 5.16 | G139: 175.1 | H139: of:=(1+[.E139]/100)*[.G139]/[.G140] -> 1.03448407679277 | I139: of:=[$Consumption.G117] -> 27388.9391294594 | J139: of:=[.J138]+1 -> 2001 | K139: of:=[.B139]*[.$G$151]/[.G139] -> 1756.53270359794 | L139: of:=[.O139]+[.L140]/(1+[$Calculations.$E$3]) -> 659.523460217768 | M139: of:=[.O139]+[.M140]/([.H139]+[$Calculations.$E$3]-[$Calculations.$E$1]+1) -> 744.588098147993 | N139: of:=([.I139]/[.I140])^4*([.O139]+[.N140]) -> 728.184167526023 | O139: of:=[.C139]*[.$G$151]/[.G140] -> 20.4664438170525 | P139: of:=([.K140]-[.K139]+[.O139])/[.K139] -> -0.144302094639161 | Q139: of:=LN(1+[.P139]) -> -0.155837879427387 | R139: of:=[.D139]*[.$G$151]/[.G140] -> 32.1039706380576 | S139: of:=[.K139]/[.R138] -> 26.7126 | T139: of:=AVERAGE([.R130:.R139]) -> 49.1927037426824 | U139: of:=[.K139]/[.T138] -> 36.1090029960978
A140: 2002 | B140: 1140.21 | C140: 16.07 | D140: 27.59 | E140: 1.85 | F140: 5.04 | G140: 177.1 | H140: of:=(1+[.E140]/100)*[.G140]/[.G141] -> 0.992715189873418 | I140: of:=[$Consumption.G118] -> 27848.5011542935 | J140: of:=[.J139]+1 -> 2002 | K140: of:=[.B140]*[.$G$151]/[.G140] -> 1482.59491134952 | L140: of:=[.O140]+[.L141]/(1+[$Calculations.$E$3]) -> 680.792728156231 | M140: of:=[.O140]+[.M141]/([.H140]+[$Calculations.$E$3]-[$Calculations.$E$1]+1) -> 776.673268684787 | N140: of:=([.I140]/[.I141])^4*([.O140]+[.N141]) -> 757.834741764478 | O140: of:=[.C140]*[.$G$151]/[.G141] -> 20.3665360484315 | P140: of:=([.K141]-[.K140]+[.O140])/[.K140] -> -0.220473710205948 | Q140: of:=LN(1+[.P140]) -> -0.249068864569321 | R140: of:=[.D140]*[.$G$151]/[.G141] -> 34.9665668684645 | S140: of:=[.K140]/[.R139] -> 46.1810449574727 | T140: of:=AVERAGE([.R131:.R140]) -> 49.6065797843676 | U140: of:=[.K140]/[.T139] -> 30.1385123920956
A141: 2003 | B141: 895.84 | C141: 17.39 | D141: 48.74 | E141: 1.18 | F141: 4.05 | G141: 181.7 | H141: of:=(1+[.E141]/100)*[.G141]/[.G142] -> 0.992678509719223 | I141: of:=[$Consumption.G119] -> 28368.6869902899 | J141: of:=[.J140]+1 -> 2003 | K141: of:=[.B141]*[.$G$151]/[.G141] -> 1135.3551744634 | L141: of:=[.O141]+[.L142]/(1+[$Calculations.$E$3]) -> 703.557487879883 | M141: of:=[.O141]+[.M142]/([.H141]+[$Calculations.$E$3]-[$Calculations.$E$1]+1) -> 779.604021332013 | N141: of:=([.I141]/[.I142])^4*([.O141]+[.N142]) -> 795.697332318925 | O141: of:=[.C141]*[.$G$151]/[.G142] -> 21.6229438444924 | P141: of:=([.K142]-[.K141]+[.O141])/[.K141] -> 0.259352607078092 | Q141: of:=LN(1+[.P141]) -> 0.230597785014652 | R141: of:=[.D141]*[.$G$151]/[.G142] -> 60.6039265658747 | S141: of:=[.K141]/[.R140] -> 32.4697354113809 | T141: of:=AVERAGE([.R132:.R141]) -> 52.2190728513518 | U141: of:=[.K141]/[.T140] -> 22.8871891470571
A142: 2004 | B142: 1132.52 | C142: 19.44 | D142: 58.55 | E142: 1.49 | F142: 4.15 | G142: 185.2 | H142: of:=(1+[.E142]/100)*[.G142]/[.G143] -> 0.985629155742003 | I142: of:=[$Consumption.G120] -> 29087.2956352182 | J142: of:=[.J141]+1 -> 2004 | K142: of:=[.B142]*[.$G$151]/[.G142] -> 1408.18955507559 | L142: of:=[.O142]+[.L143]/(1+[$Calculations.$E$3]) -> 726.470513183007 | M142: of:=[.O142]+[.M143]/([.H142]+[$Calculations.$E$3]-[$Calculations.$E$1]+1) -> 781.302139874824 | N142: of:=([.I142]/[.I143])^4*([.O142]+[.N143]) -> 857.813259578955 | O142: of:=[.C142]*[.$G$151]/[.G143] -> 23.4747939171474 | P142: of:=([.K143]-[.K142]+[.O142])/[.K142] -> 0.0297532502936361 | Q142: of:=LN(1+[.P142]) -> 0.0293192107200755 | R142: of:=[.D142]*[.$G$151]/[.G143] -> 70.7021185107499 | S142: of:=[.K142]/[.R141] -> 23.2359458350431 | T142: of:=AVERAGE([.R133:.R142]) -> 54.6009493730854 | U142: of:=[.K142]/[.T141] -> 26.9669582047959
A143: 2005 | B143: 1181.41 | C143: 22.22 | D143: 69.93 | E143: 3.41 | F143: 4.22 | G143: 190.7 | H143: of:=(1+[.E143]/100)*[.G143]/[.G144] -> 0.994467322239032 | I143: of:=[$Consumption.G121] -> 29790.2957748382 | J143: of:=[.J142]+1 -> 2005 | K143: of:=[.B143]*[.$G$151]/[.G143] -> 1426.61297745149 | L143: of:=[.O143]+[.L144]/(1+[$Calculations.$E$3]) -> 748.907157450029 | M143: of:=[.O143]+[.M144]/([.H143]+[$Calculations.$E$3]-[$Calculations.$E$1]+1) -> 775.801485219285 | N143: of:=([.I143]/[.I144])^4*([.O143]+[.N144]) -> 920.322299859201 | O143: of:=[.C143]*[.$G$151]/[.G144] -> 25.8034372163389 | P143: of:=([.K144]-[.K143]+[.O143])/[.K143] -> 0.0589804477459628 | Q143: of:=LN(1+[.P143]) -> 0.0573066035082822 | R143: of:=[.D143]*[.$G$151]/[.G144] -> 81.2076671709531 | S143: of:=[.K143]/[.R142] -> 20.1777967549103 | T143: of:=AVERAGE([.R134:.R143]) -> 57.6567492508025 | U143: of:=[.K143]/[.T142] -> 26.1279885026087
A144: 2006 | B144: 1278.73 | C144: 24.88 | D144: 81.51 | E144: 5.32 | F144: 4.42 | G144: 198.3 | H144: of:=(1+[.E144]/100)*[.G144]/[.G145] -> 1.03178385107897 | I144: of:=[$Consumption.G122] -> 30364.4334381902 | J144: 2006 | K144: of:=[.B144]*[.$G$151]/[.G144] -> 1484.95181240545 | L144: of:=[.O144]+[.L145]/(1+[$Calculations.$E$3]) -> 770.328377286967 | M144: of:=[.O144]+[.M145]/([.H144]+[$Calculations.$E$3]-[$Calculations.$E$1]+1) -> 774.415099696883 | N144: of:=([.I144]/[.I145])^4*([.O144]+[.N145]) -> 967.544543534082 | O144: of:=[.C144]*[.$G$151]/[.G145] -> 28.3049087028693 | P144: of:=([.K145]-[.K144]+[.O144])/[.K144] -> 0.110144203743057 | Q144: of:=LN(1+[.P144]) -> 0.104489920168277 | R144: of:=[.D144]*[.$G$151]/[.G145] -> 92.7304304007588 | S144: of:=[.K144]/[.R143] -> 18.2858572858573 | T144: of:=AVERAGE([.R135:.R144]) -> 61.3240447107401 | U144: of:=[.K144]/[.T143] -> 25.7550387717146
A145: 2007 | B145: 1424.16 | C145: 27.73 | D145: 66.18 | E145: 5.34 | F145: 4.76 | G145: 202.416 | H145: of:=(1+[.E145]/100)*[.G145]/[.G146] -> 1.00968375035515 | I145: of:=[$Consumption.G123] -> 30867.6098721734 | J145: 2007 | K145: of:=[.B145]*[.$G$151]/[.G145] -> 1620.20573867678 | L145: of:=[.O145]+[.L146]/(1+[$Calculations.$E$3]) -> 790.483741777054 | M145: of:=[.O145]+[.M146]/([.H145]+[$Calculations.$E$3]-[$Calculations.$E$1]+1) -> 798.242911477764 | N145: of:=([.I145]/[.I146])^4*([.O145]+[.N146]) -> 1004.98514790704 | O145: of:=[.C145]*[.$G$151]/[.G146] -> 30.238016857657 | P145: of:=([.K146]-[.K145]+[.O145])/[.K145] -> -0.0533925505592295 | Q145: of:=LN(1+[.P145]) -> -0.0548707918591777 | R145: of:=[.D145]*[.$G$151]/[.G146] -> 72.1655952268207 | S145: of:=[.K145]/[.R144] -> 17.4722119985278 | T145: of:=AVERAGE([.R136:.R145]) -> 62.8805042334222 | U145: of:=[.K145]/[.T144] -> 26.4203991488028
A146: 2008 | B146: 1378.76 | C146: 28.39 | D146: 14.88 | E146: of:=(3.71+3.13)/2 -> 3.42 | F146: 3.74 | G146: 211.18 | H146: of:=(1+[.E146]/100)*[.G146]/[.G147] -> 1.03438122978266 | I146: of:=[$Consumption.G124] -> 30509.0812369265 | J146: 2008 | K146: of:=[.B146]*[.$G$151]/[.G146] -> 1503.46080500047 | L146: of:=[.O146]+[.L147]/(1+[$Calculations.$E$3]) -> 809.896062251275 | M146: of:=[.O146]+[.M147]/([.H146]+[$Calculations.$E$3]-[$Calculations.$E$1]+1) -> 804.694471251218 | N146: of:=([.I146]/[.I147])^4*([.O146]+[.N147]) -> 928.862555533498 | O146: of:=[.C146]*[.$G$151]/[.G147] -> 30.9631349369858 | P146: of:=([.K147]-[.K146]+[.O146])/[.K146] -> -0.351499422421661 | Q146: of:=LN(1+[.P146]) -> -0.433092384588658 | R146: of:=[.D146]*[.$G$151]/[.G147] -> 16.2286526193149 | S146: of:=[.K146]/[.R145] -> 20.8334844363856 | T146: of:=AVERAGE([.R137:.R146]) -> 59.2180019968753 | U146: of:=[.K146]/[.T145] -> 23.9098083472644
A147: 2009 | B147: 865.58 | C147: 22.41 | D147: 50.97 | E147: of:=(1.53+0.5)/2 -> 1.015 | F147: 2.52 | G147: 211.143 | H147: of:=(1+[.E147]/100)*[.G147]/[.G148] -> 0.984305018067535 | I147: of:=[$Consumption.G125] -> 29933.8546757902 | J147: 2009 | K147: of:=[.B147]*[.$G$151]/[.G147] -> 944.032065472216 | L147: of:=[.$B147]*[.$G$145]/[.$G147] -> 829.803693610492 | M147: of:=[.$B147]*[.$G$145]/[.$G147] -> 829.803693610492 | N147: of:=[.$B147]*[.$G$145]/[.$G147] -> 829.803693610492 | O147: of:=[.C147]*[.$G$151]/[.G148] -> 23.8158025169946 | P147: of:=([.K148]-[.K147]+[.O147])/[.K147] -> 0.290082386500757 | Q147: of:=LN(1+[.P147]) -> 0.254706081838729 | R147: of:=[.D147]*[.$G$151]/[.G148] -> 54.1674009054535 | S147: of:=[.K147]/[.R146] -> 58.1706989247312 | T147: of:=AVERAGE([.R138:.R147]) -> 58.0633039357619 | U147: of:=[.K147]/[.T146] -> 15.9416399344583
A148: 2010 | B148: 1123.58 | C148: 22.73 | D148: 77.35 | E148: of:=(0.29+0.62)/2 -> 0.455 | F148: 3.73 | G148: 216.687 | H148: of:=(1+[.E148]/100)*[.G148]/[.G149] -> 0.988420491274753 | J148: 2010 | K148: of:=[.B148]*[.$G$151]/[.G148] -> 1194.06333744064 | O148: of:=[.C148]*[.$G$151]/[.G149] -> 23.7680187809629 | P148: of:=([.K149]-[.K148]+[.O148])/[.K148] -> 0.143123507496115 | Q148: of:=LN(1+[.P148]) -> 0.13376443452725 | R148: of:=[.D148]*[.$G$151]/[.G149] -> 80.8823692348211 | S148: of:=[.K148]/[.R147] -> 22.043947420051 | T148: of:=AVERAGE([.R139:.R148]) -> 59.5758698141269 | U148: of:=[.K148]/[.T147] -> 20.5648534703035
A149: 2011 | B149: 1282.62 | C149: 26.43 | D149: 86.95 | E149: of:=(0.38+0.35)/2 -> 0.365 | F149: 3.39 | G149: 220.223 | H149: of:=(1+[.E149]/100)*[.G149]/[.G150] -> 0.975125466878433 | J149: 2011 | K149: of:=[.B149]*[.$G$151]/[.G149] -> 1341.1938516867 | O149: of:=[.C149]*[.$G$151]/[.G150] -> 26.8515227317848 | P149: of:=([.K150]-[.K149]+[.O149])/[.K149] -> 0.00520443926653524 | Q149: of:=LN(1+[.P149]) -> 0.00519094297931418 | R149: of:=[.D149]*[.$G$151]/[.G150] -> 88.3367348289326 | S149: of:=[.K149]/[.R148] -> 16.5820297349709 | T149: of:=AVERAGE([.R140:.R149]) -> 65.1991462332144 | U149: of:=[.K149]/[.T148] -> 22.5123671021698
A150: 2012 | B150: 1300.58 | C150: 31.25 | D150: 86.51 | F150: 1.97 | G150: 226.665 | H150: of:=(1+[.E150]/100)*[.G150]/[.G151] -> 0.984301719645649 | J150: 2012 | K150: of:=[.B150]*[.$G$151]/[.G150] -> 1321.32249090067 | O150: of:=[.C150]*[.$G$151]/[.G151] -> 31.25 | P150: of:=([.K151]-[.K150]+[.O150])/[.K150] -> 0.144043191885424 | Q150: of:=LN(1+[.P150]) -> 0.1345686473895 | S150: of:=[.K150]/[.R149] -> 14.9577918343876 | T150: of:=AVERAGE([.R141:.R150]) -> 68.5583217181866 | U150: of:=[.K150]/[.T149] -> 20.2659477499039
A151: 2013 | B151: 1480.4 | C151: 34.99 | D151: 100.2 | F151: 1.91 | G151: 230.28 | J151: 2013 | K151: of:=[.B151]*[.$G$151]/[.G151] -> 1480.4 | T151: of:=AVERAGE([.R142:.R151]) -> 69.5526211122256 | U151: of:=[.K151]/[.T150] -> 21.5932940436506
A152: 2014 | B152: 1822.36 | C152: 39.44 | D152: 102.31 | F152: 2.86 | G152: 233.916 | K152: of:=[.B152]*[.$G$151]/[.G152] -> 1794.03316062176
A153: 2015 | B153: 2028.18 | C153: 43.39 | F153: 1.88 | G153: 233.707 | K153: of:=[.B153]*[.$G$151]/[.G153] -> 1998.43945795376
A154: 2016 | B154: 1918.6
B157: Notes: The Federal Reserve Board discontinued its 6-month commercial paper rate series August 1997.
B158: After that, the 6-month Certificate of Deposit rate, secondary market, is used,
B159: The series R is the result of converting the January and July rates into an annual yield. RLONG is the 10-year Treasury after 1953
B160: Before 1953, it is government bond yields from Sidney Homer A History of Interest Rates.
B161: See Shiller, Market Volatility, 1989, Chapter 26, and Shiller Irrational Exuberance 3rd Edition, 2015 for description of data

Sheet: Consumption
A1: This page shows how consumption data in column I of Data were constructed
B2: NIPA Table 2.3.6 | C2: NIPA Table 2.4.3 | D2: NBER Kendrick | E2: Real Consumption | F2: Population | G2: Per Capita Real Consumption
B3: Personal Consumption Expenditures | C3: Real Personal Consumption Index | D3: Personal Consumption Expenditures | E3: Inferred from Columns B,C,D | F3: From NIPA Table 7.1 Line 18
B4: Billions of Chained 2005 Dollars | C4: 2000=100 | D4: Millions of 1929 Dollars | E4: Billions of 2005 Dollars | F4: Millions | G4: In 2005 Dollars
A5: 1889 | D5: 18004 | E5: of:=([.$E$45]/[.$D$45])*[.D5] -> 168.742745528986 | F5: 61.775 | G5: of:=1000*[.E5]/[.F5] -> 2731.57014211228
A6: of:=[.A5]+1 -> 1890 | D6: 17995 | E6: of:=([.$E$45]/[.$D$45])*[.D6] -> 168.65839290125 | F6: 63.056 | G6: of:=1000*[.E6]/[.F6] -> 2674.73980114898
A7: of:=[.A6]+1 -> 1891 | D7: 19247 | E7: of:=([.$E$45]/[.$D$45])*[.D7] -> 180.392780670762 | F7: 64.361 | G7: of:=1000*[.E7]/[.F7] -> 2802.82749911844
A8: of:=[.A7]+1 -> 1892 | D8: 20157 | E8: of:=([.$E$45]/[.$D$45])*[.D8] -> 188.921768586302 | F8: 65.666 | G8: of:=1000*[.E8]/[.F8] -> 2877.01045573511
A9: of:=[.A8]+1 -> 1893 | D9: 20256 | E9: of:=([.$E$45]/[.$D$45])*[.D9] -> 189.849647491399 | F9: 66.97 | G9: of:=1000*[.E9]/[.F9] -> 2834.84616233237
A10: of:=[.A9]+1 -> 1894 | D10: 19659 | E10: of:=([.$E$45]/[.$D$45])*[.D10] -> 184.254256518237 | F10: 68.275 | G10: of:=1000*[.E10]/[.F10] -> 2698.707528645
A11: of:=[.A10]+1 -> 1895 | D11: 22119 | E11: of:=([.$E$45]/[.$D$45])*[.D11] -> 207.310641432773 | F11: 69.58 | G11: of:=1000*[.E11]/[.F11] -> 2979.45733591223
A12: of:=[.A11]+1 -> 1896 | D12: 22056 | E12: of:=([.$E$45]/[.$D$45])*[.D12] -> 206.72017303862 | F12: 70.885 | G12: of:=1000*[.E12]/[.F12] -> 2916.27527740171
A13: of:=[.A12]+1 -> 1897 | D13: 23794 | E13: of:=([.$E$45]/[.$D$45])*[.D13] -> 223.009602705882 | F13: 72.189 | G13: of:=1000*[.E13]/[.F13] -> 3089.2463215432
A14: of:=[.A13]+1 -> 1898 | D14: 24193 | E14: of:=([.$E$45]/[.$D$45])*[.D14] -> 226.749235868849 | F14: 73.494 | G14: of:=1000*[.E14]/[.F14] -> 3085.27547648583
A15: of:=[.A14]+1 -> 1899 | D15: 27053 | E15: of:=([.$E$45]/[.$D$45])*[.D15] -> 253.554626460546 | F15: 74.799 | G15: of:=1000*[.E15]/[.F15] -> 3389.81305178606
A16: of:=[.A15]+1 -> 1900 | D16: 27296 | E16: of:=([.$E$45]/[.$D$45])*[.D16] -> 255.832147409421 | F16: 76.094 | G16: of:=1000*[.E16]/[.F16] -> 3362.0541357981
A17: of:=[.A16]+1 -> 1901 | D17: 30651 | E17: of:=([.$E$45]/[.$D$45])*[.D17] -> 287.276932526603 | F17: 77.584 | G17: of:=1000*[.E17]/[.F17] -> 3702.78578736083
A18: of:=[.A17]+1 -> 1902 | D18: 30911 | E18: of:=([.$E$45]/[.$D$45])*[.D18] -> 289.713786216757 | F18: 79.163 | G18: of:=1000*[.E18]/[.F18] -> 3659.71206519153
A19: of:=[.A18]+1 -> 1903 | D19: 32761 | E19: of:=([.$E$45]/[.$D$45])*[.D19] -> 307.052937473624 | F19: 80.632 | G19: of:=1000*[.E19]/[.F19] -> 3808.0779029867
A20: of:=[.A19]+1 -> 1904 | D20: 33188 | E20: of:=([.$E$45]/[.$D$45])*[.D20] -> 311.055001033992 | F20: 82.166 | G20: of:=1000*[.E20]/[.F20] -> 3785.68995733019
A21: of:=[.A20]+1 -> 1905 | D21: 35090 | E21: of:=([.$E$45]/[.$D$45])*[.D21] -> 328.88152302889 | F21: 83.822 | G21: of:=1000*[.E21]/[.F21] -> 3923.57045917408
A22: of:=[.A21]+1 -> 1906 | D22: 38965 | E22: of:=([.$E$45]/[.$D$45])*[.D22] -> 365.20001552638 | F22: 85.45 | G22: of:=1000*[.E22]/[.F22] -> 4273.8445351244
A23: of:=[.A22]+1 -> 1907 | D23: 39702 | E23: of:=([.$E$45]/[.$D$45])*[.D23] -> 372.107558486548 | F23: 87.008 | G23: of:=1000*[.E23]/[.F23] -> 4276.70511316831
A24: of:=[.A23]+1 -> 1908 | D24: 37197 | E24: of:=([.$E$45]/[.$D$45])*[.D24] -> 348.629410433332 | F24: 88.71 | G24: of:=1000*[.E24]/[.F24] -> 3929.98997219402
A25: of:=[.A24]+1 -> 1909 | D25: 41269 | E25: of:=([.$E$45]/[.$D$45])*[.D25] -> 386.794288226824 | F25: 90.49 | G25: of:=1000*[.E25]/[.F25] -> 4274.44234972731
A26: of:=[.A25]+1 -> 1910 | D26: 42034 | E26: of:=([.$E$45]/[.$D$45])*[.D26] -> 393.964261584393 | F26: 92.407 | G26: of:=1000*[.E26]/[.F26] -> 4263.35950289906
A27: of:=[.A26]+1 -> 1911 | D27: 44064 | E27: of:=([.$E$45]/[.$D$45])*[.D27] -> 412.990465395982 | F27: 93.863 | G27: of:=1000*[.E27]/[.F27] -> 4399.92825070562
A28: of:=[.A27]+1 -> 1912 | D28: 45211 | E28: of:=([.$E$45]/[.$D$45])*[.D28] -> 423.740739175239 | F28: 95.335 | G28: of:=1000*[.E28]/[.F28] -> 4444.75522290071
A29: of:=[.A28]+1 -> 1913 | D29: 46701 | E29: of:=([.$E$45]/[.$D$45])*[.D29] -> 437.705785322661 | F29: 97.225 | G29: of:=1000*[.E29]/[.F29] -> 4501.98802080392
A30: of:=[.A29]+1 -> 1914 | D30: 46124 | E30: of:=([.$E$45]/[.$D$45])*[.D30] -> 432.297844633357 | F30: 99.111 | G30: of:=1000*[.E30]/[.F30] -> 4361.75444333482
A31: of:=[.A30]+1 -> 1915 | D31: 45322 | E31: of:=([.$E$45]/[.$D$45])*[.D31] -> 424.781088250651 | F31: 100.546 | G31: of:=1000*[.E31]/[.F31] -> 4224.74378145974
A32: of:=[.A31]+1 -> 1916 | D32: 49408 | E32: of:=([.$E$45]/[.$D$45])*[.D32] -> 463.077181242844 | F32: 101.961 | G32: of:=1000*[.E32]/[.F32] -> 4541.70890088214
A33: of:=[.A32]+1 -> 1917 | D33: 48342 | E33: of:=([.$E$45]/[.$D$45])*[.D33] -> 453.086081113211 | F33: 103.268 | G33: of:=1000*[.E33]/[.F33] -> 4387.47802913982
A34: of:=[.A33]+1 -> 1918 | D34: 48121 | E34: of:=([.$E$45]/[.$D$45])*[.D34] -> 451.01475547658 | F34: 103.208 | G34: of:=1000*[.E34]/[.F34] -> 4369.95926165201
A35: of:=[.A34]+1 -> 1919 | D35: 50245 | E35: of:=([.$E$45]/[.$D$45])*[.D35] -> 470.921975622302 | F35: 104.514 | G35: of:=1000*[.E35]/[.F35] -> 4505.82673730124
A36: of:=[.A35]+1 -> 1920 | D36: 52713 | E36: of:=([.$E$45]/[.$D$45])*[.D36] -> 494.053340650381 | F36: 106.541 | G36: of:=1000*[.E36]/[.F36] -> 4637.2132854993
A37: of:=[.A36]+1 -> 1921 | D37: 56082 | E37: of:=([.$E$45]/[.$D$45])*[.D37] -> 525.629340966264 | F37: 108.538 | G37: of:=1000*[.E37]/[.F37] -> 4842.81395424887
A38: of:=[.A37]+1 -> 1922 | D38: 58149 | E38: of:=([.$E$45]/[.$D$45])*[.D38] -> 545.00232780299 | F38: 110.049 | G38: of:=1000*[.E38]/[.F38] -> 4952.36056486647
A39: of:=[.A38]+1 -> 1923 | D39: 63427 | E39: of:=([.$E$45]/[.$D$45])*[.D39] -> 594.47045771312 | F39: 111.947 | G39: of:=1000*[.E39]/[.F39] -> 5310.28484651773
A40: of:=[.A39]+1 -> 1924 | D40: 68127 | E40: of:=([.$E$45]/[.$D$45])*[.D40] -> 638.521274419754 | F40: 114.109 | G40: of:=1000*[.E40]/[.F40] -> 5595.71352320811
A41: of:=[.A40]+1 -> 1925 | D41: 66137 | E41: of:=([.$E$45]/[.$D$45])*[.D41] -> 619.869971175881 | F41: 115.829 | G41: of:=1000*[.E41]/[.F41] -> 5351.59563818976
A42: of:=[.A41]+1 -> 1926 | D42: 71548 | E42: of:=([.$E$45]/[.$D$45])*[.D42] -> 670.584645473668 | F42: 117.397 | G42: of:=1000*[.E42]/[.F42] -> 5712.11057755878
A43: of:=[.A42]+1 -> 1927 | D43: 73157 | E43: of:=([.$E$45]/[.$D$45])*[.D43] -> 685.665020810045 | F43: 119.035 | G43: of:=1000*[.E43]/[.F43] -> 5760.19675566048
A44: of:=[.A43]+1 -> 1928 | D44: 74813 | E44: of:=([.$E$45]/[.$D$45])*[.D44] -> 701.185904313489 | F44: 120.509 | G44: of:=1000*[.E44]/[.F44] -> 5818.53558085694
A45: 1929 | C45: 9.814 | D45: 78952 | E45: of:=([.$B$111]/[.$C$111])*[.C45] -> 739.978740557905 | F45: 121.878 | G45: of:=1000*[.E45]/[.F45] -> 6071.47098375347
A46: of:=[.A45]+1 -> 1930 | C46: 9.29 | E46: of:=([.$B$111]/[.$C$111])*[.C46] -> 700.468972873746 | F46: 123.188 | G46: of:=1000*[.E46]/[.F46] -> 5686.17862838706
A47: of:=[.A46]+1 -> 1931 | C47: 9.005 | E47: of:=([.$B$111]/[.$C$111])*[.C47] -> 678.979881671483 | F47: 124.149 | G47: of:=1000*[.E47]/[.F47] -> 5469.07249894468
A48: of:=[.A47]+1 -> 1932 | C48: 8.206 | E48: of:=([.$B$111]/[.$C$111])*[.C48] -> 618.735025985141 | F48: 124.949 | G48: of:=1000*[.E48]/[.F48] -> 4951.90058331912
A49: of:=[.A48]+1 -> 1933 | C49: 8.028 | E49: of:=([.$B$111]/[.$C$111])*[.C49] -> 605.313769023728 | F49: 125.69 | G49: of:=1000*[.E49]/[.F49] -> 4815.92623934862
A50: of:=[.A49]+1 -> 1934 | C50: 8.595 | E50: of:=([.$B$111]/[.$C$111])*[.C50] -> 648.065750468229 | F50: 126.485 | G50: of:=1000*[.E50]/[.F50] -> 5123.65695907205
A51: of:=[.A50]+1 -> 1935 | C51: 9.123 | E51: of:=([.$B$111]/[.$C$111])*[.C51] -> 687.87711943242 | F51: 127.362 | G51: of:=1000*[.E51]/[.F51] -> 5400.9604075974
A52: of:=[.A51]+1 -> 1936 | C52: 10.046 | E52: of:=([.$B$111]/[.$C$111])*[.C52] -> 757.471614799747 | F52: 128.181 | G52: of:=1000*[.E52]/[.F52] -> 5909.39074277582
A53: of:=[.A52]+1 -> 1937 | C53: 10.417 | E53: of:=([.$B$111]/[.$C$111])*[.C53] -> 785.445133522692 | F53: 128.961 | G53: of:=1000*[.E53]/[.F53] -> 6090.5632983824
A54: of:=[.A53]+1 -> 1938 | C54: 10.249 | E54: of:=([.$B$111]/[.$C$111])*[.C54] -> 772.777879761359 | F54: 129.969 | G54: of:=1000*[.E54]/[.F54] -> 5945.86308859311
A55: of:=[.A54]+1 -> 1939 | C55: 10.819 | E55: of:=([.$B$111]/[.$C$111])*[.C55] -> 815.756062165883 | F55: 131.028 | G55: of:=1000*[.E55]/[.F55] -> 6225.8148042089
A56: of:=[.A55]+1 -> 1940 | C56: 11.382 | E56: of:=([.$B$111]/[.$C$111])*[.C56] -> 858.206442330352 | F56: 132.122 | G56: of:=1000*[.E56]/[.F56] -> 6495.56048447913
A57: of:=[.A56]+1 -> 1941 | C57: 12.195 | E57: of:=([.$B$111]/[.$C$111])*[.C57] -> 919.506902496806 | F57: 133.402 | G57: of:=1000*[.E57]/[.F57] -> 6892.7520014453
A58: of:=[.A57]+1 -> 1942 | C58: 11.917 | E58: of:=([.$B$111]/[.$C$111])*[.C58] -> 898.545613534599 | F58: 134.86 | G58: of:=1000*[.E58]/[.F58] -> 6662.80300707845
A59: of:=[.A58]+1 -> 1943 | C59: 12.258 | E59: of:=([.$B$111]/[.$C$111])*[.C59] -> 924.257122657306 | F59: 136.739 | G59: of:=1000*[.E59]/[.F59] -> 6759.2795227207
A60: of:=[.A59]+1 -> 1944 | C60: 12.615 | E60: of:=([.$B$111]/[.$C$111])*[.C60] -> 951.17503690014 | F60: 138.397 | G60: of:=1000*[.E60]/[.F60] -> 6872.80097762336
A61: of:=[.A60]+1 -> 1945 | C61: 13.395 | E61: of:=([.$B$111]/[.$C$111])*[.C61] -> 1009.98728650633 | F61: 139.928 | G61: of:=1000*[.E61]/[.F61] -> 7217.9069700584
A62: of:=[.A61]+1 -> 1946 | C62: 15.03 | E62: of:=([.$B$111]/[.$C$111])*[.C62] -> 1133.26680971931 | F62: 141.389 | G62: of:=1000*[.E62]/[.F62] -> 8015.24029252142
A63: of:=[.A62]+1 -> 1947 | C63: 15.307 | E63: of:=([.$B$111]/[.$C$111])*[.C63] -> 1154.15269836151 | F63: 144.126 | G63: of:=1000*[.E63]/[.F63] -> 8007.9423446256
A64: of:=[.A63]+1 -> 1948 | C64: 15.646 | E64: of:=([.$B$111]/[.$C$111])*[.C64] -> 1179.7134068442 | F64: 146.631 | G64: of:=1000*[.E64]/[.F64] -> 8045.45701007427
A65: of:=[.A64]+1 -> 1949 | C65: 16.077 | E65: of:=([.$B$111]/[.$C$111])*[.C65] -> 1212.21094476762 | F65: 149.188 | G65: of:=1000*[.E65]/[.F65] -> 8125.39175247086
A66: of:=[.A65]+1 -> 1950 | C66: 17.105 | E66: of:=([.$B$111]/[.$C$111])*[.C66] -> 1289.72247373578 | F66: 151.684 | G66: of:=1000*[.E66]/[.F66] -> 8502.69292565981
A67: of:=[.A66]+1 -> 1951 | C67: 17.378 | E67: of:=([.$B$111]/[.$C$111])*[.C67] -> 1310.30676109795 | F67: 154.287 | G67: of:=1000*[.E67]/[.F67] -> 8492.65823496438
A68: of:=[.A67]+1 -> 1952 | C68: 17.928 | E68: of:=([.$B$111]/[.$C$111])*[.C68] -> 1351.77693710232 | F68: 156.954 | G68: of:=1000*[.E68]/[.F68] -> 8612.56761281851
A69: of:=[.A68]+1 -> 1953 | C69: 18.78 | E69: of:=([.$B$111]/[.$C$111])*[.C69] -> 1416.01800974908 | F69: 159.565 | G69: of:=1000*[.E69]/[.F69] -> 8874.23939929859
A70: of:=[.A69]+1 -> 1954 | C70: 19.162 | E70: of:=([.$B$111]/[.$C$111])*[.C70] -> 1444.82093199211 | F70: 162.391 | G70: of:=1000*[.E70]/[.F70] -> 8897.17368568524
A71: of:=[.A70]+1 -> 1955 | C71: 20.558 | E71: of:=([.$B$111]/[.$C$111])*[.C71] -> 1550.07977872319 | F71: 165.275 | G71: of:=1000*[.E71]/[.F71] -> 9378.79158204927
A72: of:=[.A71]+1 -> 1956 | C72: 21.151 | E72: of:=([.$B$111]/[.$C$111])*[.C72] -> 1594.7921684879 | F72: 168.221 | G72: of:=1000*[.E72]/[.F72] -> 9480.33936600009
A73: of:=[.A72]+1 -> 1957 | C73: 21.674 | E73: of:=([.$B$111]/[.$C$111])*[.C73] -> 1634.22653585205 | F73: 171.274 | G73: of:=1000*[.E73]/[.F73] -> 9541.59146077077
A74: of:=[.A73]+1 -> 1958 | C74: 21.846 | E74: of:=([.$B$111]/[.$C$111])*[.C74] -> 1647.19539089342 | F74: 174.141 | G74: of:=1000*[.E74]/[.F74] -> 9458.97514596458
A75: of:=[.A74]+1 -> 1959 | C75: 23.067 | E75: of:=([.$B$111]/[.$C$111])*[.C75] -> 1739.25918162311 | F75: 177.13 | G75: of:=1000*[.E75]/[.F75] -> 9819.11128336877
A76: of:=[.A75]+1 -> 1960 | C76: 23.702 | E76: of:=([.$B$111]/[.$C$111])*[.C76] -> 1787.13838482815 | F76: 180.76 | G76: of:=1000*[.E76]/[.F76] -> 9886.80230597561
A77: of:=[.A76]+1 -> 1961 | C77: 24.191 | E77: of:=([.$B$111]/[.$C$111])*[.C77] -> 1824.00914131203 | F77: 183.742 | G77: of:=1000*[.E77]/[.F77] -> 9927.01255734689
A78: of:=[.A77]+1 -> 1962 | C78: 25.389 | E78: of:=([.$B$111]/[.$C$111])*[.C78] -> 1914.33872468154 | F78: 186.59 | G78: of:=1000*[.E78]/[.F78] -> 10259.5997892789
A79: of:=[.A78]+1 -> 1963 | C79: 26.436 | E79: of:=([.$B$111]/[.$C$111])*[.C79] -> 1993.28285972985 | F79: 189.3 | G79: of:=1000*[.E79]/[.F79] -> 10529.7562584778
A80: of:=[.A79]+1 -> 1964 | C80: 28.02 | E80: of:=([.$B$111]/[.$C$111])*[.C80] -> 2112.71696662243 | F80: 191.927 | G80: of:=1000*[.E80]/[.F80] -> 11007.9195038865
A81: of:=[.A80]+1 -> 1965 | C81: 29.791 | E81: of:=([.$B$111]/[.$C$111])*[.C81] -> 2246.25093335649 | F81: 194.347 | G81: of:=1000*[.E81]/[.F81] -> 11557.9398362542
A82: of:=[.A81]+1 -> 1966 | C82: 31.484 | E82: of:=([.$B$111]/[.$C$111])*[.C82] -> 2373.90367512993 | F82: 196.599 | G82: of:=1000*[.E82]/[.F82] -> 12074.8512206569
A83: of:=[.A82]+1 -> 1967 | C83: 32.422 | E83: of:=([.$B$111]/[.$C$111])*[.C83] -> 2444.62917529737 | F83: 198.752 | G83: of:=1000*[.E83]/[.F83] -> 12299.8972352347
A84: of:=[.A83]+1 -> 1968 | C84: 34.284 | E84: of:=([.$B$111]/[.$C$111])*[.C84] -> 2585.02457115215 | F84: 200.745 | G84: of:=1000*[.E84]/[.F84] -> 12877.1554517032
A85: of:=[.A84]+1 -> 1969 | C85: 35.558 | E85: of:=([.$B$111]/[.$C$111])*[.C85] -> 2681.08457884227 | F85: 202.736 | G85: of:=1000*[.E85]/[.F85] -> 13224.5115758537
A86: of:=[.A85]+1 -> 1970 | C86: 36.381 | E86: of:=([.$B$111]/[.$C$111])*[.C86] -> 2743.1390422088 | F86: 205.089 | G86: of:=1000*[.E86]/[.F86] -> 13375.3591962943
A87: of:=[.A86]+1 -> 1971 | C87: 37.77 | E87: of:=([.$B$111]/[.$C$111])*[.C87] -> 2847.87008669982 | F87: 207.692 | G87: of:=1000*[.E87]/[.F87] -> 13711.9873981657
A88: of:=[.A87]+1 -> 1972 | C88: 40.082 | E88: of:=([.$B$111]/[.$C$111])*[.C88] -> 3022.19562655818 | F88: 209.924 | G88: of:=1000*[.E88]/[.F88] -> 14396.6179501066
A89: of:=[.A88]+1 -> 1973 | C89: 42.048 | E89: of:=([.$B$111]/[.$C$111])*[.C89] -> 3170.43265569378 | F89: 211.939 | G89: of:=1000*[.E89]/[.F89] -> 14959.1753084321
A90: of:=[.A89]+1 -> 1974 | C90: 41.729 | E90: of:=([.$B$111]/[.$C$111])*[.C90] -> 3146.37995361125 | F90: 213.898 | G90: of:=1000*[.E90]/[.F90] -> 14709.7212391479
A91: of:=[.A90]+1 -> 1975 | C91: 42.688 | E91: of:=([.$B$111]/[.$C$111])*[.C91] -> 3218.68886049886 | F91: 215.981 | G91: of:=1000*[.E91]/[.F91] -> 14902.6481982159
A92: of:=[.A91]+1 -> 1976 | C92: 45.041 | E92: of:=([.$B$111]/[.$C$111])*[.C92] -> 3396.10581347754 | F92: 218.086 | G92: of:=1000*[.E92]/[.F92] -> 15572.3238239848
A93: of:=[.A92]+1 -> 1977 | C93: 46.95 | E93: of:=([.$B$111]/[.$C$111])*[.C93] -> 3540.0450243727 | F93: 220.289 | G93: of:=1000*[.E93]/[.F93] -> 16070.003606048
A94: of:=[.A93]+1 -> 1978 | C94: 49.012 | E94: of:=([.$B$111]/[.$C$111])*[.C94] -> 3695.52048422907 | F94: 222.629 | G94: of:=1000*[.E94]/[.F94] -> 16599.4568732244
A95: of:=[.A94]+1 -> 1979 | C95: 50.204 | E95: of:=([.$B$111]/[.$C$111])*[.C95] -> 3785.39766567853 | F95: 225.106 | G95: of:=1000*[.E95]/[.F95] -> 16816.0673890457
A96: of:=[.A95]+1 -> 1980 | C96: 50.065 | E96: of:=([.$B$111]/[.$C$111])*[.C96] -> 3774.91702119742 | F96: 227.726 | G96: of:=1000*[.E96]/[.F96] -> 16576.5745729404
A97: of:=[.A96]+1 -> 1981 | C97: 50.779 | E97: of:=([.$B$111]/[.$C$111])*[.C97] -> 3828.75284968309 | F97: 230.008 | G97: of:=1000*[.E97]/[.F97] -> 16646.1725230561
A98: of:=[.A97]+1 -> 1982 | C98: 51.493 | E98: of:=([.$B$111]/[.$C$111])*[.C98] -> 3882.58867816876 | F98: 232.218 | G98: of:=1000*[.E98]/[.F98] -> 16719.585381705
A99: of:=[.A98]+1 -> 1983 | C99: 54.436 | E99: of:=([.$B$111]/[.$C$111])*[.C99] -> 4104.49181995212 | F99: 234.333 | G99: of:=1000*[.E99]/[.F99] -> 17515.6372339881
A100: of:=[.A99]+1 -> 1984 | C100: 57.325 | E100: of:=([.$B$111]/[.$C$111])*[.C100] -> 4322.32334445506 | F100: 236.394 | G100: of:=1000*[.E100]/[.F100] -> 18284.4037685181
A101: of:=[.A100]+1 -> 1985 | C101: 60.303 | E101: of:=([.$B$111]/[.$C$111])*[.C101] -> 4546.8654974387 | F101: 238.506 | G101: of:=1000*[.E101]/[.F101] -> 19063.9459696557
A102: of:=[.A101]+1 -> 1986 | C102: 62.749 | E102: of:=([.$B$111]/[.$C$111])*[.C102] -> 4731.29468017811 | F102: 240.683 | G102: of:=1000*[.E102]/[.F102] -> 19657.785054109 | I102: 6079 | J102: 6291.2 | K102: 6523.4 | L102: 6865.5 | M102: 7240.9 | N102: 7608.1 | O102: 7813.9 | P102: 8021.9 | Q102: 8247.6 | R102: 8532.7 | S102: 8819 | T102: 9073.5 | U102: 9313.9 | V102: 9290.9
A103: of:=[.A102]+1 -> 1987 | C103: 64.84 | E103: of:=([.$B$111]/[.$C$111])*[.C103] -> 4888.95674931471 | F103: 242.843 | G103: of:=1000*[.E103]/[.F103] -> 20132.1707824179
A104: of:=[.A103]+1 -> 1988 | C104: 67.468 | E104: of:=([.$B$111]/[.$C$111])*[.C104] -> 5087.10879029557 | F104: 245.061 | G104: of:=1000*[.E104]/[.F104] -> 20758.540895106
A105: of:=[.A104]+1 -> 1989 | C105: 69.369 | E105: of:=([.$B$111]/[.$C$111])*[.C105] -> 5230.44479863066 | F105: 247.387 | G105: of:=1000*[.E105]/[.F105] -> 21142.7633571314
A106: 1990 | C106: 70.782 | E106: of:=([.$B$111]/[.$C$111])*[.C106] -> 5336.98545080188 | F106: 250.181 | G106: of:=1000*[.E106]/[.F106] -> 21332.497075325
A107: 1991 | C107: 70.903 | E107: of:=([.$B$111]/[.$C$111])*[.C107] -> 5346.10888952284 | F107: 253.53 | G107: of:=1000*[.E107]/[.F107] -> 21086.6914744718
A108: 1992 | C108: 73.224 | E108: of:=([.$B$111]/[.$C$111])*[.C108] -> 5521.11303226127 | F108: 256.922 | G108: of:=1000*[.E108]/[.F108] -> 21489.4521771637
A109: 1993 | C109: 75.672 | E109: of:=([.$B$111]/[.$C$111])*[.C109] -> 5705.6930156407 | F109: 260.282 | G109: of:=1000*[.E109]/[.F109] -> 21921.1970694889
A110: 1994 | C110: 78.504 | E110: of:=([.$B$111]/[.$C$111])*[.C110] -> 5919.22672190318 | F110: 263.455 | G110: of:=1000*[.E110]/[.F110] -> 22467.6955149957
A111: 1995 | B111: 6079 | C111: 80.623 | E111: of:=[.B111] -> 6079 | F111: 266.588 | G111: of:=1000*[.E111]/[.F111] -> 22802.9768781791
A112: 1996 | B112: 6291.2 | C112: 83.382 | E112: of:=[.B112] -> 6291.2 | F112: 269.714 | G112: of:=1000*[.E112]/[.F112] -> 23325.448437975
A113: 1997 | B113: 6523.4 | C113: 86.533 | E113: of:=[.B113] -> 6523.4 | F113: 272.958 | G113: of:=1000*[.E113]/[.F113] -> 23898.9148513691
A114: 1998 | B114: 6865.5 | C114: 90.896 | E114: of:=[.B114] -> 6865.5 | F114: 276.154 | G114: of:=1000*[.E114]/[.F114] -> 24861.1282110706
A115: 1999 | B115: 7240.9 | C115: 95.537 | E115: of:=[.B115] -> 7240.9 | F115: 279.328 | G115: of:=1000*[.E115]/[.F115] -> 25922.5713140108
A116: 2000 | B116: 7608.1 | C116: 100 | E116: of:=[.B116] -> 7608.1 | F116: 282.413 | G116: of:=1000*[.E116]/[.F116] -> 26939.6238841696
A117: 2001 | B117: 7813.9 | C117: 102.537 | E117: of:=[.B117] -> 7813.9 | F117: 285.294 | G117: of:=1000*[.E117]/[.F117] -> 27388.9391294594
A118: 2002 | B118: 8021.9 | C118: 105.698 | E118: of:=[.B118] -> 8021.9 | F118: 288.055 | G118: of:=1000*[.E118]/[.F118] -> 27848.5011542935
A119: 2003 | B119: 8247.6 | C119: 109.143 | E119: of:=[.B119] -> 8247.6 | F119: 290.729 | G119: of:=1000*[.E119]/[.F119] -> 28368.6869902899
A120: 2004 | B120: 8532.7 | E120: of:=[.B120] -> 8532.7 | F120: 293.348 | G120: of:=1000*[.E120]/[.F120] -> 29087.2956352182
A121: 2005 | B121: 8819 | E121: of:=[.B121] -> 8819 | F121: 296.036 | G121: of:=1000*[.E121]/[.F121] -> 29790.2957748382
A122: 2006 | B122: 9073.5 | E122: of:=[.B122] -> 9073.5 | F122: 298.82 | G122: of:=1000*[.E122]/[.F122] -> 30364.4334381902
A123: 2007 | B123: 9313.9 | E123: of:=[.B123] -> 9313.9 | F123: 301.737 | G123: of:=1000*[.E123]/[.F123] -> 30867.6098721734
A124: 2008 | B124: 9290.9 | E124: of:=[.B124] -> 9290.9 | F124: 304.529 | G124: of:=1000*[.E124]/[.F124] -> 30509.0812369265
A125: 2009 | B125: 9186.7 | E125: of:=[.B125] -> 9186.7 | F125: 306.9 | G125: of:=1000*[.E125]/[.F125] -> 29933.8546757902
B126: 2009 value is 2nd quarter 2009 | F126: 2009 Pop is 2nd Quarter

Sheet: Calculations
A1: Average Real Interest Rate: | E1: of:=AVERAGE([$Data.H9:.H151]) -> 1.02721944418783
A2: Geometric Average Stock Return: | E2: of:=AVERAGE([$Data.Q9:.Q151]) -> 0.0632642179393342
A3: exp(geo. Avg. return) | E3: of:=EXP([.E2])-1 -> 0.0653082756067351
A4: Geometric Average Dividend Growth | E4: of:=EXP(LN([$Data.O150]/[$Data.O9])/141)-1 -> 0.0134786919876562